Code,title,Fully Specified Name,Description,Inclusions,Exclusions,Index Terms
5C50.12,Tyrosinaemia type 2,,"Tyrosinemia type 2 is an inborn error of tyrosine metabolism characterised by hypertyrosinemia with oculocutaneous manifestations (eye redness, photophobia, excessive tearing and pain, palmoplantar hyperkeratosis) and, in some cases, intellectual deficit.",,,Tyrosinaemia type 2; Hepatic tyrosine aminotransferase deficiency; Keratosis palmoplantaris - corneal dystrophy; Oculocutaneous tyrosinaemia; Richner-Hanhart syndrome; Tyrosine transaminase deficiency
5C50.2,Disorders of histidine metabolism,,,,,
5C50.20,Histidinaemia,,"Histidinemia is a disorder of histidine metabolism caused by a defect in histidase, and seems to be benign in most affected individuals.",,,Histidinaemia; Histidase deficiency; Histidine ammonia-lyase deficiency; Histidinuria
5C50.21,Urocanic aciduria,,This is an autosomal recessive metabolic disorder caused by a deficiency of the enzyme urocanase. It is a secondary disorder of histidine metabolism.,,,Urocanic aciduria; Encephalopathy due to urocanase deficiency; Urocanase deficiency; Urocanate hydratase deficiency
5C50.3,Disorders of tryptophan metabolism,,,,Hartnup disease,Disorders of tryptophan metabolism; Disturbance of tryptophan metabolism; Hypertryptophanaemia; Hypertryptophanemia; Tryptophanuria; Encephalopathy due to hydroxykynureninuria; Kynureninase deficiency; Xanthurenic aciduria; Pellagra-like skin rash - neurological manifestations
5C50.4,Disorders of lysine or hydroxylysine metabolism,,,,Refsum disease; Zellweger syndrome; Glutaryl-CoA dehydrogenase deficiency,Disorders of lysine or hydroxylysine metabolism; glutaric aciduria NOS; Hyperlysinaemia; Alpha-aminoadipic semialdehyde deficiency; Lysine alpha-ketoglutarate reductase deficiency; Hyperlysinaemia type 1; oxoglutarate reductase deficiency; Hyperlysinaemia type 2; Saccharopine dehydrogenase deficiency; Saccharopinuria; 2-aminoadipic aciduria; 2-aminoadipic acidaemia; 2-ketoadipic aciduria; 2-ketoadipic acidaemia; 2-oxoadipic acidaemia; 2-oxoadipic aciduria; Seizures - intellectual deficit due to hydroxylysinuria; Hydroxylysine metabolic disorder; Hydroxylysinemia; Lysine metabolic disorder; Pipecolic acidaemia; Lysine hyperaminoaciduria; Lysine intolerance
5C50.5,Disorders of the gamma-glutamyl cycle,,,,,Disorders of the gamma-glutamyl cycle; Oxoprolinuria; 5-oxoprolinase deficiency; Gamma-glutamyl transpeptidase deficiency; Glutathionuria; Cysteinylglycinase deficiency
5C50.6,Disorders of serine metabolism,,,,,Disorders of serine metabolism; 3-phosphoglycerate dehydrogenase deficiency; 3-phosphoserine phosphatase deficiency; Phosphoserine aminotransferase deficiency; Neurometabolic disorder due to serine deficiency
5C50.7,Disorders of glycine metabolism,,,,,
5C50.70,Glycine encephalopathy,,"Isolated nonketotic hyperglycinemia is an inborn disorder of glycine metabolism whose onset is generally neonatal with coma, severe hypotonia, myoclonic seizures, and microcephaly, usually progressing to severe intellectual deficit and tetrapyramidal syndrome.",,,Glycine encephalopathy; Glycine cleavage deficiency; NKH - [non-ketotic hyperglycinaemia]; Non-ketotic hyperglycinaemia; nonketotic hyperglycinaemia; Neonatal glycine encephalopathy; neonatal NKH - [non-ketotic hyperglycinaemia]; neonatal non-ketotic hyperglycinaemia; neonatal nonketotic hyperglycinaemia; Infantile glycine encephalopathy; infantile NKH - [non-ketotic hyperglycinaemia]; infantile non-ketotic hyperglycinaemia; infantile nonketotic hyperglycinaemia; Atypical glycine encephalopathy
5C50.71,Sarcosinaemia,,"Sarcosinaemia is a metabolic disorder characterised by an increased concentration of sarcosine in plasma and urine due to sarcosine dehydrogenase deficiency. Prevalence has been estimated at 1:28,000 to 1:350,000 in newborn screening programs. Sarcosinaemia is most probably a benign condition without significant clinical problems. It is transmitted in an autosomal recessive manner. Mutations in the gene for sarcosine dehydrogenase, located on chromosome 9q34, have been associated with this deficiency.",,,Sarcosinaemia; Hypersarcosinaemia; Sarcosin dehydrogenase complex deficiency; Sarcosine dehydrogenase deficiency
5C50.8,Disorders of proline or hydroxyproline metabolism,,,,,Disorders of proline or hydroxyproline metabolism; Hyperhydroxyprolinaemia; Hydroxyprolinaemia; Hyperprolinaemia type 1; Proline dehydrogenase deficiency; Proline oxydase deficiency; Hyperprolinaemia type 2; Delta1-pyrroline-5-carboxylate dehydrogenase deficiency; Pyrroline-5-carboxylase reductase deficiency; Progressive neurodegeneration - joint laxity - cataract; Delta-1-pyrroline 5-carboxylate synthetase deficiency; Hyperammonaemia - hypoornithinaemia - hypocitrullinaemia - hypoargininaemia - hypoprolinaemia; Hypoprolinaemia; Paradoxical fasting hyperammonaemia
5C50.9,Disorders of ornithine metabolism,,,,,Disorders of ornithine metabolism; Hyperornithinaemia; Generalised gyrate choroid atrophy; HOGA - [hyperornithinaemia - gyrate atrophy of choroid and retina]; OAT - [ornithine oxo-acid aminotransferase] deficiency; OKT - [ornithine ketoacid transaminase] deficiency; Ornithinaemia; Ornithine aminotransferase deficiency; Ornithine keto-acid transaminase deficiency; Ornithine oxo-acid aminotransferase deficiency; ornithine-oxo-acid amino acid transferase deficiency; Ornithinaemia Type 1; Ornithinaemia Type 2; Deficiency of citrulline phosphorylase; Ornithine hyperaminoaciduria; Ornithine-delta-aminotransferase deficiency
5C50.A,Disorders of urea cycle metabolism,,,,Lysinuric protein intolerance; Disorders of ornithine metabolism,
5C50.A0,Argininosuccinic aciduria,,"Argininosuccinic aciduria is an autosomal recessive inherited deficiency of argininosuccinate lyase, an enzyme involved in the urea cycle that leads to severe hyperammonemic coma in neonates or, in childhood, to hypotonia, growth failure, anorexia and chronic vomiting or behavioural disorders. Onset can also occur later with hyperammonemic coma or behavioural disorders that simulate psychiatric disorders.",,,Argininosuccinic aciduria; Argininosuccinase deficiency; Argininosuccinate lyase deficiency; argininosuccinic acidaemia; metabolic disorder of arginosuccinic acid
5C50.A1,Carbamoylphosphate synthetase deficiency,,Carbamyl phosphate synthetase deficiency is an urea cycle disorder strictly limited to the liver and intestine that results in congenital hyperammonemia and defective citrulline synthesis.,,,Carbamoylphosphate synthetase deficiency; Carbamylphosphate synthetase deficiency
5C50.A2,Argininaemia,,"Arginase deficiency is a rare autosomal recessive amino acid metabolism disorder characterised clinically by variable degrees of hyperammonemia, developing from about 3 years of age, and leading to progressive loss of developmental milestones and spasticity in the absence of treatment.",,,Argininaemia; Arginase deficiency; Hyperargininaemia; metabolic disorder of arginine; Arginine hyperaminoaciduria
5C50.A3,Citrullinaemia,,,,,Citrullinaemia; ASA synthase deficiency; Argininosuccinate synthetase deficiency; Citrullinuria; deficiency of citrulline-aspartate ligase; metabolic disorder of citrulline; Citrullinaemia type 1; Argininosuccinate synthase deficiency; CTLN1 - [Citrullinaemia type 1]; Citrullinaemia type 3; Citrullinuria type 1; Citrullinuria type 3; Classic citrullinaemia; Acute neonatal citrullinaemia type 1; Adult-onset citrullinaemia type 1; Citrin deficiency; Aspartate-glutamate carrier deficiency; Citrullinaemia type 2; Adult-onset citrin deficiency; CTLN2 - [Citrullinaemia type 2]; Citrullinuria type 2; N-acetylglutamate synthase deficiency; NAGS - [N-acetylglutamate synthase deficiency]; Neonatal intrahepatic cholestasis caused by citrin deficiency; NICCD - [Neonatal intrahepatic cholestasis caused by citrin deficiency]
5C50.B,Disorders of methionine cycle or sulphur amino acid metabolism,,,,,"Disorders of methionine cycle or sulphur amino acid metabolism; Disorders of sulphur-bearing amino-acid metabolism; disorder of sulphur-bearing amino acid including those due to folate and b12 disturbance; disorder of sulphur-bearing amino acid metabolism; disorder of transsulfuration; disorder of transsulphuration; disturbances of sulphur-bearing amino-acid metabolism; sulphuraminoacidaemia; Brain demyelination due to methionine adenosyltransferase deficiency; Isolated persistent hypermethioninaemia; MAT I/III - [Methionine adenosyltransferase I/III] deficiency; Methionine adenosyltransferase I/III deficiency; Glycine N-methyltransferase deficiency; GNMT - [Glycine N-methyltransferase] deficiency; Psychomotor retardation and myopathy due to S-adenosylhomocysteine hydrolase deficiency; Hypermethioninaemia due to S-adenosylhomocysteine hydrolase deficiency; Cystathioninuria; CTH - [cystathioninuria]; Cystathione gamma-lyase deficiency; Gamma-cystathionase deficiency; cystathionine metabolic disorder; Classical homocystinuria; CBS - [Cystathionine beta-synthase] deficiency; Cystathionine beta-synthase deficiency; Homocystinuria due to cystathionine beta-synthase deficiency; cystathionine synthase deficiency; homocystine metabolic disorder; Homocystinuria without methylmalonic aciduria; 5-methyltetrahydrofolate-homocysteine s-methyltransferase deficiency; Methionine synthase deficiency; Methylcobalamin deficiency; N5-methylhomocysteine transferase deficiency; Methylcobalamin deficiency type cbl E; Homocystinuria - megaloblastic anaemia due to defect in cobalamin metabolism, cbI E complementation type; Homocystinuria due to defect in methylation type cbl E; Methylcobalamin deficiency type cbl G; Homocystinuria - megaloblastic anaemia due to defect in cobalamin metabolism, cbI G complementation type; Homocystinuria due to methionine synthase deficiency type Cbl G; Methylcobalamin deficiency type cbl Dv1; Encephalopathy due to sulfite oxidase deficiency; Isolated sulfite oxidase deficiency; ISOD - [Isolated sulfite oxidase deficiency]; Sulfite oxidase deficiency due to molybdenum cofactor deficiency; Combined deficiency of sulfite oxidase, xanthine dehydrogenase and aldehyde oxidase; Molybdenum cofactor deficiency, complementation group A; Molybdenum cofactor deficiency due to defects in MOCS1 gene; Molybdenum cofactor deficiency, complementation group B; Molybdenum cofactor deficiency due to defects in MOCS2 gene; Molybdenum cofactor deficiency, complementation group C; Hypermethioninaemia due to adenosine kinase deficiency; Other genetic defects of methionine cycle or sulfur amino acid metabolism; Secondary non-genetic disorders of methionine cycle or sulfur amino acid metabolism; Beery-baby syndrome; Cystathioninemia; Deficiency of cystathionase; Deficiency of cysteine desulfhydrase; deficiency of cysteine desulphydrase; deficiency of cystine desulfhydrase; deficiency of cystine desulphydrase; Deficiency of homoserine deaminase; Deficiency of methionine adenosyltransferase; Familial methionine malabsorption; Hepatic methionine adenosyltransferase deficiency; Homocystinaemia; Hypermethioninaemia; methionine metabolic disorder; Methionine malabsorption syndrome; Smith-Strang disease; oast-house disease; oast-house urine disease; oasthouse disease; oasthouse urine disease; Sulfite oxidase deficiency; sulfite oxidase deficiency syndrome; sulfocysteinuria; sulphite oxidase deficiency; sulphocysteinuria"
5C50.C,Disorders of beta or omega amino acid metabolism,,,,4-hydroxybutyric aciduria,Disorders of beta or omega amino acid metabolism
5C50.D,Disorders of branched-chain amino acid metabolism,,,,Methylmalonic acidaemia; Propionic acidaemia; Isovaleric acidaemia; 3-methylglutaconic aciduria; Developmental delay due to 2-methylbutyryl-CoA dehydrogenase deficiency; 3-hydroxyisobutyric aciduria,
5C50.D0,Maple-syrup-urine disease,,"Maple syrup urine disease (MSUD) is a disorder of branched-chain amino acids metabolism. Four forms are described. The early onset classic form manifests after birth by lethargy, poor feeding and neurological signs of intoxication. Clinical course without treatment is characterised by deepening coma with maple syrup odour of urine. Subacute MSUD manifests later with encephalopathy, mental disability, major hypotonia, opisthotonus and cerebral atrophy with severe outcome. The intermittent form of MSUD may manifest at any age and presents with repeated ketoacidotic coma. Thiamine-responsive MSUD is a very rare form characterised by improvement of the biochemical profile with thiamine therapy.",,,Maple-syrup-urine disease; BCKD - [branched-chain alpha-ketoacid dehydrogenase deficiency]; Branched chain ketoaciduria; Ketoacid decarboxylase deficiency; Ketoaminoacidaemia; MSUD - [Maple-syrup-urine disease]; Oxoacid decarboxylase deficiency; branched chain ketoacid dehydrogenase deficiency; branched-chain alpha-keto acid dehydrogenase deficiency; ketoacidaemia; maple-syrup-urine disorder; maple-syrup-urine syndrome; Classical maple-syrup-urine disease; Severe branched chain ketoacid dehydrogenase deficiency; Severe branched chain ketoaciduria; Intermediate maple-syrup-urine disease; Intermediate branched chain ketoaciduria; Partial branched-chain ketoacid dehydrogenase deficiency; Intermittent maple-syrup-urine disease; Intermittent branched chain ketoaciduria; Thiamine-responsive maple-syrup-urine disease
5C50.E,Organic aciduria,,"An inborn error of metabolism disrupting normal amino acid metabolism, particularly branched-chain amino acids, causing a buildup of acids, which are usually not present",,,
5C50.E0,Classical organic aciduria,,"This a term used to classify a group of metabolic disorders which disrupt normal amino acid metabolism, particularly branched-chain amino acids, causing a buildup of acids which are usually not present.",,,"Classical organic aciduria; Methylmalonic aciduria - homocystinuria; Methylmalonic acidaemia - homocystinuria; Methylmalonic aciduria - homocystinuria type cbl C; Methylmalonic acidaemia - homocystinuria type cbl C; Methylmalonic aciduria - homocystinuria type cbl D; Methylmalonic acidaemia - homocystinuria type cbl D; Methylmalonic aciduria - homocystinuria type cbl F; Methylmalonic acidaemia - homocystinuria type cbl F; Methylmalonic aciduria; Methylmalonic acidaemia; Methylmalonic aciduria, vitamin B12 unresponsive; Complete deficiency of methylmalonyl-CoA mutase; Mutase0 methylmalonic acidaemia; Mutase0 methylmalonic aciduria; Partial deficiency of methylmalonyl-CoA mutase; Mutase methylmalonic acidaemia; Mutase methylmalonic aciduria; Methylmalonyl-CoA epimerase deficiency; Methylmalonyl-CoA racemase deficiency; Methylmalonyl-CoA epimerase deficiency with sepiapterin reductase deficiency; Methylmalonyl-CoA racemase deficiency with sepiapterin reductase deficiency; Methylmalonic aciduria, vitamin B12 responsive; Adenosylcobalamin deficiency; Vitamin B12 responsive methylmalonic aciduria type cbl A; Vitamin B12 responsive methylmalonic aciduria type cbl B; Vitamin B12 responsive methylmalonic aciduria type cbl mut-; Propionic aciduria; Hyperglycinaemia with ketosis and leucopaenia; Ketotic glycinaemia; Ketotic hyperglycinaemia; Propionic acidaemia; Propionyl-CoA carboxylase deficiency; Isovaleric aciduria; Isovaleric acid CoA dehydrogenase deficiency; Isovaleric acidaemia; Multiple carboxylase deficiency; Multiple carboxylase deficiency due to biotinidase deficiency; Multiple carboxylase deficiency due to holocarboxylase synthetase deficiency; Neurodegeneration due to 3-hydroxyisobutyryl-CoA hydrolase deficiency; Beta-hydroxyisobutyryl-CoA deacylase deficiency; Methacrylic aciduria; 3-hydroxyisobutyric aciduria; 3-hydroxyisobutyrate dehydrogenase deficiency; 3-hydroxy-3-methylglutaric aciduria; 3-methylcrotonylglycinuria; 3-methylcrotonyl-CoA carboxylase deficiency; MCC - [methylcrotonyl-CoA carboxylase] deficiency; MCCD - [methylcrotonyl-CoA carboxylase deficiency]; methylcrotonyl-CoA carboxylase deficiency; 3-methylglutaconic aciduria; MGA - [3-methylglutaconic aciduria]; 3-methylglutaconic aciduria type 1; 3-methylglutaconyl-CoA hydratase deficiency; 3MG-CoA hydratase deficiency; MGA1- [3-methylglutaconic aciduria type 1]; Barth syndrome; 3-methylglutaconic aciduria type 2; Cardioskeletal myopathy-neutropaenia; MGA2 - [3-methylglutaconic aciduria type 2]; Tafazzin gene defect; 3-methylglutaconic aciduria type 3; Autosomal recessive optic atrophy type 3; Costeff optic atrophy syndrome; Costeff syndrome; Infantile optic atrophy with chorea and spastic paraplegia; MGA3 - [3-methylglutaconic aciduria type 3]; Optic atrophy plus syndrome; 3-methylglutaconic aciduria type 4; MGA4 - [3-methylglutaconic aciduria type 4]; 3-methylglutaconic aciduria type 5; 3-methylglutaconic aciduria with normal3 -methylglutaconyl-Co A hydratase; DCMA - [Dilated cardiomyopathy with ataxia] syndrome; Dilated cardiomyopathy with ataxia; 2-methylbutyric aciduria; 2-methylbutyryl glycinuria; Developmental delay due to 2-methylbutyryl-CoA dehydrogenase deficiency; SBCAD - [Short/branched-chain acyl-coA dehydrogenase] deficiency; Short/branched-chain acyl-coA dehydrogenase deficiency; Isobutyric aciduria; Isobutyric acidaemia; Isobutyryl-CoA dehydrogenase deficiency; Methylmalonate semialdehyde dehydrogenase deficiency; Glutaric aciduria type 3; Glutaric acidaemia type 3; Glutaryl-CoA oxidase deficiency"
5C50.E1,Cerebral organic aciduria,,"This is a term used to classify a group of metabolic disorders which disrupt normal amino acid metabolism, particularly branched-chain amino acids, causing a buildup of acids which are usually not present.",,,Cerebral organic aciduria; Glutaric aciduria type 1; Glutaric acidaemia type 1; Glutaryl-CoA dehydrogenase deficiency; 2-hydroxyglutaric aciduria; L-2-hydroxyglutaric aciduria; D-2-hydroxyglutaric aciduria; D-2-hydroxyglutarate dehydrogenase deficiency; Mitochondrial isocitrate dehydrogenase deficiency; Aminoacylase deficiency; Neurological conditions associated with aminoacylase 1 deficiency; Canavan disease; Aspartoacylase deficiency; Canavan-van Bogaert-Bertrand disease; Spongy degeneration of central nervous system; Malonic aciduria; Malonyl-CoA decarboxylase deficiency; Ethylmalonic encephalopathy; 4-hydroxybutyric aciduria; Gamma-hydroxybutyric acidaemia; Succinic semialdehyde dehydrogenase deficiency
5C50.F,Disorders of peptide metabolism,,A condition which refers to inborn errors in peptide metabolism.,,Disorders of gamma aminobutyric acid metabolism,
5C50.F0,Prolidase deficiency,,"Prolidase deficiency is a very rare inborn error of metabolism characterised by mild to severe skin lesions particularly on the face, palms, lower legs and soles, together with other variable features.",,,Prolidase deficiency; Hyperimidodipeptiduria; Imidodipeptiduria; Proline dipeptidase deficiency
5C50.F1,Carnosinaemia,,"Carnosinaemia is a very rare inherited disorder of the metabolism of peptides that presents with serum carnosinase deficiency, variable degrees of intellectual deficit, sometimes with seizures, while a few patients are asymptomatic.",,,Carnosinaemia; Aminoacyl-histidine dipeptidase deficiency; Carnosinase deficiency; Carnosinuria
5C50.F2,Homocarnosinosis,,"Homocarnosinosis is a metabolic defect characterised by progressive spastic diplegia, intellectual deficit and retinitis pigmentosa. This extremely rare disorder has been reported in only one family, namely a woman and three of her children. The latter showed but their mother was symptom free. It is therefore uncertain whether there is a relationship between the biochemical defect and the clinical symptoms. Inheritance in the reported family seems to be autosomal dominant.",,,Homocarnosinosis; Homocarnosinase deficiency; Serum carnosinase deficiency
5C50.G,Trimethylaminuria,,Trimethylaminuria is a metabolic disorder characterised by a body malodour similar to that of decaying fish.,Fish odour syndrome,,Trimethylaminuria; Fish odour syndrome
5C51,Inborn errors of carbohydrate metabolism,,,,Increased secretion of glucagon; Diabetes mellitus; hypoglycaemia NOS; Mucopolysaccharidosis,
5C51.0,Disorders of the pentose phosphate pathway,,,,,Disorders of the pentose phosphate pathway; Essential pentosuria; L-xylulose reductase deficiency; L-xylulosuria; Xylitol dehydrogenase deficiency; Ribose-5-phosphate isomerase deficiency; Transaldolase deficiency
5C51.1,Disorders of glycerol metabolism,,,,,Disorders of glycerol metabolism; Glycerol kinase deficiency; Hyperglycerolaemia; Isolated glycerol kinase deficiency; Glycerol kinase deficiency - contiguous gene syndrome; Glycerol intolerance
5C51.2,Disorders of glyoxylate metabolism,,"Primary hyperoxaluria, or oxalosis, is a rare metabolic disorder transmitted as an autosomal recessive disease, including both type 1, the most frequent, and type 2, extremely rare. Hyperoxaluria type 1 is due to a defect of the peroxysomal hepatic enzyme L-alanine: glyoxylate aminotransferase (AGT). Hyperoxaluria type 2 is extremely rare and is due to glycerate dehydrogenase deficiency.",,,
5C51.20,Primary hyperoxaluria type 1,,"Primary hyperoxaluria type 1 is a rare metabolic disorder due to a defect of the peroxysomal hepatic enzyme L-alanine: glyoxylate aminotransferase (AGT). The infantile form is characterised by chronic renal failure due to massive oxalate deposition. In other patients, urolithiasis develops with infections, haematuria, renal colic or acute renal failure due to complete obstruction. End-stage renal failure occurs before 15 years of age in half the cases and the resulting increase of circulating oxalate leads to its deposition in tissues causing cardiac conduction defects, hypertension, distal gangrene, and reduced joint mobility and pain.",,,Primary hyperoxaluria type 1; 2-oxoglutarate glyoxylate carboligase deficiency; Alanine-glyoxylate aminotransferase deficiency; Oxalosis type 1
