Code,title,Fully Specified Name,Description,Inclusions,Exclusions,Index Terms
3A72.1,Acquired sideroblastic anaemias,,"A disease caused by determinants arising after birth such as myelodysplastic syndromes, antimicrobials, pyridoxine deficiency, lead poisoning, or copper deficiency. Zinc can indirectly cause sideroblastic anaemia by decreasing absorption and increasing excretion of copper. This disease is characterised by the inability to incorporate haemoglobin, which red blood cells need to transport oxygen efficiently. This disease may present with pallor, fatigue, dizziness, and enlarged spleen and liver, heart disease, liver damage, or kidney failure.",,,"Acquired sideroblastic anaemias; Secondary sideroblastic anaemia due to drugs or toxins; Secondary sideroblastic anaemia due to another disease; Pyridoxine-responsive sideroblastic anaemia, not elsewhere classified; hypochromic pyridoxine-responsive anaemia; vitamin b6-responsive anemia; vitamin b6-responsive sideroblastic anaemia"
3A73,Congenital dyserythropoietic anaemia,,"Congenital dyserythropoietic anaemias (CDA) result from diverse erythropoietic disorders; they lead to the defective production of red blood cells (RBC) and often mild haemolysis that attests to a qualitative defect of these RBC released into the circulation. Three forms of CDA have been characterised: types I, II and III. The shared symptoms include anaemia of variable severity, intermittent jaundice, splenomegaly and hepatomegaly.",,Blackfan-Diamond syndrome; Di Guglielmo disease,Congenital dyserythropoietic anaemia; CDA - [congenital dyserythropoietic anaemia]; congenital dyshaematopoietic anaemia; dyserythropoietic anaemia; dyserythropoietic dyshaematopoietic congenital anaemia; dyshaematopoietic anaemia; Congenital dyserythropoietic anaemia type I; CDA type 1 -[Congenital dyserythropoietic anaemia type 1]; Congenital dyserythropoietic anaemia type II; CDA type 2 - [Congenital dyserythropoietic anaemia type 2]; Congenital dyserythropoietic anaemia type III; CDA type 3 - [Congenital dyserythropoietic anaemia type 3]; Dyserythropoietic anaemia with thrombocytopenia; X-linked dyserythropoietic anaemia and thrombocytopenia
3A80,Congenital polycythaemia,,"A disease caused by determinants occurring in the antenatal period leading to changes in the concentration of red blood cells. This disease is characterised by having a high concentration of red blood cells in the body leading to slow flow of blood. This disease may present with headaches, blurred vision, red skin, tiredness, high blood pressure, dizziness, periods of confusion, bleeding problems, gout or itchy skin. Confirmation is by identification of increased levels of red blood cells in a blood sample.",,,
3A80.0,Primary inherited erythrocytosis,,A disease caused by genetically inherited factors leading to changes in the concentration of red blood cells. This disease is characterised by having a high concentration of red blood cells in the body leading to slow flow of blood. Confirmation is by identification of mutations by genetic testing.,,,Primary inherited erythrocytosis; Primary familial polycythaemia; Primary inherited polycythaemia; Polycythaemia due to HIF2A mutation; Polycythaemia due to PHD2 mutation; Polycythaemia due to VHL mutation; Chuvash erythrocytosis; Chuvash polycythaemia; Von Hippel-Lindau-dependent polycythaemia; Primary familial polycythaemia due to EPOR mutation; Primary familial polycythaemia due to other mutations
3A81,Acquired polycythaemia,,"Secondary polycythaemia is acquired and caused by either natural or artificial increases in the production of erythropoietin, hence an increased production of erythrocytes.",,,
3A81.0,"Polycythaemia due to hypoxia, including high altitude",,,,,"Polycythaemia due to hypoxia, including high altitude; Polycythaemia due to high altitude"
3A81.1,Polycythaemia due to over-transfusion or blood doping,,,,,Polycythaemia due to over-transfusion or blood doping
3A81.2,Relative polycythaemia,,"A disease caused by loss of body fluids leading to apparent increased levels of red blood cells in the blood. This disease may present with headache, vertigo, abnormally enlarged spleen or liver, high blood pressure, or formation of blood clots. Confirmation is by identification of relative blood cell counts in a blood sample.",,,Relative polycythaemia; Relative (pseudo)polycythaemia; Relative polycythaemia due to acute loss of plasma volume; Relative polycythaemia due to chronic loss of plasma volume; Polycythaemia due to inappropriate erythropoietin production; Polycythaemia due to erythropoietin; Polycythaemia due to fall in plasma volume; Secondary polycythaemia with excess erythropoietin
3A90,Anaemia due to acute disease,,,,Acute posthaemorrhagic anaemia,Anaemia due to acute disease
3A91,Congenital methaemoglobinaemia,,"A disease caused by determinants in the antenatal period leading to lack of the enzyme cytochrome b5 reductase. This disease is characterised by elevated levels of methemoglobin within the blood leading to haemoglobin ineffectively releasing oxygen to body tissues. This disease may present with shortness of breath, cyanosis, headache, fatigue, exercise intolerance, dizziness and loss of consciousness. Confirmation is by identification of mutation by genetic testing.",,,Congenital methaemoglobinaemia
3A92,Hereditary methaemoglobinaemia,,"Hereditary methemoglobinemia (HM) is a rare red cell disorder classified principally into two clinical phenotypes: autosomal recessive congenital (or hereditary) methemoglobinemia types I and II (RCM/RHM type 1; RCM/RHM type 2). In RCM type 1, well-tolerated cyanosis from birth is the only symptom. RCM type 2, with global loss of Cb5R function, is much more severe; the cyanosis is accompanied by neurological dysfunction (with intellectual deficit, microcephaly, growth retardation, opisthotonus, strabismus and hypertonia), which usually becomes evident during the first four months of life.",,,"Hereditary methaemoglobinaemia; Congenital NADH - [nicotinamide adenine dinucleotide] methaemoglobin reductase deficiency; DPNH - [diphosphopyridine nucleotide] methaemoglobin reductase deficiency; Haemoglobin-M disease; Hb M - [haemoglobin-m disease]; Hb M methaemoglobinaemia; Hereditary congenital methaemoglobinaemia; NADH - [nicotinamide adenine dinucleotide] diaphorase or reductase deficiency; Recessive hereditary methaemoglobinaemia; chronic familial methaemoglobin reductase deficiency; congenital DPNH-methaemoglobin-reductase deficiency; congenital infantile lactic acidosis due to lad deficiency; cytochrome b5 reductase deficiency; cytochrome b<sub>5</sub> reductase deficiency; cytochrome b>5< reductase deficiency; cytochrome-b reductase deficiency; deficiency of NADH - [nicotinamide adenine dinucleotide] cytochrome b5 reductase; deficiency of lipoamide reductase (NADH); enzymatic methaemoglobinaemia; haemoglobin M disease; hereditary Methemoglobinemia; hereditary m haemoglobinopathy; hereditary methaemoglobinemia due to globin chain mutation; maple syrup urine disease with lactic acidosis; maple syrup urine disease, type 3; Recessive hereditary methaemoglobinaemia type 1; NADH - [nicotinamide adenine dinucleotide] cytochrome b5 reductase deficiency type 1; NADH - [nicotinamide adenine dinucleotide] diaphorase deficiency type 1; Partial NADH - [nicotinamide adenine dinucleotide] cytochrome b5 reductase deficiency; Partial NADH - [nicotinamide adenine dinucleotide] diaphorase deficiency; Recessive congenital methaemoglobinaemia type 1; Recessive hereditary methaemoglobinaemia type 2; NADH - [nicotinamide adenine dinucleotide] cytochrome b5reductase deficiency type 2; NADH - [nicotinamide adenine dinucleotide] diaphorase deficiency type 2; Recessive congenital methaemoglobinaemia type 2; Total NADH - [nicotinamide adenine dinucleotide] cytochrome b5 reductase deficiency; Total NADH - [nicotinamide adenine dinucleotide] diaphorase deficiency; Methaemoglobin reductase deficiency haemoglobinopathy; NADPH - [Methaemoglobin reductase deficiency haemoglobinopathy]"
3A93,Acquired methaemoglobinaemia,,,Toxic methaemoglobinaemia,,Acquired methaemoglobinaemia; Acquired methaemoglobinaemia with sulfhaemoglobinaemia; methaemoglobin sensitivity; nitrosohaemoglobinaemia; sulfhaemoglobinaemia; Toxic methaemoglobinaemia; Stokvis disease; Stokvis-Talma syndrome; Van den Bergh disease; autotoxic cyanosis; enterogenous cyanosis
3A94,Acute posthaemorrhagic anaemia,,"A disease caused by blood loss such as subsequent to trauma. This disease is characterised by loss of blood from the body leading to low levels of red blood cells/blood in the body. This disease may present with pallor, fatigue, or shortness of breath. Confirmation is by identification of low levels of red blood cells in a blood sample.",,Anaemia due to acute disease; congenital anaemia from fetal blood loss,Acute posthaemorrhagic anaemia; acute haemorrhagic anaemia; acute posthaemorrhagic iron deficiency anaemia; anaemia due to acute blood loss
3B10,Hereditary factor VIII deficiency,,A disease caused by a genetically inherited mutation leading to a deficiency in clotting due to lack of factor VIII. This disease is characterised by increasing haemorrhaging and bruising. Confirmation is by identification of mutations by genetic testing.,,,
3B10.0,Haemophilia A,,"Haemophilia A is the most common form of haemophilia characterised by spontaneous or prolonged haemorrhages due to factor VIII deficiency. Depending on the extent of the factor VIII deficiency, it can be severe (biological activity of factor VIII below 1%), moderately severe (activity of factor VIII between 1% and 5%), or mild (activity of factor VIII between 5 and 40%).",Severe haemophilia A; Moderately severe haemophilia A; Mild haemophilia A; Symptomatic form of haemophilia A in female carriers,factor VIII deficiency with vascular defect,Haemophilia A; AHG - [antihaemophilic globulin] deficiency; AHG - [antihaemophilic globulin] deficiency disease; Haemophilia NOS; antihaemophilic globulin deficiency; classic haemophilia; congenital factor VIII disorder; familial haemophilia; haemophilia; hereditary haemophilia; sex-linked factor VIII deficiency; subhaemophilia; Severe haemophilia A; Moderately severe haemophilia A; Mild haemophilia A; Symptomatic form of haemophilia A in female carriers
3B10.1,Hereditary factor VIII deficiency with anti-factor VIII inhibitor,,"A disease caused by a genetically inherited mutation leading to a deficiency in clotting due to lack of factor VIII. This disease also causes anti-factor VIII inhibitor antibodies to be produced when receiving transfusions. Anti-factor VIII inhibitor antibodies develop as the body recognises the factor VIII as foreign, therefore deeming factor VIII infusions ineffective. This disease is characterised by increasing haemorrhaging and bruising. Confirmation is by identification of mutations by genetic testing.",,,Hereditary factor VIII deficiency with anti-factor VIII inhibitor
3B11,Hereditary factor IX deficiency,,A disease caused by a genetically inherited X-linked recessive trait leading to a defective gene located on the X chromosome. This disease is characterised by low levels of the protein factor IX in the body leading to increased haemorrhaging and bruising due to clotting abnormalities. Confirmation is by identification of recessive trait by genetic testing.,,,
3B11.0,Haemophilia B,,"Haemophilia B is a form of haemophilia characterised by spontaneous or prolonged haemorrhages due to factor IX deficiency. Depending on the extent of the factor IX deficiency, it can be severe (biological activity of factor IX below 1%), moderately severe (activity of factor IX between 1% and 5%), or mild (activity of factor IX between 5 and 40%).",PTC - [plasma thromboplastin component] deficiency; Severe haemophilia B; Moderately severe haemophilia B; Mild haemophilia B; Symptomatic form of haemophilia B in female carriers,,Haemophilia B; Christmas disease; PTC - [plasma thromboplastin component] deficiency; deficiency of functional factor ix; functional factor IX deficiency; plasma thromboplastin component deficiency; sex-linked factor IX deficiency disease; Severe haemophilia B; Moderately severe haemophilia B; Mild haemophilia B; Symptomatic form of haemophilia B in female carriers
3B12,Von Willebrand disease,,"A disease caused by inherited genetic mutations. This disease is characterised by quantitative, structural or function abnormalities of von Willebrand factor leading to abnormalities in coagulation of the blood. This disease may present with prolonged bleeding, easy bruising or bleeding gums. Confirmation is by identification of mutation through genetic testing.",Angiohaemophilia; Factor VIII deficiency with vascular defect; Vascular haemophilia; Von Willebrand disease type 1; Von Willebrand disease type 2; Von Willebrand disease type 3,Acquired von Willebrand disease or syndrome; factor VIII deficiency NOS; factor VIII deficiency with functional defect,Von Willebrand disease; Angiohaemophilia; Factor VIII deficiency with vascular defect; Minot-von Willebrand-Jurgen disease; Vascular haemophilia; Willebrand Jurgen thrombopathy; angiohaemophilia A; angiohaemophilia B; pseudohaemophilia; Von Willebrand disease type 1; Von Willebrand disease type 2; Von Willebrand disease type 2A; Von Willebrand disease type 2B; Von Willebrand disease type 2M; Von Willebrand disease type 2N; Von Willebrand disease type 3
3B13,Haemophilia C,,"A disease caused by genetically inherited mutations. This disease is characterised by decreased levels of factor XI leading to abnormalities in coagulation of the blood. This disease may present with prolonged bleeding, easy bruising or bleeding gums. Confirmation is by identification of mutation through genetic testing.",,,Haemophilia C; PTA - [plasma thromboplastin antecedent] deficiency; Rosenthal disease; Rosenthal factor deficiency; Rosenthal syndrome; congenital factor XI deficiency; congenital factor XI deficiency disease; factor XI deficiency; hereditary factor XI deficiency disease; plasma thromboplastin antecedent deficiency; thromboplastin antecedent deficiency
3B14,Other inherited coagulation factor deficiency with bleeding tendency,,Any disease caused by genetically inherited mutations leading to lack of coagulation factors in the blood not elsewhere classified. These diseases are characterised by increased haemorrhaging and bruising as the blood cannot clot properly to control bleeding. Confirmation is identification of mutations by genetic testing.,,,
3B14.0,Hereditary deficiency of factor I,,Congenital deficiencies of fibrinogen are coagulation disorders characterised by bleeding symptoms ranging from mild to severe resulting from reduced quantity and/or quality of circulating fibrinogen. Afibrinogenaemia (complete absence of fibrinogen) and hypofibrinogenaemia (reduced plasma fibrinogen concentration) correspond to quantitative anomalies of fibrinogen while dysfibrinogenaemia corresponds to a functional anomaly of fibrinogen. Hypo- and dysfibrinogenaemia may be frequently combined (hypodysfibrinogenaemia).,,,Hereditary deficiency of factor I; Deficiency of factor 1; Deficiency of fibrinogen; Hereditary fibrinogen deficiency; congenital fibrinogenopenia; Hereditary afibrinogenaemia; Congenital afibrinogenaemia; Hereditary dysfibrinogenaemia; congenital dysfibrinogenaemia; dysfibrinogenaemia NOS; Hereditary hypofibrinogenaemia; congenital hypofibrinogenaemia; Hereditary hypodysfibrinogenaemia
3B14.1,Hereditary factor X deficiency,,Congenital factor X deficiency is an inherited bleeding disorder with a decreased antigen and/or activity of factor X (FX) and characterised by mild to severe bleeding symptoms.,,,Hereditary factor X deficiency; Congenital Stuart factor deficiency; Deficiency of factor X; Stuart Prower deficiency; Stuart deficiency disease; Stuart-Prower disease; Stuart-Prower factor deficiency; congenital factor x deficiency
3B14.2,Combined deficiency of vitamin K-dependent clotting factors,,"Hereditary combined vitamin K-dependent clotting factors deficiency (VKCFD) is a congenital bleeding disorder resulting from variably decreased levels of coagulation factors II, VII, IX and X, as well as natural anticoagulants protein C, protein S and protein Z.",,,"Combined deficiency of vitamin K-dependent clotting factors; Combined deficiency of factors II,VII,IX and X; Vitamin K epoxide reductase deficiency"
3B15,Inherited coagulation factor deficiency without bleeding tendency,,A disease caused by a genetically inherited mutation leading to decreased levels of coagulation factor. This disease is characterised by decreased levels of coagulation factor without leading to increased haemorrhaging. Confirmation is by identification of decreased levels of coagulation factor in a blood sample.,,,Inherited coagulation factor deficiency without bleeding tendency; Congenital prekallikrein deficiency; Congenital high-molecular-weight kininogen deficiency; Hereditary factor XII deficiency; Congenital Hageman factor deficiency; Deficiency of factor XII; Hageman defect; Hageman deficiency; Hageman factor defect; Hageman factor deficiency; congenital factor XII deficiency; factor XII deficiency disease
3B20,Disseminated intravascular coagulation,,"A disorder that is characterised by the systemic intravascular activation of the coagulation system, simultaneously leading to intravascular thrombi, compromising an adequate blood supply to the organs, and to bleeding as the consequence of consumption of platelets and coagulation factors. It may be provoked by a wide range of disorders including infections, inflammatory disorders and malignancy.",,,Disseminated intravascular coagulation; Consumption coagulopathy; DIC - [disseminated intravascular coagulation]; Defibrination syndrome; Diffuse intravascular coagulation; Fibrinolytic purpura; disseminated intravascular coagulopathy; fibrinolysis NOS; thrombolytic purpura; Purpura fulminans; Acquired fibrinolytic haemorrhage; haemorrhagic fibrinolysis; Gangrenous purpura; Acquired hypofibrinogenaemia; acquired afibrinogenaemia; acquired fibrinogenopenia
3B21,Haemorrhagic disorder due to circulating anticoagulants or coagulation factors inhibitors,,"A disease caused by anticoagulants present in the body that prevent the blood from clotting normally. This disease is characterised by abnormalities in blood clotting. This disease may present with prolonged bleeding, easy bruising or bleeding gums. Confirmation is by identification of anticoagulants present in a blood sample.",,long-term use of anticoagulants without haemorrhage,
3B21.0,Haemorrhage due to thrombin inhibitor other than heparin,,A disease caused by any thrombin inhibitors other than heparin that affects normal coagulation of the blood. This disease is characterised by inability of the blood to coagulate leading to bleeding. Confirmation is by identification of thrombin inhibitors in a blood sample.,,,Haemorrhage due to thrombin inhibitor other than heparin
3B21.1,Haemorrhage due to factor Xa inhibitor,,A disease caused by factor Xa inhibitor that affects normal coagulation of the blood. This disease is characterised by inability of the blood to coagulate leading to bleeding. Confirmation is by identification of factor Xa inhibitor in a blood sample.,,,Haemorrhage due to factor Xa inhibitor
3B22,Acquired haemophilia,,"Acquired haemophilia is a rare haemorrhagic disease caused by production of anti-factor VIII antibodies and is sometimes associated with other autoimmune disorders, cancers, lymphoproliferative syndromes and multiple transfusions during the postpartum period.",,,Acquired haemophilia; Autoimmune coagulation factor deficiency; nonfamilial haemophilia; Acquired haemophilia A; Acquired haemophilia B; Acquired factor XIII deficiency
3B50,Inherited fibrinolytic defects,,A disease caused by genetically inherited mutations affecting the fibrinolysis system which prevents blood clots from growing and becoming problematic. This disease is characterised by defects in the fibrinolysis system leading to coagulation of the blood. This disease may present with thrombosis.,,,
3B50.0,Congenital alpha-2 antiplasmin deficiency,,,,,Congenital alpha-2 antiplasmin deficiency; Congenital alpha2 antiplasmin deficiency
3B50.1,Congenital plasminogen activator inhibitor type 1 deficiency,,"Congenital plasminogen activator inhibitor type 1 (PAI-1) deficiency is a disorder that causes premature lysis of haemostatic clots and a moderate bleeding syndrome. Spontaneous bleeding is rarely observed, whereas moderate haemorrhages of the knees, elbows, nose and gingiva are usually triggered by mild trauma. However, menstrual bleeding may be severe and a prolonged bleeding after surgery is common. The PAI-1 deficiency may be qualitative or quantitative, total or partial.",,,Congenital plasminogen activator inhibitor type 1 deficiency; Congenital PAI-1 - [plasminogen activator inhibitor type 1] deficiency
3B51,Acquired fibrinolytic defects,,"A disease caused by determinants arising after birth, affecting the fibrinolysis system which prevents blood clots from growing and becoming problematic. This disease is characterised by defects in the fibrinolysis system leading to coagulation of the blood. This disease may present with thrombosis.",,,Acquired fibrinolytic defects; Drug-induced fibrinolytic disorder; medicament-induced fibrinolytic disorder; Fibrinolytic disorder due to administration of tissue-type plasminogen activator; Fibrinolytic disorder due to administration of tPA - [ tissue-type plasminogen activator]; Fibrinolytic disorder due to administration of urokinase; Fibrinolytic disorder due to administration of other drugs
3B60,Non-thrombocytopenic purpura,,A descriptive term for purpura caused by determinants other than low platelet count. This should be used for coding only when a more precise diagnosis is not available.,,Antineutrophil cytoplasmic antibody-associated vasculitis; Antiphospholipid syndrome; Drug-associated immune complex vasculitis; Immune complex small vessel vasculitis; Leukocytoclastic vasculitis; Purpura or bruising due to vascular fragility; Thrombotic thrombocytopenic purpura; Traumatic purpura,Non-thrombocytopenic purpura
3B60.0,Hereditary vascular purpura,,,,,Hereditary vascular purpura; Hereditary capillary fragility
3B60.1,Acquired vascular purpura,,Purpura resulting from vascular factors rather than from abnormalities in the blood such as dysproteinaemias and disorders of platelets and coagulation.,,Antineutrophil cytoplasmic antibody-associated vasculitis; Antiphospholipid syndrome; Capillaritis; Drug-associated immune complex vasculitis; IgA vasculitis; Leukocytoclastic vasculitis; Purpura or bruising due to vascular fragility; Thrombotic thrombocytopenic purpura; Traumatic purpura,Acquired vascular purpura
3B61,Thrombophilia,,"A disease caused by determinants arising after birth or genetically inherited factors leading to abnormalities in blood. This disease is characterised by abnormality of blood coagulation that increases the risk of thrombosis, clots in blood vessels. This disease may present with deep vein thrombosis or pulmonary embolism. Confirmation is identification of abnormal blood coagulation in a blood sample.",,,
3B61.0,Hereditary thrombophilia,,"A disease caused by hereditary factors leading to abnormalities in blood. This disease is characterised by abnormality of blood coagulation that increases the risk of thrombosis, clots in blood vessels. This disease may present with deep vein thrombosis or pulmonary embolism. Confirmation is identification of abnormal blood coagulation in a blood sample.",,,
3B61.00,Hyperhomocysteinaemia,,"A disease caused by deficiencies of vitamin B6, folic acid, or vitamin B12. Genetic defects in 5-MTHF reductase can consequently lead to hyperhomocysteinaemia. This disease is characterised by abnormally high level of homocysteine in the blood. This disease may present with cardiovascular disease, thrombosis, schizophrenia and osteoporosis. Confirmation is by identification of deficiency in a blood sample.",,,Hyperhomocysteinaemia
3B61.1,Acquired thrombophilia,,"A disease caused by determinants arising after birth. This disease is characterised by abnormality of blood coagulation that increases the risk of thrombosis, clots in blood vessels. This disease may present with deep vein thrombosis or pulmonary embolism. Confirmation is identification of abnormal blood coagulation in a blood sample.",,,Acquired thrombophilia; Gaisbock syndrome; polycythaemia due to stress; stress erythrocytosis; stress polycythaemia; Acquired protein S deficiency; Acquired antithrombin deficiency; acquired antithrombin 3 deficiency; acquired antithrombin III deficiency
3B62,Qualitative platelet defects,,"A disease caused by determinants arising after birth, during the antenatal period or genetically inherited factors. This disease is characterised by abnormalities in coagulation of the blood due to defective platelets. This condition may present with easy bruising, prolonged bleeding or bleeding gums. Confirmation is by identification of decreased platelets in a blood sample.",Thrombocytopathy,Von Willebrand disease,
3B62.0,Inherited qualitative platelet defects,,A disease caused by genetically inherited mutations leading to abnormalities in platelets. This disease is characterised by abnormal platelet formation or function. Confirmation is by identification of mutations by genetic testing.,,,
