Code,title,Fully Specified Name,Description,Inclusions,Exclusions,Index Terms
5C56.30,Mucopolysaccharidosis type 1,,"Mucopolysaccharidosis type 1 (MPS 1) is a rare lysosomal storage disease belonging to the group of mucopolysaccharidoses. There are three variants, differing widely in their severity, with Hurler syndrome (57% of cases) being the most severe, Scheie syndrome (20% of cases) the mildest and Hurler-Scheie syndrome (23% of cases) giving an intermediate phenotype.",,,"Mucopolysaccharidosis type 1; Alpha-L-iduronidase deficiency; Gargoylism; Lipochondrodystrophy; MPS1 - [Mucopolysaccharidosis type 1]; dysostosis multiplex; dysostosis multiplex syndrome; l-iduronidase deficiency; Mucopolysaccharidosis type 1H; Hurler syndrome; MPS1H - [Mucopolysaccharidosis type 1H]; Mucopolysaccharidosis type 1, severe form; Mucopolysaccharidosis type 1H/S; Hurler-Scheie syndrome; MPS1H/S - [Mucopolysaccharidosis type 1H/S]; Mucopolysaccharidosis type 1, intermediate form; Mucopolysaccharidosis type 1S; MPS1S - [Mucopolysaccharidosis type 1S]; Mucopolysaccharidosis type 1, mild form; Scheie syndrome"
5C56.31,Mucopolysaccharidosis type 2,,"Mucopolysaccharidosis type 2 (MPS 2) is a lysosomal storage disease belonging to the group of mucopolysaccharidoses. The clinical picture ranges from severe (the most frequent form) with early psychomotor regression, facial dysmorphism (macroglossia, constantly opened mouth, coarse features), hepatosplenomegaly, limited joint motion, carpal tunnel syndrome, dysostosis multiplex, small size, behavioural disorders and psychomotor regression leading to intellectual deficit, deafness, cardiac and respiratory disorders, and cutaneous signs, to mild (normal intelligence, milder dysmorphism and dysostoses).",Hunter syndrome,,"Mucopolysaccharidosis type 2; Hunter syndrome; Iduronate 2-sulfatase deficiency; MPS2 - [mucopolysaccharidosis 2]; iduronate 2-sulphatase deficiency; iduronate sulfatase deficiency; iduronate sulphatase deficiency; sulfo-iduronate sulfatase deficiency; sulfoiduronidate sulfatase deficiency; sulpho-iduronate sulphatase deficiency; sulphoiduronidate sulphatase deficiency; Mucopolysaccharidosis type 2A; Hunter syndrome type A; Iduronate 2-sulfatase deficiency type A; Mucopolysaccharidosis type 2, severe form; Mucopolysaccharidosis type 2B; Hunter syndrome type B; Iduronate 2-sulfatase deficiency type B; Mucopolysaccharidosis type 2, attenuated form; Mucopolysaccharidosis type 2, mild form"
5C56.32,Mucopolysaccharidosis type 4,,"Mucopolysaccharidosis type IV (MPS IV) is a lysosomal storage disease belonging to the group of mucopolysaccharidoses, and characterised by spondylo-epiphyso-metaphyseal dysplasia. It exists in two clinically indistinguishable forms, A and B. A deficiency in one of the two enzymes required for the degradation of keratan sulfate (KS) is responsible for the MPS IV subtypes: N-acetylgalactosamine-6-sulfate sulfatase in MPS IVA, and beta-D-galactosidase in MPS IVB.",,,Mucopolysaccharidosis type 4; Galactosamine-6-sulfatase deficiency; Morquio syndrome; Morquio-Brailsford disease; Mucopolysaccharidosis type 4A; Galactosamide-6-sulfatase deficiency; Galactose-6-sulfatase deficiency; Morquio syndrome type A; Mucopolysaccharidosis type 4B; Beta-D-galactosidase deficiency; Morquio syndrome type B
5C56.33,Mucopolysaccharidosis type 6,,"Mucopolysaccharidosis type 6 (MPS VI) is a lysosomal storage disease with progressive multisystem involvement, associated with a deficiency of arylsulfatase B (ASB) leading to the accumulation of dermatan sulfate. The disorder shows a wide spectrum of symptoms from slowly to rapidly progressing forms.",,,Mucopolysaccharidosis type 6; ARSB - [Arylsulfatase B] deficiency; Arylsulfatase B deficiency; Maroteaux-Lamy syndrome; N-acetylgalactosamine 4-sulfatase deficiency
5C56.4,Disorders of sialic acid metabolism,,"This refers to any disorders of the N- or O-substituted derivatives of neuraminic acid, a monosaccharide with a nine-carbon backbone.",,,Disorders of sialic acid metabolism; Free sialic acid storage disease; Finnish type sialuria; Salla disease; Sialuria; French type sialuria
5C57,Peroxisomal diseases,,"Peroxisomal disorders represent a class of medical conditions caused by defects in peroxisome functions. This may be due to defects in single enzymes important for peroxisome function or in peroxins, proteins encoded by PEX genes that are critical for normal peroxisome assembly and biogenesis.",,,
5C57.0,Disorders of peroxisome biogenesis,,"Peroxisome biogenesis disorders (PBDs) include the Zellweger syndrome spectrum (PBD-ZSD) and rhizomelic chondrodysplasia punctata type 1 (RCDP1). PBD-ZSD represents a continuum of disorders including infantile Refsum disease, neonatal adrenoleukodystrophy, and Zellweger syndrome. Collectively, PBDs are autosomal recessive developmental brain disorders that also result in skeletal and craniofacial dysmorphism, liver dysfunction, progressive sensorineural hearing loss, and retinopathy.",,,"Disorders of peroxisome biogenesis; Hyperpipecolic acidaemia; Zellweger spectrum disorder; Zellweger syndrome; Cerebrohepatorenal syndrome; Zellweger spectrum disorder, severe form; Zellweger spectrum disorder, mild form; Zellweger spectrum disorder, unclassified clinical severity; PEX1 deficiency; PEX2 deficiency; PEX3 deficiency; PEX5 deficiency; PEX6 deficiency; PEX10 deficiency; PEX12 deficiency; PEX13 deficiency; PEX14 deficiency; PEX16 deficiency; PEX19 deficiency; PEX26 deficiency"
5C57.1,"Disorders of peroxisomal alpha-, beta- or omega-oxidation",,,,,"Disorders of peroxisomal alpha-, beta- or omega-oxidation; Refsum disease; HMSN 4 - [Hereditary motor and sensory neuropathy type 4]; Hereditary motor and sensory neuropathy type 4; Heredoataxia hemeralopica polyneuritiformis; Phytanic acid oxidase deficiency; Phytanic acid storage disease; Refsum-Thiebaut disease; Infantile Refsum disease; X-linked adrenoleukodystrophy; Schilder-Addison complex; X-linked cerebral adrenoleukodystrophy; X-linked childhood adrenoleukodystrophy; Adrenomyeloneuropathy; X-linked adult-onset adrenomyeloneuropathy; Peroxisomal D-bifunctional enzyme deficiency; Bifunctional enzyme deficiency; Peroxisomal acyl-CoA oxidase deficiency; Pseudo-neonatal adrenoleukodystrophy; Pseudoadrenoleukodystrophy; Sterol carrier protein deficiency"
5C58,Inborn errors of porphyrin or heme metabolism,,,defects of catalase and peroxidase,,
5C58.0,Disorders of bilirubin metabolism or excretion,,,,,
5C58.00,Crigler-Najjar syndrome,,"Crigler-Najjar syndrome is an autosomal recessive disorder of bilirubin metabolism characterised by unconjugated hyperbilirubinemia due to a hepatic deficit of bilirubin glucuronosyltransferase activity. Two types have been described, CNS types 1 and 2, depending on whether the enzymatic deficit is complete or partial: clinical manifestations vary accordingly. Patients present with isolated jaundice that appears early in life. Biological analyses detect severe unconjugated hyperbilirubinemia with normal liver function tests. Abdominal imaging studies (plain X-rays, CT scans or ultrasonograms) and liver histology findings are normal. Diagnosis is generally confirmed by genomic DNA analysis.",,,Crigler-Najjar syndrome; Bilirubin UDP glucuronyl transferase deficiency; Bilirubin uridinediphosphate glucuronosyltransferase deficiency; Bilirubin-UGT deficiency; CNS - [Crigler-Najjar syndrome]; Hereditary unconjugated hyperbilirubinaemia; UGT deficiency; bilirubin glucuronosyltransferase deficiency; congenital familial nonhemolytic jaundice; crigler-najjar disease or syndrome; deficiency of glucuronosyltransferase; glucuronyl transferase deficiency; glucuronyltransferase deficiency; udp glucuronyl transferase deficiency; Crigler-Najjar syndrome type 1; Bilirubin glucuronyltransferase deficiency; Bilirubin uridinediphosphate glucuronosyltransferase deficiency type 1; Bilirubin-UGT deficiency type 1; CNS1 - [Crigler-Najjar syndrome type 1]; Hereditary unconjugated hyperbilirubinaemia type 1; UGT deficiency type 1; Crigler-Najjar syndrome type 2; Arias syndrome; Bilirubin uridinediphosphate glucuronosyltransferase deficiency type 2; Bilirubin-UGT deficiency type 2; CNS2 - [Crigler-Najjar syndrome type 2]; Hereditary unconjugated hyperbilirubinaemia type 2; UGT deficiency type 2
5C58.01,Gilbert syndrome,,"Gilbert's syndrome is an inherited liver disorder characterised by jaundice due to unconjugated hyperbilirubinemia, resulting from a partial deficiency in hepatic bilirubin glucuronosyltransferase activity.",,,Gilbert syndrome; Gilbert cholaemia; Gilbert disease; Gilbert--Lereboullet syndrome; Hyperbilirubinaemia type 1; Meulengracht icterus; Meulengracht syndrome; benign unconjugated bilirubinaemia syndrome; cholaemia familiaris simplex; chronic intermittent juvenile jaundice; congenital familial cholaemia; constitutional hepatic dysfunction; constitutional hyperbilirubinaemia (in part); familial cholaemia; familial nonhaemolytic bilirubinaemia; familial nonhaemolytic jaundice; hereditary nonhaemolytic bilirubinaemia; hereditary nonhaemolytic jaundice; icterus intermittens juvenilis; idiopathic hyperbilirubinaemia (in part); idiopathic unconjugated hyperbilirubinaemia; low-grade chronic hyperbilirubinaemia syndrome; physiologic cholaemia
5C58.02,Dubin-Johnson syndrome,,"Dubin-Johnson syndrome (DJS) is a benign, inherited liver disorder characterised clinically by chronic, predominantly conjugated, hyperbilirubinemia and histopathologically by black-brown pigment deposition in parenchymal liver cells.",,,Dubin-Johnson syndrome; DJS - [Dubin-Johnson syndrome]; Dubin-Sprinz disease; Hyperbilirubinaemia type 2; Sprinz-Nelson syndrome
5C58.03,Progressive familial intrahepatic cholestasis,,"Progressive familial intrahepatic cholestasis (PFIC) refers to a heterogeneous group of autosomal recessive disorders of childhood that disrupt bile formation and present with cholestasis of hepatocellular origin. Three types of PFIC have been identified and are related to mutations in hepatocellular transport system genes involved in bile formation. PFIC1 and PFIC2 usually appear in the first months of life, whereas onset of PFIC3 may also occur later in infancy, in childhood or even during young adulthood.",,,Progressive familial intrahepatic cholestasis; PFIC - [Progressive familial intrahepatic cholestasis]; Progressive familial intrahepatic cholestasis type 1; PFIC1 - [Progressive familial intrahepatic cholestasis type 1]; Progressive familial intrahepatic cholestasis type 2; PFIC2 - [Progressive familial intrahepatic cholestasis type 2]; Progressive familial intrahepatic cholestasis type 3; PFIC3 - [Progressive familial intrahepatic cholestasis type 3]
5C58.04,Benign recurrent intrahepatic cholestasis,,,,,Benign recurrent intrahepatic cholestasis; BRIC - [Benign recurrent intrahepatic cholestasis]; Summerskill-Walshe-Tygstrup syndrome; Benign intrahepatic cholestasis type 1; Benign intrahepatic cholestasis type 2
5C58.1,Porphyrias,,"Porphyrias constitute a group of diseases characterised by intermittent neuro-visceral manifestations, cutaneous lesions or by the combination of both. All porphyrias are caused by a deficiency in one of the enzymes of the heme biosynthesis pathway resulting in an accumulation of porphyrins and/or their precursors in the liver or bone marrow. Clinical signs of the disease usually appear in adulthood, but some porphyrias affect children. Porphyrias can be classified according to the main location of the metabolic anomaly. Direct or indirect neurotoxicity may cause neurological manifestations. Transmission of hereditary porphyrias is autosomal and either dominant with weak penetrance or recessive with complete penetrance. Diagnosis is mainly based on the measurement of porphyrins and their precursors in biological samples.",,,
5C58.10,Porphyria cutanea tarda,,"Porphyria cutanea tarda (PCT) is due to an accumulation of uroporphyrins in plasma from blockage of the normal haem synthetic pathway in the liver at the level of uroporphyrinogen decarboxylase (URO-D). The majority of cases are sporadic and frequently associated with iron overload. PCT manifests as skin fragility and blistering in light-exposed skin, particularly on the dorsa of the hands, together with hypertrichosis.",,,"Porphyria cutanea tarda; Heterozygous uroporphyrinogen decarboxylase deficiency; PCT - [porphyria cutanea tarda]; Porphyria, hepatocutaneous type; UROD - [uroporphyrinogen decarboxylase] deficiency; Sporadic porphyria cutanea tarda; Sporadic PCT - [porphyria cutanea tarda]; Familial porphyria cutanea tarda; Familial PCT - [porphyria cutanea tarda]; Toxic porphyria cutanea tarda; Porphyria turcica"
5C58.12,Erythropoietic porphyrias,,Erythropoietic porphyrias are associated clinically with photosensitivity and biochemically with abnormal accumulation of porphyrins in erythrocytes. They include erythropoietic protoporphyria and the very rare congenital erythropoietic porphyria.,,,Erythropoietic porphyrias; Erythropoietic protoporphyria; EPP - [erythropoietic protoporphyria]; Ferrochelatase deficiency; Heme synthetase deficiency; Erythropoietic protoporphyria due to ferrochelatase deficiency; EPP due to ferrochelatase deficiency; FECH-deficient EPP; Erythropoietic protoporphyria due to gain of function of erythroid-specific aminolevulinic acid synthase 2; EPP due to gain of function of erythroid-specific aminolevulinic acid synthase 3; X-linked dominant protoporphyria; X-linked protoporphyria; XLDPP - [X-linked dominant protoporphyria]; XLP - [X-linked protoporphyria]; Congenital erythropoietic porphyria; Günther disease; Hereditary erythropoietic porphyria; Uroporphyrinogen III synthase deficiency
5C58.13,Variegate porphyria,,Variegate porphyria is a form of acute hepatic porphyria characterised by the occurrence of neuro-visceral attacks with or without the presence of cutaneous lesions (bullous photodermatitis).,,,Variegate porphyria; Porphyria variegata; Protocoproporphyria; Protoporphyrinogen oxidase deficiency; VP - [variegate porphyria]
5C59,Inborn errors of neurotransmitter metabolism,,,,,
5C59.0,Disorders of biogenic amine metabolism,,,,,
5C59.00,Disorders of catecholamine synthesis,,Any condition caused by failure to correctly synthesize catecholamines. Confirmation is by blood test.,,,Disorders of catecholamine synthesis; Aromatic L-amino acid decarboxylase deficiency; DOPA decarboxylase deficiency; Dopamine beta-hydroxylase deficiency; Noradrenaline deficiency; Norepinephrine deficiency
5C59.01,Disorders of pterin metabolism,,Any condition caused by failure to correctly metabolize pterin.,,,Disorders of pterin metabolism; Malignant hyperphenylalaninaemia due to tetrahydrobiopterin deficiency; Malignant hyperphenylalaninaemia due to BH4 deficiency; Dihydropteridine reductase deficiency; DHPR - [Dihydropteridine reductase] deficiency; 6-pyruvoyl-tetrahydropterin synthase deficiency; PTPS - [6-pyruvoyl-tetrahydropterin synthase] deficiency; GTP cyclohydrolase 1 deficiency; GTPCH deficiency; Guanosine-5-triphosphatase cyclohydrolase deficiency; Hyperphenylalaninaemia due to GTP cyclohydrolase deficiency; Hyperphenylalaninaemia with neopterin deficiency; Pterin-4-carbinolamine dehydratase deficiency; Dehydratase deficiency; Hyperphenylalaninaemia due to dehydratase deficiency; Hyperphenylalaninaemia due to pterin-4-alpha-carbinolamine dehydratase deficiency; Primapterinuria; Motor or cognitive disorder due to sepiapterin reductase deficiency
5C59.1,Disorders of gamma aminobutyric acid metabolism,,,,,Disorders of gamma aminobutyric acid metabolism; Disorders of GABA - [gamma aminobutyric acid] metabolism; Gamma aminobutyric acid transaminase deficiency; GABA - [gamma aminobutyric acid] transaminase deficiency
5C59.2,Disorders of pyridoxine metabolism,,,,,Disorders of pyridoxine metabolism
5C5A,Alpha-1-antitrypsin deficiency,,"Alpha-1-antitrypsin deficiency (AATD) is a genetic disorder that manifests as pulmonary emphysema, liver cirrhosis and, rarely, as the skin disease panniculitis, and is characterised by low serum levels of AAT, the main protease inhibitor (PI) in human serum.",,,Alpha-1-antitrypsin deficiency; AATD - [Alpha-1-antitrypsin] deficiency; Alpha-1 antitrypsin deficiency panniculitis; Alpha-1-antichymotrypsin deficiency; Hemorrhagic disease due to alpha-1-antitrypsin Pittsburgh mutation
5C60,Disorders of amino acid absorption or transport,,Any condition caused by deficiencies in amino acid absorption and transport.,,Disorders of tryptophan metabolism,
5C60.0,Oculocerebrorenal syndrome,,"Oculocerebrorenal syndrome of Lowe (OCRL) is a multisystem disorder characterised by congenital cataracts, glaucoma, intellectual disabilities, postnatal growth retardation and renal tubular dysfunction with chronic renal failure.",,,"Oculocerebrorenal syndrome; Cerebro-oculorenal dystrophy; Lowe disease; Lowe oculocerebrorenal syndrome; Lowe syndrome; Lowe-Terrey-Maclachlan syndrome; OCRL1 - [Oculocerebrorenal syndrome]; Oculocerebrorenal dystrophy; Phosphatidylinositol 4,5-biphosphate 5-phosphatase deficiency; renal-oculocerebrodystrophy; Glaucoma in Lowe syndrome"
5C60.1,Cystinosis,,"Cystinosis is a metabolic disease characterised by an accumulation of cystine inside the lysosomes of different tissues due to a defect in cystine transport out of lysosomes. There are three clinical forms : infantile, juvenile and ocular. The infantile form is severe, multisystem disease, with impaired proximal tubular reabsorptive capacity, with severe fluid-electrolyte balance alterations, cystine deposits in various organs and progression towards renal failure after 6 years of age. Juvenile cystinosis appear around 8 years of age and has an intermediate clinical picture with end-stage renal disease occurring after the age of 15.The ocular, adult form presents with photophobia.",,,Cystinosis; Cystine diathesis; Cystine storage disease; Protein defect of cystine transport; Renal tubulo-interstitial disorders in cystinosis; Juvenile nephropathic cystinosis; Benign adult nephropathic cystinosis; Infantile nephropathic cystinosis
5C60.2,Cystinuria,,Cystinuria is a renal tubular aminoacid transport disorder characterised by recurrent formation of kidneys cystine stones.,,,Cystinuria; CSNU - [cystinuria]; Cystinuria - lysinuria; cystine disease; Cystinuria type A; Cystinuria type B
5C61,Disorders of carbohydrate absorption or transport,,,,,
5C61.0,Glucose-galactose malabsorption,,"Glucose-galactose malabsorption is characterised by diarrhoea and severe neonatal dehydration. Around 300 cases have been described to date. Moderate glucosuria has also been reported, but fructose absorption is normal. Glucose-galactose malabsorption is caused by a mutation in the SLC5A1 gene, encoding the glucose-sodium cotransporter, SGTL1. The mode of transmission is autosomal recessive. The fatal consequences of this syndrome can be avoided by following a glucose and galactose restricted diet.",,Glucose or galactose intolerance of newborn,Glucose-galactose malabsorption; Congenital monosaccharide malabsorption; SGLT1 deficiency; Congenital glucose-galactose malabsorption
5C61.1,Maltase-glucoamylase deficiency,,Chronic diarrhea due to glucoamylase deficiency is characterised by chronic diarrhoea in infancy or childhood in association with intestinal glucoamylase deficiency.,,,Maltase-glucoamylase deficiency; Chronic diarrhoea due to glucoamylase deficiency
5C61.2,Congenital sucrase-isomaltase deficiency,,"Congenital sucrase-isomaltase deficiency (CSID) is a carbohydrate intolerance disorder characterised by malabsorption of oligosaccharides and disaccharides. CSID is transmitted as an autosomal recessive trait and is caused by mutations in the brush-border membrane complex sucrase-isomaltase (SI), which is required for the breakdown of sucrose and starch into monosaccharides. The SI deficiency results in an accumulation of disaccharides in the lumen, causing osmotic diarrhoea. The prognosis for patients is good as the starch intolerance usually resolves during the first few years of life and sucrose intolerance usually improves with age.",,,Congenital sucrase-isomaltase deficiency; CSID - [Congenital sucrase-isomaltase deficiency]; Congenital sucrose intolerance; Congenital sucrose-isomaltose malabsorption; Disaccharidase deficiency; Disaccharide intolerance type I; Invertase deficiency; Sucrase-alpha-dextrinase deficiency; disaccharide malabsorption; intestinal disaccharidase deficiency; sucrase deficiency; sucrose intolerance; sucrose intolerance of newborn
5C61.3,"Alpha, alpha trehalase deficiency",,"Alpha, alpha trehalase deficiency is characterised by diarrhoea and vomiting after ingestion of trehalose, a disaccharide found mainly in mushrooms. The disease is very rare in most populations but the incidence has been estimated at least 1 in 13 in Greenland. Isolated trehalose intolerance is due to a deficiency of trehalase (TREH; 11q23.3), a brush-border membrane glycoprotein.",,,"Alpha, alpha trehalase deficiency"
5C61.4,Acquired monosaccharide malabsorption,,"This is an acquired condition in which the cells lining the intestine cannot take in one or all of the sugars glucose, galactose or fructose, which prevents proper digestion of these molecules and larger molecules made from them. 
It may cause osmotic diarrhoea.",,,
5C61.40,Fructose malabsorption,,,,,Fructose malabsorption
5C61.5,Disorders of facilitated glucose transport,,,,,"Disorders of facilitated glucose transport; Encephalopathy due to GLUT1 deficiency; Facilitated glucose transporter protein type 1 deficiency; Glucose transporter defect, blood-brain barrier; Familial renal glucosuria; SGLT2 deficiency"
5C61.6,Lactose intolerance,,"Lactose intolerance is the inability to digest lactose, a sugar found in milk and some dairy products, due to a deficiency of lactase, the enzyme that metabolizes lactose. Lactose intolerance occurs when lactose is not completely broken down and consequently the sugar cannot be absorbed into the blood.",,,
5C61.60,Primary lactase deficiency,,,,,"Primary lactase deficiency; Primary lactase deficiency, non-congenital"
5C61.61,Congenital lactase deficiency,,"This is a congenital deficiency of lactase (EC 3.2.1.108), inherited as an autosomal recessive trait, presenting in infancy and manifested by profuse watery diarrhoea in response to dietary milk, due to inability to digest lactose, a sugar found in milk and to a lesser extent milk-derived dairy products. The condition may lead to marasmus and death if lactose is not eliminated from the diet.",,,Congenital lactase deficiency; CLD - [congenital lactase deficiency]; congenital alactasia; congenital alactasia syndrome; congenital lactose intolerance; congenital lactose malabsorption; disaccharide intolerance 2; disaccharide intolerance type 2; hereditary alactasia; hereditary lactase deficiency; lactose intolerance of newborn
5C61.62,Secondary lactase deficiency,,This form of lactase deficiency results from some sort of damage to the intestines either due to a disease or surgery.,,,Secondary lactase deficiency; acquired lactase deficiency; acquired lactose intolerance; secondary lactose intolerance
5C62,Disorders of lipid absorption or transport,,,,,Disorders of lipid absorption or transport; Pancreatic colipase deficiency; Pancreatic triacylglycerol lipase deficiency; Congenital pancreatic lipase deficiency; Isolated lipase deficiency; Pancreatic triglyceride lipase deficiency
5C63,Disorders of vitamin or non-protein cofactor absorption or transport,,,,,
5C63.0,Disorders of cobalamin metabolism or transport,,,,,"Disorders of cobalamin metabolism or transport; Haptocorrin deficiency; Cobalophilin deficiency; Protein R deficiency; TCN1 - [Transcobalamin I] deficiency; Transcobalamin I deficiency; Vitamin B12-binding alpha-globulin deficiency; Vitamin B12-binding protein 1 deficiency; Other genetic defects of cobalamine transport or metabolism; Secondary non-genetic disorders of cobalamin absorption, transport or metabolism; Unspecified disorders of cobalamin absorption, transport or metabolism"
5C63.1,Disorders of folate metabolism or transport,,,,,Disorders of folate metabolism or transport; Hereditary folate malabsorption; Congenital folate malabsorption; Neurodegenerative syndrome due to cerebral folate transport deficiency; Cerebral folate deficiency due to FOLR1 deficiency; Homocystinuria due to methylenetetrahydrofolate reductase deficiency; MTHFR - [methylenetetrahydrofolate reductase] deficiency; Methylenetetrahydrofolate reductase deficiency; Other genetic disorders of folate transport or metabolism; Secondary disorders of folate transport or metabolism; Non genetic cerebral folate deficiency due to autoantibodies; Inherited disorders of folate metabolism
5C63.2,Disorders of vitamin D metabolism or transport,,,,,
5C63.20,Hypocalcaemic vitamin D dependent rickets,,"Hypocalcaemic vitamin D-dependent rickets (VDDR-I) is an early-onset hereditary vitamin D metabolism disorder characterised by severe hypocalcaemia leading to osteomalacia and rachitic bone deformations, and moderate hypophosphatemia.",,,Hypocalcaemic vitamin D dependent rickets; Vitamin D-dependency type I
5C63.21,Hypocalcaemic vitamin D resistant rickets,,"Hypocalcaemic vitamin D-resistant rickets is a hereditary disorder of vitamin D action characterised by hypocalcaemia, severe rickets and in many cases alopecia.",,,Hypocalcaemic vitamin D resistant rickets
