Code,title,Fully Specified Name,Description,Inclusions,Exclusions,Index Terms
MB27.26,Tactile hallucinations,,"Hallucinations involving the perception of being touched (e.g., feeling like bugs are crawling on the skin, pins being stuck into one's finger) that are not restricted to the period of awakening or the onset of sleep.",,,Tactile hallucinations; Formication
MB27.27,Visual hallucinations,,"Hallucinations involving sight in the absence of an actual visual stimulus that are not restricted to the period of awakening or the onset of sleep. Visual hallucinations may involve formed images, such as of people, or of unformed images, such as flashes of light. Visual hallucinations must be distinguished from illusions, which are visual misperceptions of real external stimuli.",,,Visual hallucinations; seeing things
MB27.3,Disturbance of body image,,"Excessively negative, distorted, or inaccurate perception of one's own body or parts of it.",,,Disturbance of body image
MB27.4,Illusions,,"A misinterpretation of a true sensation (e.g., hearing voices in the sound of running water, the perception of figures in shadows).",,Visual illusions,Illusions
MB28,Symptoms or signs related to personality features,,"Symptoms and signs involving the characteristics or qualities possessed by a person that uniquely influence his or her cognition, motivations, and behaviours in various situations.",,,
MB28.0,Attention seeking,,A tendency to engage in behaviour designed to attract notice and to make oneself the focus of others’ attention.,,,Attention seeking
MB28.1,Callousness,,Lack of concern for the feelings or problems of others; a lack of guilt or remorse about the negative or harmful effects of one's actions on others.,,,Callousness
MB28.2,Eccentricity,,"A tendency toward appearance or behaviour that is odd, unusual, peculiar, or unconventional, and is inconsistent with cultural or subcultural norms.",,,Eccentricity
MB28.3,Entitlement,,The belief that one is inherently deserving of privileges or special treatment.,,,Entitlement
MB28.4,Hostility,,"A tendency to experience persistent or frequent angry feelings, especially in response to minor slights and insults, and to adopt an unfriendly or threatening attitude in interactions with others.",,,Hostility; hostile behaviour
MB28.5,Impulsivity,,"A tendency to act on the spur of the moment in response to immediate stimuli, characterised by lack of deliberation and failure to consider risks and consequences before acting. Impulsivity may reflect a desire for immediate rewards or an inability to delay gratification.",,,Impulsivity
MB28.6,Indecisiveness,,A tendency to have difficulty making decisions or committing to a course of action.,,,Indecisiveness
MB28.7,Irresponsibility,,A pattern of disregard for and failure to honour obligations or commitments; a lack of respect for and follow-through on agreements or promises; carelessness with others' property.,,,Irresponsibility
MB28.8,Low frustration tolerance,,Diminished ability to regulate one's emotions and behaviour in response to frustrating circumstances.,,,Low frustration tolerance
MB28.9,Low self-esteem,,Low appraisal of one's self-worth.,,,Low self-esteem
MB28.A,Negative affectivity,,"A tendency to experience a broad range of distressing emotions, e.g. anxiety, anger irritability, depression, and other negative emotional states, often in response to even relatively minor actual or perceived stressors.",negative emotionality; proneness to negative emotional states,,Negative affectivity; negative emotionality; neuroticism; proneness to negative emotional states
MB28.B,Negativism,,"A tendency to oppose or resist suggestions or advice, or to resist stubbornly for no apparent reason.",,,Negativism
MB28.C,Perfectionism,,An inclination to demand flawlessness of oneself or others and setting excessively high standards.,,,Perfectionism
MB28.D,Pessimism,,"An inclination to emphasize adverse aspects, conditions, and possibilities, or to expect the worst possible outcome.",,,Pessimism
MB28.E,Recklessness,,"A tendency to engage in behaviour that potentially endangers a person's physical health, safety, or life.",,,Recklessness
MB28.F,Sensation seeking,,"An inclination to search for experiences and feelings that are varied, novel, complex, and intense.",,,Sensation seeking
MB28.G,Stubbornness,,"A steadfast adherence to an opinion, purpose, or course of action in spite of reason, arguments, or persuasion.",,,Stubbornness
MB28.H,Submissiveness,,"A tendency to adapt one’s behaviour to the actual or perceived interests and desires of others even when doing so is antithetical to one’s own interests, needs, or desires.",,,Submissiveness
MB29,Symptoms or signs involving eating and related behaviour,,"Symptoms and signs related to disturbances in the regulation or form of eating behaviour that are not developmentally appropriate or culturally sanctioned, including avoidant or restrictive eating, binge eating, decreased appetite, eating of non-nutritive substances, increased appetite, purging behaviour, and rumination-regurgitation.",,,
MB29.0,Avoidant or restrictive eating,,"Acceptance of only a limited diet, which may be defined in terms of a specific dietary composition or sensory features of food, that is inconsistent with cultural or subcultural norms.",,Avoidant-restrictive food intake disorder,Avoidant or restrictive eating
MB29.1,Binge eating,,An episode in which an individual eats notably more than usual and feels that she or he is unable to stop or limit the amount or type of food eaten.,,Bulimia Nervosa; Binge eating disorder,Binge eating
MB29.2,Eating of non-nutritive substances,,"Consumption of non-food objects and materials (e.g., clay, soil, chalk, plaster, plastic, metal and paper) or raw food ingredients (e.g., large quantities of salt or corn flour).",,Pica,Eating of non-nutritive substances
MB29.3,Purging behaviour,,"Behaviour aimed at the removal of ingested food from the body with the specific intention to lose weight or prevent weight gain (e.g., self-induced vomiting, laxative abuse, or the use of enemas).",,Bulimia Nervosa; Anorexia Nervosa,Purging behaviour
MB29.4,Rumination-regurgitation,,"Rechewing of previously swallowed food that has been brought back to the mouth through regurgitation, which may then be reswallowed or spat out.",,Rumination-regurgitation disorder; Bulimia Nervosa; Anorexia Nervosa,Rumination-regurgitation
MB2A,Symptoms or signs involving elimination,,"Symptoms and signs involving the behavioural components of defecation (soiling, faecal elimination) and urination.",,,
MB2A.0,Soiling,,"The passage of faeces in clothing, bed, or other inappropriate places in an individual who has reached a developmental age where faecal continence is ordinarily expected.",,Encopresis,Soiling
MB2A.1,Wetting,,"The voiding of urine into clothes or bed, which may occur during the day or night in an individual who has reached a developmental age where urinary continence is ordinarily expected.",,Enuresis,Wetting
MB40,Sensation disturbance,,,,,
MB40.0,Asomatognosia,,,,,Asomatognosia
MB40.1,Allodynia,,Pain due to a normally non-painful stimulus,,,Allodynia
MB40.2,Anacusis,,,,,Anacusis
MB40.3,Anaesthesia of skin,,"Partial or complete loss of sensation affecting the skin, most commonly affecting a circumscribed area and resulting from sensory nerve damage as from injury or leprosy.",Numbness of skin,,Anaesthesia of skin; Hypoaesthesia of skin; Loss of cutaneous sensation; Loss of sensation; Numbness of skin; Paraesthesia of skin; Pins and needles; Hemianaesthesia; Hemihypalgesia; Hemihypesthesia; Hemiparaesthesia; Hypoaesthesia; hypaesthesia
MB40.4,Tingling fingers or feet or toes,,,,,Tingling fingers or feet or toes
MB40.5,Hyperaesthesia,,Increased sensibility to stimuli of sense,,,Hyperaesthesia; heightened sensation; heightened sensation of skin
MB40.6,Dysesthesia,,,,,Dysesthesia
MB40.7,Acroparaesthesia,,Severe pain in the extremities,,,"Acroparaesthesia; Acroparaesthesia, simple; Acroparaesthesia, vasomotor"
MB40.8,Analgesia,,,,,Analgesia; Hemianalgesia
MB40.9,Neurological neglect syndrome,,,,,Neurological neglect syndrome; hemi-inattention; hemiakinesia; hemispatial neglect; left sided neglect; sensory extinction; unilateral neglect; unilateral visual inattention; visuospatial neglect
MB41,Disturbances of smell or taste,,"Disturbances of smell or taste include anosmia, parosmia, parageusia, and other disturbances of smell or taste.",,,
MB41.0,Anosmia,,,,,Anosmia; absent smell; complete loss of smell; loss of smell; lost sense of smell; no sense of smell; sense of smell absent
MB41.1,Parosmia,,,,,Parosmia; Disturbance of olfactory nerve; distorted sense of smell; disturbance of smell; hyperosmia; loss of sense of smell; olfactory alteration; perversion of the sense of smell; sense of smell altered; smell disorder
MB41.2,Dysgeusia,,A disorder characterised by an alteration of the sense of taste,ageusia; cacogeusia,,Dysgeusia; adverse taste perception; ageusia; cacogeusia; disorder of taste; disturbance of taste; gustatory alteration; loss of taste sense; parageusia; perversion of sense of taste; taste sense altered; things taste abnormal; things taste different; things taste peculiar
MB41.3,Hyposmia,,Decreased ability to smell,,,Hyposmia
MB42,Phonophobia,,Hypersensitivity to sounds,,,Phonophobia
MB43,Dyssomnia,,"Difficulties to fall asleep, or to remain sleeping",,,Dyssomnia
MB44,Abnormalities of gait or mobility,,"Abnormalities of gait or mobility include ataxic gait, paralytic gait, difficulty in walking, immobility, and other abnormalities of gait or mobility.",,"Ataxia, unspecified; Hereditary ataxia; ataxia, locomotor (syphilitic); Immobility syndrome",
MB44.0,Ataxic gait,,,Staggering gait,,Ataxic gait; Staggering gait; gait ataxia
MB44.1,Paralytic gait,,"A collection of gait abnormalities due to affected motor control, sensory feedback, and muscle strength.",Spastic gait,,Paralytic gait; Spastic gait; paralysis of gait; rigid gait; spasm of gait; spastic paraplegic gait
MB44.2,Difficulty in walking,,,,,Difficulty in walking; difficult walking; dysbasia
MB44.3,Immobility,,,Bedfast; Chairfast,Catatonia; Psychomotor retardation,Immobility; Bedfast; Chairfast; bed bound; bed ridden; inactivity NOS; nonambulatory
MB45,Lack of coordination,,Other lack of coordination is a lack of coordination other than abnormal involuntary movements and abnormalities of gait and mobility.,,Ataxic gait; Hereditary ataxia; Vertigo,
MB45.0,"Ataxia, unspecified",,,,,"Ataxia, unspecified; ataxia NOS; ataxic; ataxy; dyssynergia; general ataxia NOS; nonorganic ataxia"
MB45.1,Automatism,,"Repetitive unconscious gestures such as lip smacking, chewing or swallowing",,,Automatism
MB45.2,Atonia,,Loss of muscle tone,,,Atonia
MB45.3,Head drop,,,,,Head drop
MB45.4,Intention tremor,,Cerebellar tremor characterised by a broad course and low frequency,,,Intention tremor
MB46,Abnormal involuntary movements,,"Abnormal involuntary movements include abnormal head movements, tremor, cramp, spasm, fasciculation, and other abnormal involuntary movements",,Movement disorders; Stereotyped movement disorder; Tic disorders; Essential tremor or related tremors; Intention tremor,
MB46.0,Asterixis,,,,,Asterixis
MB46.1,Abnormal head movements,,,,,Abnormal head movements
MB46.2,Athetosis,,Twisting and writhing movements,,,Athetosis; acquired athetosis; athetoid; Unilateral athetosis; hemiathetosis
MB46.3,Drop attack,,A sudden spontaneous fall while standing and recovery within seconds or minutes,,,Drop attack
MB46.4,Titubation,,Head tremor of cerebellar origin,,,Titubation
MB46.5,Shuddering,,,,,Shuddering
MB47,Abnormality of tonus or reflex,,,,,
MB47.0,Abnormal reflex,,,,abnormal pupillary reflex; hyperactive gag reflex; vasovagal reaction or syncope,Abnormal reflex; motor disorder; motor disturbance; reflex disorder; reflex disturbance; Areflexia; Hyporeflexia; Hyperreflexia
MB47.1,Abnormal posture,,,,,Abnormal posture; imperfect posture; malposture; Posture imbalance; Relaxation of posture
MB47.2,Clonus,,A series of involuntary muscle contractions and relaxations,,,Clonus
MB47.3,Cramp or spasm,,,,carpopedal spasm; Infantile spasms,Cramp or spasm; cramp; crampy; spasm; Facial hemispasm; Muscle cramp; muscular cramp; Muscle rigidity; Muscle spasticity; spasticity NOS; Muscle spasm
MB47.4,Dystonia,,"Sustained muscle contraction, involuntary movements that can lead to fixed abnormal postures",,,Dystonia; dystonia disorder; Dyskinesia NOS; dyskinetic
MB47.5,Fasciculation,,,,,Fasciculation; flickering muscles; fluttering muscles; involuntary muscle contractions; muscle fasciculation; muscle twitching; muscular fasciculation; spontaneous contraction of muscle; twitching; twitching NOS; writhing muscles; Myokymia
MB47.6,Meningismus,,,,,Meningismus
MB47.7,Muscle fibrillation,,An involuntary muscle contraction and relaxation in a muscle fiber,,,Muscle fibrillation
MB47.8,Muscular hypertonia,,,,,Muscular hypertonia
MB47.9,Myotonia,,Slow relaxation of the muscles after voluntary contraction,,,Myotonia
MB47.A,Ophthalmoparesis,,Paresis of one or more extraocular muscles,,,Ophthalmoparesis
MB47.B,Opisthotonos,,Arching position of the body due spasm of the axial muscles along the spinal column,,,Opisthotonos
MB47.C,Tendency to fall,,,Tendency to fall because of old age or other unclear health problems,accidents; Difficulty in walking; Dizziness or giddiness; falls causing injury; Syncope or collapse,Tendency to fall; Tendency to fall because of old age or other unclear health problems; falls NOS; multiple falls NOS; recurrent falls; repeated falls; Complications of fall
MB47.D,Tetany,,,Carpopedal spasm,Parathyroid tetany; post-thyroidectomy tetany,Tetany; Carpopedal spasm; Hyperkinetic tetany; Pseudotetany
MB48,Dizziness or giddiness,,"Terms which may refer to a sense of spatial disorientation, motion of the environment, or lightheadedness. Dizziness is a general feeling of being off-balance. Giddiness is the feeling that you or your surroundings are moving or spinning.",,Vertiginous syndromes,
MB48.0,Vertigo,,,,,
MB48.00,Vertigo of central origin,,"Central vertigo is usually a result of an abnormal processing of the vestibular sensory input by the central nervous system due to either a disruption of central integrators (i.e. brain stem, cerebellum) or a sensory information mismatch (i.e. from the cortex). Lesions that affect the vestibular nerve or root entry zone (i.e. cerebellopontine angle [CPA] lesions) result in imbalance by affecting primary vestibular sensory information",Central positional nystagmus,,"Vertigo of central origin; Central positional nystagmus; central positional vertigo; central vertigo; central vestibular vertigo; cerebellar vertigo; cerebral vertigo; vertigo of central origin, unspecified ear"
MB48.1,Disorder of equilibrium,,,,,Disorder of equilibrium
MB48.2,Exertional dizziness,,,,,Exertional dizziness
MB48.3,Light-headedness,,,,,Light-headedness; light headed
MB48.4,Presyncope,,,,,Presyncope
MB49,Aura,,Reversible visual and/or sensory symptoms prior to a seizure (few seconds) or migraine with aura (20 minutes),,,Aura
MB4A,Apraxia,,,,,Apraxia; apraxic; dyspraxia syndrome; ideomotor apraxia; ideomotor dyspraxia; motor apraxia; transcortical apraxia; Classic apraxia; Cortical apraxia; Ideational apraxia; ideational dyspraxia; Ideokinetic apraxia; Innervation apraxia; Limb-kinetic apraxia; Sensory apraxia; Verbal apraxia
MB4B,Symbolic dysfunctions,,,,Developmental learning disorder,
MB4B.0,Dyslexia or alexia,,"Dyslexia and alexia refer to the loss, usually in adulthood, of a previous ability to read fluently and to accurately comprehend written material that is inconsistent with general level of intellectual functioning and is acquired after the developmental period in individuals who had previously attained these skills, such as due to a stroke or other brain injury.",,Developmental learning disorder,Dyslexia or alexia; aphemesthesia; reading disorder; visual amnesia; Dyslexia; dyslexia NEC; dyslexic
MB4B.1,Agnosia,,"Agnosia refers to the inability to recognize objects, shapes, people, sounds, or smells, which occurs despite otherwise normal functioning of the specific sense and is not accounted for by memory impairment.",,,Agnosia; loss of perception of sensory stimuli; Astereognosia; astereognosis; asterognosia; tactile agnosia; tactile amnesia; Verbal agnosia; Verbal and auditory agnosia; Visual verbal agnosia
MB4B.2,Acalculia,,"Acalculia refers to the loss, usually in adulthood, of a previous ability to perform simple mathematical calculations that is inconsistent with general level of intellectual functioning and is acquired after the developmental period in individuals who had previously attained these skills, such as due to a stroke or other brain injury.",,Developmental learning disorder,Acalculia
MB4B.3,Agraphia,,"Agraphia refers to the loss, usually in adulthood, of a previous ability to write that is inconsistent with general level of intellectual functioning and is acquired after the developmental period in individuals who had previously attained these skills, such as due to a stroke or other brain injury.",,Developmental learning disorder,Agraphia
MB4B.4,Anomia,,"Acquired difficulty in retrieving previously used vocabulary, particularly nouns and verbs.",,,Anomia; Anomic aphasia; Anomic dysphasia
MB4B.5,Dyscalculia,,"Dyscalculia refers to acquired difficulty with performing simple mathematical calculations that is inconsistent with general level of intellectual functioning, with onset after the developmental period in individuals who had previously attained these skills, such as due to a stroke or other brain injury.",,Developmental learning disorder,Dyscalculia
MB4C,Gerstmann syndrome,,"Gerstmann syndrome is a very rare neurological disorder characterised by the specific association of acalculia, finger agnosia, left-right disorientation, and agraphia, which is supposed to be secondary to a focal subcortical white matter damage in the parietal lobe.",,Gerstmann-Straussler-Scheinker syndrome,Gerstmann syndrome
MB4D,"Headache, not elsewhere classified",,"Headache with characteristic features suggesting that it is a unique diagnostic entity, a finding or complaint, but not fulfilling criteria for any of the headache disorders classified elsewhere.",,"Acute headache, not elsewhere classified; Chronic secondary headache or orofacial pain; Atypical facial pain; Trigeminal neuralgia","Headache, not elsewhere classified; cephalalgia; cephalgia; cephalodynia; headache, unspecified; pain in head NOS; Facial pain, not elsewhere classified; pain in face"
MB50,Tetraplegia,,,Quadriplegia,,
MB50.0,Flaccid tetraplegia,,This is a severe or complete loss of motor function in all four limbs with limp and relaxed muscles.,,,Flaccid tetraplegia; flaccid quadriplegia
MB50.1,Spastic tetraplegia,,This is a severe or complete loss of motor function in all four limbs with involuntary contractions.,,,Spastic tetraplegia; spastic quadriplegia; spastic quadriplegic
MB51,Diplegia of upper extremities,,This is a loss of motor control in both arms.,Paralysis of both arms; paralysis of both upper limbs,,
MB51.0,Flaccid diplegia of upper extremities,,,,,Flaccid diplegia of upper extremities
MB51.1,Spastic diplegia of upper extremities,,,,,Spastic diplegia of upper extremities
MB52,Diplegia of lower extremities,,,,,Diplegia of lower extremities; Flaccid diplegia of lower extremities; Spastic diplegia of lower extremities
MB53,Hemiplegia,,This is a severe or complete loss of motor function on one side of the body.,,congenital cerebral palsy; spastic hemiplegic cerebral palsy,
MB53.0,Alternating hemiplegia,,,,,Alternating hemiplegia; Alternating hemiplegia of childhood; Benign familial nocturnal alternating hemiplegia of childhood
MB53.1,Flaccid hemiplegia,,This is a severe or complete loss of motor function on one side of the body with limp and relaxed muscles.,,,Flaccid hemiplegia; flaccid hemiplegia affecting unspecified side; Flaccid hemiplegia of dominant side; Flaccid hemiplegia of non-dominant side; Flaccid hemiplegia of unspecified side
MB53.2,Spastic hemiplegia,,This is a severe or complete loss of motor function on one side of the body with involuntary contractions.,,,Spastic hemiplegia; hypertonic hemiplegia; spastic hemiplegia affecting unspecified side; spinal hemiplegia; Spastic hemiplegia of dominant side; Spastic hemiplegia of non-dominant side; Spastic hemiplegia of unspecified side
MB54,Monoplegia of upper extremity,,This is a loss of motor control in one arm.,Paralysis of arm; paralysis of upper limb,,
MB54.0,Flaccid monoplegia of upper extremity,,,,,Flaccid monoplegia of upper extremity; Flaccid monoplegia of upper extremity of dominant side; Flaccid monoplegia of upper extremity of nondominant side; Flaccid monoplegia of upper extremity of unspecified side
MB54.1,Spastic monoplegia of upper extremity,,,,,Spastic monoplegia of upper extremity; Spastic monoplegia of upper extremity of dominant side; Spastic monoplegia of upper extremity of non dominant side; Spastic monoplegia of upper extremity of unspecified side
MB55,Monoplegia of lower extremity,,This is a loss of motor control in one leg.,Paralysis of leg; paralysis of lower limb,,
MB55.0,Flaccid monoplegia of lower extremity,,,,,Flaccid monoplegia of lower extremity
MB55.1,Spastic monoplegia of lower extremity,,,,,Spastic monoplegia of lower extremity
MB56,Paraplegia,,,,,Paraplegia; Flaccid paraplegia; Spastic paraplegia; hypertonic paraplegia
MB57,Functional level of injury of spinal cord,,,,,
MB57.0,Functional level of injury of cervical spinal cord,,,,,Functional level of injury of cervical spinal cord
MB57.1,Functional level of injury of thoracic spinal cord,,,,,Functional level of injury of thoracic spinal cord
MB57.2,Functional level of injury of lumbar spinal cord,,,,,Functional level of injury of lumbar spinal cord
MB57.3,"Functional level of injury of spinal cord, sacrum",,,,,"Functional level of injury of spinal cord, sacrum"
MB60,Sleeptalking,,,,,Sleeptalking
MB70,Clinical findings in cerebrospinal fluid,,,,,
MB70.0,Abnormal level of enzymes in cerebrospinal fluid,,,,,Abnormal level of enzymes in cerebrospinal fluid
MB70.1,Abnormal level of hormones in cerebrospinal fluid,,,,,Abnormal level of hormones in cerebrospinal fluid
MB70.2,"Abnormal level of drugs, medicaments or biological substances in cerebrospinal fluid",,,,,"Abnormal level of drugs, medicaments or biological substances in cerebrospinal fluid"
MB70.3,Abnormal level of substances chiefly nonmedicinal as to source in cerebrospinal fluid,,,,,Abnormal level of substances chiefly nonmedicinal as to source in cerebrospinal fluid
MB70.4,Abnormal immunological findings in cerebrospinal fluid,,,,,Abnormal immunological findings in cerebrospinal fluid
MB70.5,Abnormal microbiological findings in cerebrospinal fluid,,,,,Abnormal microbiological findings in cerebrospinal fluid; Positive culture findings in cerebrospinal fluid
MB70.6,Abnormal cytological findings in cerebrospinal fluid,,,,,Abnormal cytological findings in cerebrospinal fluid
MB70.7,Abnormal histological findings in cerebrospinal fluid,,,,,Abnormal histological findings in cerebrospinal fluid
MB70.8,Other abnormal findings in cerebrospinal fluid,,,,,Other abnormal findings in cerebrospinal fluid; Abnormal chromosomal findings not elsewhere classified
MB71,Clinical findings on diagnostic imaging of central nervous system,,"Clinical findings on diagnostic imaging of central nervous system is findings on diagnostic imaging of the brain or the spinal cord which don't appear in normal status of the body. Diagnostic imaging refers to technologies that doctors use to look inside body for clues about a medical condition. X-rays, CT scans, nuclear medicine scans, MRI scans and ultrasound are all types of diagnostic imaging.",,,
MB71.0,Intracranial space-occupying lesion,,,,,Intracranial space-occupying lesion; intracranial lesion; intracranial mass lesion
MB72,Results of function studies of the nervous system,,,,,Results of function studies of the nervous system; Abnormal results of function studies of central nervous system; abnormal central nervous system function studies; Abnormal brain function studies; Abnormal EEG - [electroencephalogram]; Abnormal echoencephalogram; Abnormal results of function studies of peripheral nervous system or special senses; abnormal peripheral nervous system function studies; abnormal special senses function studies; Abnormal caloric test; Abnormal EMG - [electromyogram]; Abnormal EOG - [electro-oculogram]; Abnormal ERG - [electroretinogram]; Abnormal response to nerve stimulation; Abnormal VEP - [visual evoked potential]
MC10,Eye appearance abnormal,,,,,Eye appearance abnormal
MC11,Eye sensation abnormal,,,,,Eye sensation abnormal
MC12,Chronic enlargement of lacrimal gland,,,,,Chronic enlargement of lacrimal gland
MC13,Epiphora,,This is overflow of tears onto the face. A clinical sign or condition that constitutes insufficient tear film drainage from the eyes in that tears will drain down the face rather than through the nasolacrimal system.,,,"Epiphora; epiphora, unspecified as to cause; excessive tears; lacrimation abnormal; tearing; tearing eyes; watering eye; watery eye; Epiphora due to excess lacrimation; excessive tear production; hypersecretion of lacrimal glands; increased lacrimation; Epiphora due to insufficient drainage"
MC14,Eye discharge,,,,,Eye discharge
MC15,Red eye,,,,,Red eye
MC16,Pallor conjunctiva,,,,,Pallor conjunctiva
MC17,Icteric sclera,,,,,Icteric sclera
MC18,Ocular pain,,,,Chronic primary headache or orofacial pain; Chronic secondary headache or orofacial pain,"Ocular pain; ocular pain, unspecified eye; ophthalmic pain; pain in eye; pain in orbital region; sore eye"
MC19,Quadrantanopia,,,,,Quadrantanopia
