Code,title,Fully Specified Name,Description,Inclusions,Exclusions,Index Terms
CA0H.2,Nodules of vocal cords,,,,,Nodules of vocal cords; chorditis; chorditis cantorum; fibrinous chorditis; nodosa chorditis; nodular chorditis; nodule of the vocal cord; screamer's node; singer's chorditis; singer's lump; singer's nodes; singer's nodule; teacher's lump; tuberosa chorditis; vocal cord lump; vocal cord node; vocal cord nodule; vocal fold nodule
CA0H.3,Oedema of larynx,,"Laryngeal oedema is oedema (accumulation of fluid) which may occur for example in asaryepiglottic folds, epiglottis, the arytenoid region or submucosal of the subglottic region. It may occur due to anaphylaxis, angioneurotic oedema, larynx infection, foreign body or substance, or injury.",,laryngitis: acute obstructive [croup]; oedematous laryngitis,Oedema of larynx; laryngeal oedema; Glottic oedema; Subglottic oedema; Supraglottic oedema
CA0H.4,Laryngeal spasm,,"Laryngeal spasm is a pathological condition that is mainly a spasmodic closure (spasm) of the inlet portion of the larynx or the glottic region. There is an adult-onset and childhood (infant)-onset generally in this disease. There is a difference in the pattern of expression for these two types. In the infant, respiratory arrest is associated with this condition and spasmodic closure of the glottis occurs suddenly, and then breathing returns to original quite rapidly within a few minutes. In adults, the main symptoms of this condition are difficulty breathing or inspiratory stridor rather than a complete respiratory arrest.",laryngospasm,,Laryngeal spasm; Millar asthma; laryngeal stridor; laryngismus; laryngospasm; stridulous laryngismus; Acute spasmodic laryngotracheitis; False croup; pseudocroup; Glottic spasm; spasm of glottis; Paradoxical vocal fold dysfunction; Spasmodic croup; stridulous croup; Spasmodic laryngotracheitis; stridulous laryngotracheitis
CA0H.5,Stenosis of larynx,,Laryngeal stenosis is an abnormal narrowing within the cavity of the larynx.,,,Stenosis of larynx; laryngeal stenosis; laryngeal stricture; laryngostenosis; larynx narrowing; larynx stenosis; larynx stricture; Glottic stenosis; glottic stricture; glottis stenosis; stricture of glottis; subglottic stricture; Laryngeal constriction; larynx constriction
CA0J,Nasal polyp,,"Nasal polyp is an inflammatory and proliferating mass arising from the epithelial linings of nasal cavity and paranasal sinuses. In general, nasal polyp appears to be greyish white, smoothly surfaced, and glutinous and agar-like mass. The pathogenesis is thought to be multifactorial.",,adenomatous polyps,
CA0J.0,Polypoid sinus degeneration,,"Also referred to as Woakes' syndrome or ethmoiditis. Woakes' syndrome is characterised by severe recurrent nasal polyps, often without eosinophils on histological examination and with broadening of the nose.",,,Polypoid sinus degeneration; Woake ethmoiditis; Woake syndrome; sinus polyp degeneration
CA0K,Abscess of upper respiratory tract,,"Abscess of upper respiratory tract is defined as abscess formation which occurs from nose to pharynx and larynx. Abscess, furuncle and carbuncle of nose, retropharyngeal, parapharyngeal abscess and other abscess of pharynx are included in this classification.",,,
CA0K.0,Retropharyngeal or parapharyngeal abscess,,A retropharyngeal abscess is an abscess located in the tissues in the back of the throat behind the posterior pharyngeal wall (the retropharyngeal space). A parapharyngeal abscess is an abscess developing in the potential space in the head and the neck.,,Peritonsillar abscess,Retropharyngeal or parapharyngeal abscess; Certain specified abscess of pharynx; abscess of pharynx; pharyngeal abscess; throat abscess; Abscess of nasopharynx; Nasopharyngeal abscess; Cellulitis of pharynx; pharyngeal cellulitis; Cellulitis of nasopharynx; Fauces abscess; Thornwaldt abscess; Thornwaldt bursitis; Thornwaldt disease; Pharyngeal bursa abscess; Pharyngeal bursitis; Abscess of lateral pharyngeal space; lateral pharyngeal abscess; Abscess of parapharyngeal space; parapharyngeal abscess; Peripharyngeal abscess; Postpharyngeal abscess; Retropharyngeal abscess
CA0K.1,Peritonsillar abscess,,"Peritonsillar abscess is defined with abscess formation between the tonsillar capsule and the tonsillar constrictor muscles. Peritonsillar abscess mostly comes from peritonsillitis. Fever rise, pharyngeal pain and swallowing pain are the main symptoms, but, it also causes a muffled voice. Uvula is deviated to the unaffected side and swelling and redness around the affected tonsil is remarkable. Bacterial examination from the peritonsillar pus often reveal streptococcus group A beta-haemolytic as the aerobic bacteria and the detection rate of anaerobic bacteria also amounted to more than half. The treatment consists of antimicrobial therapy and incision and drainage of the abscess. The symptoms improve with above treatment in the most cases, while in some cases the abscess proceeds to a deadly deep neck infection and mediastinal abscess. If there are systemic complications such as diabetes mellitus, special attention is required.",Quinsy,"retropharyngeal abscess; tonsillitis, NOS; Acute tonsillitis; Chronic tonsillitis",Peritonsillar abscess; Quinsy; angina tonsillaris; posttonsillar abscess; Recurrent peritonsillar abscess; Abscess of tonsil; tonsil abscess; tonsillar abscess; Intratonsillar abscess; Lingual tonsil abscess; Tonsillopharyngeal abscess; Peritonsillar cellulitis; Cellulitis of tonsil; Acute peritonsillitis; peritonsillitis
CA20,Bronchitis,,Bronchitis is inflammation of the main air passages to the lungs.,,"bronchitis, asthmatic NOS; bronchitis, chemical (acute)",
CA20.0,Acute noninfectious bronchitis,,,,Acute bronchitis due to chemical fumes; Acute chemical bronchitis,Acute noninfectious bronchitis
CA20.1,Chronic bronchitis,,,,chronic asthmatic bronchitis; chronic: bronchitis: with airways obstruction; chronic: emphysematous bronchitis; chronic: obstructive pulmonary disease NOS,
CA20.10,Simple chronic bronchitis,,,,,Simple chronic bronchitis; chronic catarrhal bronchitis; Smokers bronchitis; smokers cough
CA20.11,Mucopurulent chronic bronchitis,,,,,"Mucopurulent chronic bronchitis; chronic suppurative bronchitis; chronic suppurative lung disease; fetid bronchitis; fetid chronic bronchitis; mucopurulent bronchitis; purulent bronchitis; purulent chronic bronchitis; recurrent bronchitis, mucopurulent; recurrent bronchitis, purulent; suppurative bronchitis"
CA20.12,Mixed simple and mucopurulent chronic bronchitis,,,,,Mixed simple and mucopurulent chronic bronchitis; simple and mucopurulent bronchitis
CA20.13,Protracted bacterial bronchitis,,Protracted bacterial bronchitis (PBB) is a disease caused by the chronic infection of the conducting airways. The condition causes a persistent wet cough lasting more than four weeks that responds to antibiotic treatment.,,,Protracted bacterial bronchitis
CA21,Emphysema,,"Emphysema is defined by abnormal and permanent enlargement of the airspaces that are distal to the terminal bronchioles. This is accompanied by destruction of the airspace walls, without obvious fibrosis (i.e. there is no fibrosis visible to the naked eye). Emphysema can exist in individuals who do not have airflow obstruction; however, it is more common among patients who have moderate or severe airflow obstruction.",,"Compensatory emphysema; emphysema due to inhalation of chemicals, gases, fumes or vapours; Interstitial emphysema originating in the perinatal period; emphysema mediastinal; emphysema, surgical (subcutaneous); Traumatic subcutaneous emphysema, not elsewhere classified; emphysema with chronic (obstructive) bronchitis; emphysematous (obstructive) bronchitis",
CA21.0,MacLeod syndrome,,"Decrease in size of one lung due to obliterating bronchiolitis, a congenital abnormality of other disorder resulting in hyperinflation of the normal lung.",,,MacLeod syndrome; Macleod unilateral emphysema; Swyer-James syndrome; Unilateral transparency of lung; unilateral emphysema; unilateral hyperlucent lung; unilateral lung or pulmonary emphysema
CA21.1,Panlobular emphysema,,Panlobular (panacinar) emphysema destroys the entire alveolus uniformly and is predominant in the lower half of the lungs. Panlobular emphysema generally is observed in patients with homozygous alpha1-antitrypsin deficiency.,Panacinar emphysema,,Panlobular emphysema; Panacinar emphysema
CA21.2,Centrilobular emphysema,,Centrilobular (centriacinar) emphysema begins in the respiratory bronchioles and spreads peripherally. This form is associated with long-standing cigarette smoking and predominantly involves the upper half of the lungs.,,,"Centrilobular emphysema; centriacinar emphysema; lung or pulmonary emphysema, centriacinar; lung or pulmonary emphysema, centrilobular"
CA22,Chronic obstructive pulmonary disease,,"Chronic Obstructive Pulmonary disease (COPD), a common preventable and treatable disease, is characterised by persistent airflow limitation that is usually progressive and associated with an enhanced chronic inflammatory response in the airways and the lung to noxious particles or gases. Exacerbations and comorbidities contribute to the overall severity in individual patients.",,Asthma; asthmatic bronchitis NOS; Bronchiectasis; chronic bronchitis NOS; Simple or mucopurulent chronic bronchitis; chronic tracheitis; chronic tracheobronchitis; Emphysema,
CA22.0,"Chronic obstructive pulmonary disease with acute exacerbation, unspecified",,"An acute unspecified exacerbation of COPD is an acute event characterised by a worsening of the patient’s respiratory symptoms that is beyond normal day-to-day variations and leads to a change in medication. Exacerbations of COPD can be precipitated by several factors. The diagnosis of an exacerbation relies exclusively on the clinical presentation of the patient complaining of an acute change of symptoms (baseline dyspnoea, cough, and/or sputum production) that is beyond normal day-to-day variation.",,,"Chronic obstructive pulmonary disease with acute exacerbation, unspecified; AECOPD – [acute exacerbation of chronic obstructive pulmonary disease]; acute exacerbation COPD; exacerbation COPD NOS; Chronic obstructive pulmonary disease with acute exacerbation, unspecified, very severe airflow limitation; Chronic obstructive pulmonary disease with acute exacerbation, unspecified, FEV1 less than 30% predicted; Chronic obstructive pulmonary disease with acute exacerbation, unspecified, Gold 4; Chronic obstructive pulmonary disease with acute exacerbation, unspecified, severe airflow limitation; Chronic obstructive pulmonary disease with acute exacerbation, unspecified, 30% equal to or less than FEV1 less than 50% predicted; Chronic obstructive pulmonary disease with acute exacerbation, unspecified, Gold 3; Chronic obstructive pulmonary disease with acute exacerbation, unspecified, moderate airflow limitation; Chronic obstructive pulmonary disease with acute exacerbation, unspecified, 50% equal to or less than FEV1 less than 80% predicted; Chronic obstructive pulmonary disease with acute exacerbation, unspecified, Gold 2; Chronic obstructive pulmonary disease with acute exacerbation, unspecified, mild airflow limitation; Chronic obstructive pulmonary disease with acute exacerbation, unspecified, FEV1 greater than or equal to 80% predicted; Chronic obstructive pulmonary disease with acute exacerbation, unspecified, Gold 1"
CA22.1,Certain specified chronic obstructive pulmonary disease,,,,"Chronic obstructive pulmonary disease with acute exacerbation, unspecified","Certain specified chronic obstructive pulmonary disease; Other specified chronic obstructive pulmonary disease, very severe airflow limitation; Other specified chronic obstructive pulmonary disease, FEV1 less than 30% predicted; Other specified chronic obstructive pulmonary disease, Gold 4; Other specified chronic obstructive pulmonary disease, severe airflow limitation; Other specified chronic obstructive pulmonary disease, 30% equal to or less than FEV1 less than 50% predicted; Other specified chronic obstructive pulmonary disease, Gold 3; Other specified chronic obstructive pulmonary disease, moderate airflow limitation; Other specified chronic obstructive pulmonary disease, 50% equal to or less than FEV1 less than 80% predicted; Other specified chronic obstructive pulmonary disease, Gold 2; Other specified chronic obstructive pulmonary disease, mild airflow limitation; Other specified chronic obstructive pulmonary disease, FEV1 greater than or equal to 80% predicted; Other specified chronic obstructive pulmonary disease, Gold 1; Chronic obstructive pulmonary disease with acute lower respiratory infection; COPD - [chronic obstructive pulmonary disease] with respiratory infection; acute infective exacerbation of chronic obstructive pulmonary disease; infective exacerbation of chronic obstructive airways disease; infective exacerbation of chronic obstructive pulmonary disease; Chronic obstructive pulmonary disease with acute lower respiratory infection, very severe airflow limitation; Chronic obstructive pulmonary disease with acute lower respiratory infection, FEV1 less than 30% predicted; Chronic obstructive pulmonary disease with acute lower respiratory infection, Gold 4; Chronic obstructive pulmonary disease with acute lower respiratory infection, severe airflow limitation; Chronic obstructive pulmonary disease with acute lower respiratory infection, 30% equal to or less than FEV1 less than 50% predicted; Chronic obstructive pulmonary disease with acute lower respiratory infection, Gold 3; Chronic obstructive pulmonary disease with acute lower respiratory infection, moderate airflow limitation; Chronic obstructive pulmonary disease with acute lower respiratory infection, 50% equal to or less than FEV1 less than 80% predicted; Chronic obstructive pulmonary disease with acute lower respiratory infection, Gold 2; Chronic obstructive pulmonary disease with acute lower respiratory infection, mild airflow limitation; Chronic obstructive pulmonary disease with acute lower respiratory infection, FEV1 greater than or equal to 80% predicted; Chronic obstructive pulmonary disease with acute lower respiratory infection, Gold 1; Obstructive infective bronchitis; Chronic obstructive pulmonary disease with pneumonia; Chronic obstructive tracheobronchitis; Asthma with chronic obstructive pulmonary disease; Chronic obstructive asthma; Asthmatic dyspnoea with chronic bronchitis; Bronchitis with chronic obstructive pulmonary disease; bronchitis obstruction; bronchitis with airway obstruction; bronchitis with chronic airway obstruction; chronic bronchitis obliterans; chronic obstructive bronchitis, NOS; diffuse obstructive bronchitis; obstructive bronchitis; Chronic asthmatic and obstructive bronchitis, not otherwise specified; chronic asthmatic bronchitis; Lung disease with obstructive bronchitis; Subacute obliterative bronchiolitis; Obstructive laryngobronchitis"
CA23,Asthma,,"Asthma is a chronic inflammatory disorder of the airways in which many cells and cellular elements play a role. It is characterised by an increased responsiveness of the trachea and bronchi to various stimuli and manifested by a widespread narrowing of the airways that change in severity either spontaneously or as a result of therapy. This leads to recurrent episodes of wheezing, breathlessness, chest tightness, and coughing, particularly at night or in the early morning.",Idiosyncratic asthma,miner’s asthma; Wheezing; wood asthma; asthma with chronic obstructive pulmonary disease; chronic asthmatic (obstructive) bronchitis; chronic obstructive asthma,Asthma; Idiosyncratic asthma
CA23.0,Allergic asthma,,"Allergic asthma is the most easily recognised asthma phenotype, which often commences in childhood and is associated with a past and/or family history of allergic diseases such as eczema, allergic rhinitis, or food or drug allergy. Examination of the induced sputum of these patients before treatment often reveals eosinophilic airway inflammation. The main trigger is the exposure to inhaled allergens, such as dust mite and pollens, to which the affected individual has previously been sensitized. Patients with this asthma phenotype usually respond well to inhaled corticosteroid (ICS) treatment and specific allergen-immunotherapy.",,,Allergic asthma; Allergen-induced asthma; Allergic bronchitis NOS; Extrinsic allergic asthma; Predominantly allergic asthma without stated status asthmaticus; allergic asthma without stated status asthmaticus; catarrh with asthma; extrinsic asthma; predominantly allergic asthma; Allergic occupational asthma; Asthma exacerbated by work; Allergic asthmatic rhinitis; allergic rhinitis with asthma; Allergic atopic asthma; atopic asthma; Childhood asthma; childhood asthmatic; childhood bronchial asthma; Tree allergy with asthma; Pollen allergy with asthma; pollen asthma; Platinum asthma; platinosis; Hay fever with asthma; hay asthma; Grass allergy with asthma; Dust allergy with asthma
CA23.00,Allergic asthma with exacerbation,,"This refers to acute or subacute episodes of progressively worsening shortness of breath, cough, wheezing, and chest tightness, or some combination of these symptoms in patients with proven allergic asthma. Allergic asthma can be exacerbated by allergens to which the individual is allergic, other exogenous factors such as respiratory infections, pollutants or climate change, or endogenous co-factors. Exacerbations are characterised by decreases in expiratory airflow that can be documented and quantified by simple measurement of lung function (spirometry or PEF), can vary widely among individuals and within individuals from rare to frequent. The severity of exacerbation of allergic asthma can vary from mild to very severe and life-threatening, but in general respond to standard treatments of bronchodilators (inhalers) and steroid",,,Allergic asthma with exacerbation
CA23.01,Allergic asthma with status asthmaticus,,,,,Allergic asthma with status asthmaticus; Predominantly allergic asthma with stated status asthmaticus
CA23.02,"Allergic asthma, uncomplicated",,,,,"Allergic asthma, uncomplicated; allergic asthma NOS"
CA23.1,Non-allergic asthma,,"Non-allergic asthma occurs in some patients who have asthma that is not associated with allergy. The cellular profile of the sputum of these patients may be neutrophilic, eosinophilic or contain only a few inflammatory cells (paucigranulocytic). Patients with non-allergic asthma often respond less well to inhaled corticosteroids. It can cover different phenotypes.",,,Non-allergic asthma; Non-allergic asthma without stated status asthmaticus; intrinsic asthma
CA23.10,Non-allergic asthma with exacerbation,,,,,Non-allergic asthma with exacerbation
CA23.11,Non-allergic asthma with status asthmaticus,,,,,Non-allergic asthma with status asthmaticus; Non-allergic asthma with stated status asthmaticus
CA23.12,"Non-allergic asthma, uncomplicated",,,,,"Non-allergic asthma, uncomplicated; Non-allergic asthma NOS; Nervous asthma"
CA23.2,Other specified forms of asthma or bronchospasm,,,,,Other specified forms of asthma or bronchospasm
CA23.20,Aspirin-induced asthma,,"In some asthma individuals, acetylsalicylic acid (aspirin®™) and other nonsteroidal anti-inflammatory drugs (NSAIDs) that inhibit cyclooxygenase 1 (COX-1) exacerbate the condition. This distinct clinical syndrome, called aspirin-induced asthma (AIA), is characterised by an eosinophilic rhinosinusitis, nasal polyposis, aspirin hypersensitivity, and asthma.",,,Aspirin-induced asthma; Asthma with aspirin triad including nonsteroidal anti-inflammatory activity and nasal polyps; acetylsalicylic acid-induced asthma
CA23.21,Exercise-induced bronchospasm,,Exercise-induced bronchoconstriction (EIB) describes airway narrowing that occurs in association with exercise. EIB occurs in up to 90% of asthmatic patients and is estimated to occur in >10% of the general population. Recent reviews have identified asthma as a risk factor for sudden death and have reported many deaths that have been attributed directly to EIB.,,,Exercise-induced bronchospasm
CA23.22,Cough variant asthma,,Cough variant asthma is an occult form of asthma in which the only sign or symptom is chronic cough.,,,Cough variant asthma
CA23.3,Unspecified asthma,,,,,Unspecified asthma
CA23.30,Unspecified asthma with exacerbation,,"This refers to an unspecified inflammatory disease of the airways characterised by variable and recurring symptoms, reversible airflow obstruction, and bronchospasm, with an acute sudden worsening.",,,Unspecified asthma with exacerbation; Unspecified asthma with acute exacerbation
CA23.31,Unspecified asthma with status asthmaticus,,"This refers to an unspecified inflammatory disease of the airways characterised by variable and recurring symptoms, reversible airflow obstruction, and bronchospasm, with an acute exacerbation of asthma that does not respond to standard treatments of inhalative bronchodilators and steroids.",,acute asthma NOS; severe asthma NOS,"Unspecified asthma with status asthmaticus; Asthma, unspecified, with stated status asthmaticus; acute severe asthma; acute severe bronchial asthma; status asthma; status asthmaticus NOS; status post asthmaticus"
CA23.32,"Unspecified asthma, uncomplicated",,,,acute severe asthma,"Unspecified asthma, uncomplicated; asthma NOS; asthma, unspecified, without stated status asthmaticus; asthmatic; asthmatic bronchitis NOS; asthmatic dyspnoea; bronchial asthma NOS; hypoxic asthma; Croup asthma; Late onset asthma"
CA24,Bronchiectasis,,"Bronchiectasis is an abnormal widening of one or more airways. Normally, tiny glands in the lining of the airways make a small amount of mucus. Mucus keeps the airways moist and traps any dust and dirt in the inhaled air. Because bronchiectasis creates an abnormal widening of the airways, extra mucus tends to form and pool in parts of the widened airways. Widened airways with extra mucus are prone to infection.",,"Respiratory tuberculosis, not confirmed; tuberculous bronchiectasis, confirmed",Bronchiectasis; bronchiectasis NOS; Bronchiectasis with airway obstruction; Dilatation of bronchus; bronchial dilatation; Bronchiolectasis; Cylindrical bronchiectasis; Fusiform bronchiectasis; Saccular bronchiectasis
CA25,Cystic fibrosis,,"Cystic fibrosis (CF) is a genetic disorder characterised by the production of sweat with a high salt content and mucus secretions with an abnormal viscosity. The disease is chronic and generally progressive, with onset usually occurring during early childhood or, occasionally, at birth (meconium ileus). Virtually any internal organ may be involved but the principle manifestations concern the breathing apparatus (chronic bronchitis), pancreas (pancreatic insufficiency, adolescent diabetes and occasionally pancreatitis) and, more rarely, the intestine (stercoral obstruction) or liver (cirrhosis). The usual presenting symptoms and signs include persistent pulmonary infection, pancreatic insufficiency, and elevated sweat chloride levels. However, many patients demonstrate mild or atypical symptoms, and clinicians should remain alert to the possibility of CF even when only a few of the usual features are present. Both criteria; clinical symptoms consistent with CF in at least one organ system and evidence of cystic fibrosis transmembrane conductance regulator (CFTR) dysfunction must be met to diagnose cystic fibrosis.",mucoviscidosis,,
CA25.0,Classical cystic fibrosis,,,,,"Classical cystic fibrosis; Pulmonary manifestations of classical cystic fibrosis; fibrocystic lung disease; Exacerbation of pulmonary manifestations of classical cystic fibrosis; Otorhinolaryngological manifestations of classical cystic fibrosis; Digestive manifestations of classical cystic fibrosis; meconium ileus of newborn; Digestive haemorrhage in classical cystic fibrosis; Distal ileal obstruction syndrome in classical cystic fibrosis; distal intestinal obstruction syndrome; Meconium ileus in classical cystic fibrosis; Meconium obstruction of intestine in mucoviscidosis; Meconium ileus in cystic fibrosis, with perforation; Hepatic manifestations of classical cystic fibrosis; Elevated hepatic enzymes in classical cystic fibrosis; Portal hypertension in classical cystic fibrosis; Liver cirrhosis in classical cystic fibrosis; Osteoporosis in classical cystic fibrosis; Male infertility in classical cystic fibrosis; Female hypofertility in classical cystic fibrosis; Polyneuropathy in classical cystic fibrosis"
CA25.1,Atypical cystic fibrosis,,,,,Atypical cystic fibrosis; Pulmonary manifestations of atypical cystic fibrosis; Exacerbation of pulmonary manifestations of atypical cystic fibrosis; Otorhinolaryngological manifestations of atypical cystic fibrosis; Digestive manifestations of atypical cystic fibrosis; Digestive haemorrhage in atypical cystic fibrosis; Distal ileal obstruction syndrome in atypical cystic fibrosis; Meconium ileus in atypical cystic fibrosis; Hepatic manifestations of atypical fibrosis; Elevated hepatic enzymes in atypical cystic fibrosis; Portal hypertension in atypical cystic fibrosis; Liver cirrhosis in atypical cystic fibrosis; Osteoporosis in atypical cystic fibrosis; Male infertility in atypical cystic fibrosis; Female hypofertility in atypical cystic fibrosis; Polyneuropathy in atypical cystic fibrosis
CA25.2,Subclinical cystic fibrosis,,,Asymptomatic cystic fibrosis,,Subclinical cystic fibrosis; Asymptomatic cystic fibrosis
