Code,title,Fully Specified Name,Description,Inclusions,Exclusions,Index Terms
MD81.11,Pelvic or perineal pain,,"Pain, an unpleasant distress sensation, which occurs in the pelvic and perineal region.",,Female pelvic pain associated with genital organs or menstrual cycle; Chronic primary bladder pain syndrome; Bladder pain; Sexual pain-penetration disorder; Chronic primary visceral pain; Chronic secondary visceral pain,Pelvic or perineal pain; pain in pelvis; pelvis pain
MD81.12,Pain localised to other parts of lower abdomen,,"Pain, an unpleasant distress sensation, which is localised to other part of lower abdomen than the pelvic or perineal region.",,Pelvic or perineal pain; Chronic primary visceral pain; Chronic secondary visceral pain,Pain localised to other parts of lower abdomen; lower abdominal pain; Rectal or anal pain; Pain in caecum; Iliac fossa pain; Groin pain
MD81.2,Generalised abdominal pain,,"Pain, an unpleasant distress sensation occurring in varying degrees of severity, or cramps, spasmodic contraction causing severe pain in the abdominal area in general.",,Chronic primary visceral pain; Chronic secondary visceral pain,Generalised abdominal pain; Generalised cramps
MD81.3,Acute abdomen,,"A clinical syndrome with acute abdominal pain that is severe, and rapid onset. Acute abdomen may be caused by a variety of disorders, injuries, or diseases.",,,Acute abdomen; Severe abdominal pain with abdominal rigidity; Severe localised abdominal pain; abdominal acute syndrome; acute abdominal pain syndrome; severe abdomen pain; severe abdominal pain; surgical abdomen
MD81.4,Other and unspecified abdominal pain,,,,Chronic primary abdominal pain syndrome; Chronic primary visceral pain; Chronic secondary visceral pain; Infantile colic,Other and unspecified abdominal pain; Colic NOS; abdominal colic; abdominal cramp; abdominal crisis; abdominal distress; abdominal pain NOS; abdominalgia; bilious colic; chronic abdominal pain NOS; colic; colicky; flank pain; periodic abdominalgia; spasmodic colic; Colon pain; colon cramp; Enteralgia; intestinal colic; intestinal cramp; intestine colic; Visceral spasm
MD82,"Intra-abdominal or pelvic swelling, mass or lump",,"This refers to the presence of abdominal or pelvic wall swelling, mass or tumour in the abdominal and pelvic regions. These mass or tumours can be recognised by visual examination and/or palpation.",,Abdominal distension; Ascites,"Intra-abdominal or pelvic swelling, mass or lump; Abdominal mass without further specification; abdominal peritoneal mass; diffuse or generalised intra-abdominal, swelling or mass, NOS; intra-abdominal lump; intra-abdominal mass; mass in abdomen; retroperitoneal mass; swelling in abdomen; Pelvic mass; diffuse or generalised pelvic swelling or mass, NOS; mass in pelvis; pelvic lump; pelvic swelling; Umbilical mass; diffuse or generalised umbilical swelling or mass; umbilical swelling"
MD90,Nausea or vomiting,,Nausea is the feeling of having an urge to vomit. Vomiting is forcing the contents of the stomach up through the oesophagus and out of the mouth.,,Functional nausea or vomiting; psychogenic vomiting; haematemesis neonatal,Nausea or vomiting
MD90.0,Nausea,,,,,Nausea; bilious attack; nauseous
MD90.1,Vomiting,,,,,Vomiting; emesis; hyperemesis; retching; Vomiting of faecal matter; stercoraceous vomiting; stercoral vomiting; Bilious vomiting; Projectile vomiting; Gastric contents regurgitation; food regurgitation; regurgitation of food; rumination; Periodic vomiting
MD91,Belching,,The liberation of gas in the upper gastrointestinal tract via the oesophagus through the mouth.,,Functional belching disorders,Belching; Eructation
MD92,Dyspepsia,,"A condition characterised by upper abdominal symptoms that suggest indigestion (painful, difficult, or disturbed digestion), which may include pain or discomfort of upper abdomen, bloating, feeling of fullness with very little intake of food, nausea and vomiting, heartburn, loss of appetite.",,Functional dyspepsia,Dyspepsia
MD93,Dysphagia,,Difficulty in swallowing which may result from neuromuscular disorder or mechanical obstruction. Dysphagia is classified into two distinct types: oropharyngeal dysphagia due to malfunction of the pharynx and upper oesophageal sphincter; and oesophageal dysphagia due to malfunction of the oesophagus.,Difficulty in swallowing,Functional swallowing disorder,"Dysphagia; Cervical dysphagia; Difficulty in swallowing; Neurogenic dysphagia; deglutition muscles paralysed; deglutition paralysis; difficulty in swallowing NOS; difficulty swallowing; impaired swallow; inadequate pharyngeal muscle; incoordinate swallowing; poor swallow; problem with swallowing; swallowing disorder NOS; swallowing hypofunction; swallowing mechanism neuromuscular failure; swallowing neurological dysfunction; swallowing problem; Dysphagia, oral phase; Dysphagia, oropharyngeal phase; Dysphagia, pharyngeal phase; Dysphagia, pharyngoesophageal phase"
MD94,Halitosis,,"Halitosis is an oral health condition in which one's mouth emits a foul odour. There are many causes of halitosis such as poor oral hygiene, tobacco and/or alcohol, and possibly a medical condition such as respiratory and digestive tract disorders.",,,Halitosis; bad breath; breath odour; breath smells offensive; breath smells unpleasant; fetid breath; foul breath; smelly breath; stomatodysodia
MD95,Heartburn,,"Substernal pain or burning sensation, usually associated with regurgitation of gastric juice into the oesophagus.",,Functional heartburn; Pain in throat or chest; Functional dyspepsia,Heartburn; brash; burning reflux; heartburn symptom; pyrosis; waterbrash
ME00,Abdominal compartment syndrome,,"Abdominal compartment syndrome is a condition of organ dysfunction caused by increased intra-abdominal pressure (intra-abdominal hypertension), possibly due to intra-abdominal haemorrhage, retroperitoneal haematoma, or intestinal oedema, often occurred after surgical intervention or trauma, or often associated with septic condition. The importance of this clinical entity was recognised recently in the end of the 20th Century. Usually the abdominal distension due to primary ischaemic bowel injury was excluded from this clinical entity.",,,Abdominal compartment syndrome
ME01,Abdominal distension,,"This is a condition in which the abdomen feels full and tight because of swelling of the abdomen, usually due to an increased amount of intestinal gas, but occurs sometimes when fluid, substances or mass are accumulating or expanding in the abdomen.",,Flatulence,Abdominal distension; abdomen distension; abdominal and intestinal tympanite; swollen abdomen; Gaseous abdominal distension; bloating
ME02,Abdominal rigidity,,"Abdominal rigidity is stiffness of the muscles in the belly area, which can be felt when touched or pressed.",,that with severe abdominal pain,"Abdominal rigidity; abdominal rigidity, unspecified site; observation of abdominal rigidity; rigid abdomen"
ME03,Abnormal bowel sounds,,"Bowel sounds are caused by the products of digestion as they move through the lower gastrointestinal tract, usually heard on auscultation. Abnormal bowel sounds are reduced or increased bowel sounds which provide valuable information about the disorders of bowel movement.",,,
ME03.0,Hyperactive bowel sounds,,,,,Hyperactive bowel sounds; hyperactivity of bowel sounds
ME03.1,Absent bowel sounds,,,,,Absent bowel sounds; absence of bowel sounds
ME04,Ascites,,"Accumulation or retention of free fluid in the abdominal peritoneal cavity between the tissues lining the abdomen and abdominal organs. The fluid may be serous, haemorrhagic, or the result of inflammation or tumour metastasis to the peritoneum.",,,
ME04.0,Fluid in peritoneal cavity,,,,Malignant ascites; Pelvic fluid,Fluid in peritoneal cavity; chronic peritoneal effusion; hydroperitoneum; hydroperitonia; peritoneal cavity fluid; peritoneal dropsy; peritoneal effusion
ME05,Change in bowel habit,,"Bowel habits are the time, size, amount, consistency and frequency of bowel movements throughout the day. A change in bowel habits is any alteration in regular bowel habits.",,Functional diarrhoea,
ME05.0,Constipation,,"Constipation is an acute or chronic condition in which bowel movements occur less often than usual or consist of hard, dry stools that are often painful or difficult to pass. Here constipation other than specifically described elsewhere, such as in motility disorders of intestine or in functional bowel diseases, is described.",faecal impaction,"Atonic constipation; Slow transit constipation; Neurogenic constipation; Spastic constipation; Functional constipation; Functional constipation of infants, toddlers or children",Constipation; chronic constipation with overflow; constipated; difficult passing motion; difficulty defecating; difficulty opening bowels; difficulty passing stool; faecal impaction; faecal retention; obstipation; Simple constipation
ME05.1,Diarrhoea,,"Diarrhoea is an acute or chronic condition in which there is an increased frequency or decreased consistency of bowel movements, usually with excessive and frequent evacuation of watery faeces. Here diarrhoea other than specifically described elsewhere, such as in motility disorders of intestine or in functional bowel diseases, is described.",frequent/loose bowel movements; watery stools,Melaena; Change in faeces or bowel movements; Functional diarrhoea; infectious diarrhoea,Diarrhoea; catarrhal diarrhoea; frequent/loose bowel movements; noninfectious diarrhoea; overflow diarrhoea; watery diarrhoea; watery stools
ME06,Chronic enteritis of uncertain aetiology,,,,Gastroenteritis or colitis of infectious origin,Chronic enteritis of uncertain aetiology
ME07,Faecal incontinence,,"Failure of voluntary control of the anal sphincters, with involuntary passage of faeces and flatus.",,Functional faecal incontinence; Nonretentive faecal incontinence in children; nonorganic encopresis,
ME07.0,Faecal smearing,,,,,Faecal smearing; faecal soiling
ME07.1,Incomplete defaecation,,,,Constipation,Incomplete defaecation
ME07.2,Faecal urgency,,,,,Faecal urgency
ME08,Flatulence or related conditions,,Production or presence of gas in the gastrointestinal tract which may be expelled through the anus. This category includes also gas induced pain and incontinence of flatus.,Gas pain,Abdominal distension,Flatulence or related conditions; Abdominal tympany; Flatulence; flatulent; flatulent colic; flatus; Gas pain; gas abdominal pain; gas induced abdominal pain; gas induced pain; gas related abdominal pain; gas related pain; Gas intestinal pain; gas induced intestinal pain; gas related intestinal pain; gas stomach pain; gas induced stomach pain; gas related stomachl pain; Incontinence of flatus
ME09,Rectal tenesmus,,"A symptom, where there is a feeling of constantly needing to pass stools, despite an empty colon.",,,Rectal tenesmus; tenesmus NOS
ME0A,Visible peristalsis,,The wavelike increased peristaltic motions of the intestines by which contents are forced onward toward the opening in such a way that they become visible through the abdominal walls by visual examination.,,,Visible peristalsis; Hyperperistalsis; Reverse peristalsis
ME0B,"Problems with defaecation, not otherwise specified",,,,Incomplete defaecation; Functional constipation; Functional defaecation disorders,"Problems with defaecation, not otherwise specified"
ME10,Abnormalities related to hepatobiliary system,,,,,Abnormalities related to hepatobiliary system
ME10.0,Hepatomegaly or splenomegaly,,Hepatomegaly is swelling of the liver beyond its normal size and splenomegaly is an enlargement of the spleen beyond its normal size.,,,Hepatomegaly or splenomegaly
ME10.00,"Hepatomegaly, not elsewhere classified",,,,,"Hepatomegaly, not elsewhere classified; Hepatomegaly NOS; acute hepatic hypertrophy; acute hepatomegaly; acute liver hypertrophy; enlarged liver; enlargement of liver; liver enlargement; liver hypertrophy; tumefaction of liver; Acute congestive hepatomegaly"
ME10.01,"Splenomegaly, not elsewhere classified",,"This refers to swelling of the spleen beyond its normal size, not elsewhere described.",,Hypersplenism,"Splenomegaly, not elsewhere classified; Splenomegaly NOS; enlarged spleen NOS; idiopathic splenomegaly; spleen hypertrophy; spleen palpable; splenomegalia; splenomegalic cirrhosis"
ME10.02,Hepatomegaly with splenomegaly,,"This refers to swelling of the liver and spleen beyond its normal size, not elsewhere described.",,,Hepatomegaly with splenomegaly; Hepatosplenomegaly NOS; hepatosplenomegaly
ME10.1,Unspecified jaundice,,"A clinical manifestation of hyperbilirubinemia of unspecified origin, characterised by the yellowish staining of the skin; mucus membranes and sclera.",,neonatal jaundice,Unspecified jaundice; bilirubinaemia; icteric; icterus; icterus NOS; jaundice; jaundiced; yellow jaundice; Cholaemia
ME20,Clinical findings in specimens from digestive organs or abdominal cavity,,,,Other faecal abnormalities,
ME20.0,Abnormal level of enzymes in specimens from digestive organs or abdominal cavity,,,,,Abnormal level of enzymes in specimens from digestive organs or abdominal cavity
ME20.1,Abnormal level of hormones in specimens from digestive organs or abdominal cavity,,,,,Abnormal level of hormones in specimens from digestive organs or abdominal cavity
ME20.2,"Abnormal level of drugs, medicaments or biological substances in specimens from digestive organs or abdominal cavity",,,,,"Abnormal level of drugs, medicaments or biological substances in specimens from digestive organs or abdominal cavity"
ME20.3,Abnormal level of substances chiefly nonmedicinal as to source in specimens from digestive organs or abdominal cavity,,,,,Abnormal level of substances chiefly nonmedicinal as to source in specimens from digestive organs or abdominal cavity
ME20.4,Abnormal immunological findings in specimens from digestive organs or abdominal cavity,,,,,Abnormal immunological findings in specimens from digestive organs or abdominal cavity
ME20.5,Abnormal microbiological findings in specimens from digestive organs or abdominal cavity,,,,,Abnormal microbiological findings in specimens from digestive organs or abdominal cavity; Positive culture findings in specimens from digestive organs or abdominal cavity
ME20.6,Abnormal cytological findings in specimens from digestive organs or abdominal cavity,,,,,Abnormal cytological findings in specimens from digestive organs or abdominal cavity
ME20.7,Abnormal histological findings in specimens from digestive organs or abdominal cavity,,,,,Abnormal histological findings in specimens from digestive organs or abdominal cavity
ME21,Clinical findings on diagnostic imaging of liver or biliary tract,,,,,Clinical findings on diagnostic imaging of liver or biliary tract; Abnormal diagnostic imaging of liver; Nonvisualisation of gallbladder
ME22,Clinical findings on diagnostic imaging of digestive tract,,,,,Clinical findings on diagnostic imaging of digestive tract; abnormal diagnostic imaging of gastrointestinal tract; Pancreatic mass; pancreatic head mass
ME23,Results of function studies of the digestive system,,,,,Results of function studies of the digestive system; Abnormal results of liver function studies; liver function studies abnormal; liver function tests abnormal; nonspecific abnormal results of function study of liver
ME24,Clinical manifestations of the digestive system,,,,,Clinical manifestations of the digestive system
ME24.0,Digestive system abscess,,This is a clinical form of sign indicating the presence of abscess in digestive system. This category will be used for postcoordination codes as complications of underlying illness.,,,Digestive system abscess; unspecified abscess of the digestive system; Enteric abscess
ME24.1,Digestive system fistula,,This is a clinical form of sign indicating the presence of fistula in the digestive tract. This category will be used for postcoordination codes as complications of underlying illness.,,,Digestive system fistula
ME24.2,Digestive system obstruction,,This is a clinical form of a sign indicating obstruction of digestive tract. This category will be used for postcoordination codes as complications of underlying illness.,,,Digestive system obstruction
ME24.3,Digestive system perforation,,This is a clinical form of sign indicating perforation of digestive tract. This category will be used for postcoordination codes as complications of underlying illness.,,,
ME24.30,Perforation of small intestine,,"Small intestinal perforation is a complete penetration of the wall of small intestine, often resulting in the leakage of small intestinal contents into the abdominal cavity.",,Primary ulcer of small intestine; Diverticulitis of small intestine; perforation due to Crohn disease; perforation due to obstruction; perforation due to malignant neoplasm,Perforation of small intestine; Non-traumatic perforation of small intestine
ME24.31,Perforation of large intestine,,"Perforation of large intestine is a complete penetration of the colonic wall, often resulting in the leakage of luminal contents into the abdominal cavity. Perforation of large intestine results in the potential for bacterial contamination of the abdominal cavity and peritonitis.",,Diverticular disease of large intestine; Ulcerative colitis; Crohn disease; Neoplasms of the large intestine,Perforation of large intestine; bowel perforation NOS; perforated bowel NOS; perforated intestine NOS; perforation of intestine NOS; rupture of intestine NOS; Non-traumatic perforation of large intestine
ME24.35,Perforation of gallbladder or bile ducts,,This is perforation in the small organ that aids mainly in fat digestion and concentrates bile produced by the liver and in any of a number of long tube-like structures that carry bile.,Rupture of cystic duct or gallbladder; Rupture of gallbladder or bile duct,,Perforation of gallbladder or bile ducts; Rupture of cystic duct or gallbladder; Rupture of gallbladder or bile duct; Perforation of cystic duct; cystic duct perforation; cystic duct rupture; rupture of cystic duct; ruptured cystic duct; Perforation of gallbladder; gallbladder rupture; perforated gallbladder; rupture of gallbladder; ruptured gallbladder; Perforation of bile duct; Rupture of bile duct; bile duct perforation; bile duct rupture; biliary duct perforation; biliary duct rupture; common bile duct perforation; common biliary duct perforation; common duct perforation; ruptured bile duct; ruptured biliary duct
ME24.4,Digestive system stenosis,,This is a clinical form of sign indicating stenosis of digestive tract. This category will be used for postcoordination codes as complications of underlying illness.,,,Digestive system stenosis
ME24.5,Digestive system ulcer,,,,,Digestive system ulcer
ME24.6,Digestive system dilatation,,This is a clinical form of sign indicating the excess dilatation of lumen in the digestive tract. This category will be used for postcoordination codes as complications of underlying illness.,,,Digestive system dilatation
ME24.7,Digestive system incarceration,,This is a clinical form of sign indicating the presence of incarceration in the digestive tract. This category is to be used for postcoordination codes particularly in case of haemorrhoids and hernia as complications of underlying illness.,,,Digestive system incarceration
ME24.8,Digestive system strangulation or gangrene,,This is a clinical form of sign indicating the presence of strangulation and/or gangrene in the digestive tract. This category is to be used for postcoordination codes particularly in case of mechanical bowel obstruction and hernia as complications of underlying illness.,,,Digestive system strangulation or gangrene
ME24.9,Gastrointestinal bleeding,,,,,
ME24.90,"Acute gastrointestinal bleeding, not elsewhere classified",,,,,"Acute gastrointestinal bleeding, not elsewhere classified; acute digestive system bleeding; acute gastrointestinal bleed; acute gastrointestinal haemorrhage NOS"
ME24.91,"Chronic gastrointestinal bleeding, not elsewhere classified",,,,,"Chronic gastrointestinal bleeding, not elsewhere classified; chronic gastrointestinal haemorrhage NOS"
ME24.A,"Other digestive system haemorrhage, not elsewhere classified",,,,,"Other digestive system haemorrhage, not elsewhere classified"
ME24.A0,Obscure gastrointestinal bleeding,,"Obscure gastrointestinal bleeding (OGIB) is defined as gastrointestinal bleeding with no source identified at upper and lower endoscopy. Despite a thorough endoscopic examination, the origin of the blood loss remains unexplained and observed for further bleeding.",,,Obscure gastrointestinal bleeding; OGIB - [obscure gastrointestinal bleeding]
ME24.A1,Haemorrhage of anus or rectum,,"Bleeding from anus or rectum. The bleeding due to specific diseases classified elsewhere (haemorrhoid, cancer, infection etc) is excluded from here.",,,Haemorrhage of anus or rectum; Haemorrhage of anus; anus haemorrhage; bleeding from anus; Haemorrhage of rectum; PR - [per rectum] bleeding; bleeding per rectum; blood per rectum; per rectal bleeding; per rectal blood loss; proctorrhagia; rectal bleeding; rectal haemorrhage; rectorrhagia; rectum bleeding; rectum haemorrhage
ME24.A2,Oesophageal haemorrhage,,,,,Oesophageal haemorrhage; haemorrhage of oesophagus NOS; oesophageal bleeding
ME24.A3,Haematochezia,,"Haematochezia is the passage of fresh blood through the anus, usually in or with stools (contrast with melena). Haematochezia is commonly associated with lower gastrointestinal bleeding.",,,Haematochezia
ME24.A4,Melaena,,"It is bloody stools that indicate bleeding from vascular system in the digestive tract. It is also described as black, tarry, and foul-smelling stools or red/maroon-coloured stools that contain degraded blood.",,occult blood in faeces,Melaena; altered blood in stool; altered blood passed per rectum; black tarry stool; blood in faeces; blood in stool; bloody stool; faeces bloodstained; melaena due to gastrointestinal haemorrhage; passage of bloody stools; tarry stools
ME24.A5,Haematemesis,,"Vomiting of blood that is either fresh bright red, or older ""coffee-ground"" in character. Vomiting blood is a regurgitation of blood through the upper gastrointestinal tract and it generally indicates bleeding of the upper gastrointestinal tract.",,,Haematemesis; blood in vomit; vomiting blood
ME24.A6,Positive occult blood in stool,,"Positive tests (positive stool) determined by faecal occult blood testing (FOBT), which aims to detect subtle blood loss in the gastrointestinal tract. Positive occult blood in stool may suggest gastrointestinal bleeding and warrant further investigation, especially for malignancy.",,,Positive occult blood in stool; FOBT - [faecal occult blood testing]
ME60,Skin lesion of uncertain or unspecified nature,,To be used where there is either significant uncertainty or alternatively no information as to the nature of a circumscribed skin lesion. This is of particular importance with regard to whether or not the lesion may be malignant.,,,
ME60.0,Skin lesion of uncertain nature,,This denotes the presence of a skin lesion but uncertainty as to its nature. No inference as to whether the lesion might be of serious significance (e.g. suspected skin cancer) is made.,,,"Skin lesion of uncertain nature; Cutaneous neoplasm of uncertain nature; Neoplasm of skin of uncertain nature; Skin lesion of uncertain nature, head; Skin lesion of uncertain nature, neck; Skin lesion of uncertain nature, trunk; Skin lesion of uncertain nature, upper limb; Skin lesion of uncertain nature, lower limb"
ME60.1,Pigmented skin lesion of uncertain nature,,This denotes the presence of a pigmented skin lesion but uncertainty as to its nature. No inference as to whether the lesion might be of serious significance (e.g. suspected skin cancer) is made.,,,"Pigmented skin lesion of uncertain nature; Melanocytic skin lesion of uncertain nature; Pigmented skin tumour of uncertain nature; Pigmented skin lesion of uncertain nature, head; Pigmented skin lesion of uncertain nature, neck; Pigmented skin lesion of uncertain nature, trunk; Pigmented skin lesion of uncertain nature, upper limb; Pigmented skin lesion of uncertain nature, lower limb"
ME60.2,Ulcer of skin of uncertain nature,,This denotes the presence of a skin ulcer but uncertainty as to its nature. No inference as to whether the ulcer might be of serious significance (e.g. suspected skin cancer) is made.,,,"Ulcer of skin of uncertain nature; Ulcer of skin of uncertain nature, head; Ulcer of skin of uncertain nature, neck; Ulcer of skin of uncertain nature, trunk; Anogenital ulcer of uncertain nature; Ulcer of skin of uncertain nature, upper limb; Ulcer of skin of uncertain nature, lower limb"
ME60.3,Keratosis of skin of uncertain or unspecified nature,,,,,Keratosis of skin of uncertain or unspecified nature; Keratosis of skin; Cutaneous horn; Cornu cutaneum; Keratin horn
