Code,title,Fully Specified Name,Description,Inclusions,Exclusions,Index Terms
CA26,Chronic bronchiolitis,,"Bronchiolitis and bronchiolitis obliterans are general terms used to describe a nonspecific inflammatory injury that primarily affects the small airways and generally spares the interstitium. Bronchiolitis may be caused by inhalation injury, infection, or drugs; associated with organ transplantation or connective tissue disease; or may be idiopathic. The main pathologic categories of bronchiolitis are: constrictive, proliferative, follicular, airway-centred interstitial fibrosis, and diffuse panbronchiolitis. The constrictive and proliferative patterns may occur together.",,,
CA26.0,Chronic obliterative bronchiolitis,,"Bronchiolitis obliterans is commonly used to describe a number of unrelated conditions whose common end point is functional obstruction of bronchioles. A typical form is constrictive bronchiolitis. Constrictive bronchiolitis is an uncommon histologic finding characterised by alterations in the walls of membranous and respiratory bronchioles, often without extensive changes in alveolar ducts and alveolar walls. These changes lead to concentric narrowing or complete obliteration of the airway lumen. The clinical manifestations of constrictive bronchiolitis usually include progressive airflow obstruction, sometimes in the presence of a relatively normal chest radiograph. The clinical severity depends upon the type, extent, and severity of the initial lung injury.",,"Respiratory conditions due to inhalation of chemicals, gases, fumes or vapours",Chronic obliterative bronchiolitis; OB - [obliterative bronchiolitis]; obliterative bronchiolitis; Constrictive bronchiolitis
CA26.1,Diffuse panbronchiolitis,,"Diffuse panbronchiolitis (DPB) is an idiopathic inflammatory disease principally affecting the respiratory bronchioles, causing a progressive suppurative and severe obstructive respiratory disorder. Onset occurs in the second to fifth decade of life and manifests by chronic cough, exertional dyspnoea, and sputum production. Most patients also have chronic paranasal sinusitis. If left untreated, DPB progresses to bronchiectasis, respiratory failure and death. A significant improvement in the prognosis has been reported thanks to the use of long-term therapy with macrolide antibiotics, the effect of which is attributed to an anti-inflammatory and immunoregulatory action.",,,Diffuse panbronchiolitis
CA27,Tracheobronchitis,,Tracheobronchitis is inflammation of the trachea and bronchi.,,,
CA27.0,Tracheobronchopathia osteochondroplastica,,"Tracheobronchopathia osteochondroplastica is a rare disorder of unknown cause, seen with a frequency of 0.4 percent at bronchoscopy, affecting the large airways. It is characterised by the development of multiple osseous and cartilaginous submucosal nodules connected to tracheal cartilage. The abnormality spares the posterior tracheal membranous wall. In spite of marked radiographic changes, patients are only rarely symptomatic since severe airway obstruction is unusual. Linear tracheoplasty may be required in patients with symptomatic airway obstruction.",,,Tracheobronchopathia osteochondroplastica
CA27.1,Tracheobronchomegaly,,Tracheobronchomegaly is a disorder of unknown cause defined by dilatation of trachea and large bronchi presenting in adults.,,,Tracheobronchomegaly; Congenital tracheobronchomegaly; Mounier-Kuhn syndrome
CA40,Pneumonia,Infectious alveolar inflammation,"A disease of the lungs, frequently but not always caused by an infection with bacteria, virus, fungus, or parasite. This disease is characterised by fever, chills, cough with sputum production, chest pain and shortness of breath. Confirmation is, for example, by chest x-ray.",infectious pneumonia,Pneumonitis,
CA40.0,Bacterial pneumonia,,"A disease of the pulmonary system, caused by an infection with a bacterial source. This disease is characterised by fever, lethargy, headache, myalgia, vomiting, or coughing. Transmission is by inhalation of infected respiratory secretions. Confirmation is by identification of the bacterial source in a sputum sample.",bronchopneumonia due to bacteria other than S. pneumoniae and H. influenzae,Congenital pneumonia; Legionellosis,
CA40.00,Pneumonia due to Chlamydophila pneumoniae,,"A disease of the pulmonary system, caused by an infection with the gram-negative bacteria Chlamydia pneumoniae. This disease commonly presents with a gradual onset of cough with low-grade fever. This disease may also present with pharyngitis, laryngitis, and sinusitis. Transmission is by inhalation of infected respiratory secretions. Confirmation is by identification of Chlamydia pneumoniae in a sputum sample.",,,Pneumonia due to Chlamydophila pneumoniae; pneumonia due to Chlamydia; pneumonia due to Chlamydia pneumoniae; pneumonia due to Chlamydiaceae; Late-onset pneumonia due to Chlamydia
CA40.01,Pneumonia due to Escherichia coli,,"A disease of the pulmonary system, caused by an infection with the gram-negative bacteria Escherichia coli. This disease is characterised by fever, cough, and dyspnoea. Transmission is commonly by inhalation of infected respiratory secretions. Confirmation is by identification of Escherichia coli in blood, sputum, or pleural fluid samples.",,,Pneumonia due to Escherichia coli; Escherichia coli lobar pneumonia; pneumonia due to E. coli; Early-onset pneumonia due to Escherichia coli; Late-onset pneumonia due to Escherichia coli
CA40.02,Pneumonia due to Haemophilus influenzae,,"A disease of the pulmonary system, caused by an infection with the gram-negative bacteria Haemophilus influenzae. This disease is characterised by cough, shortness of breath, fever, chills, muscle aches, and chest pain. Transmission is by inhalation of infected respiratory secretions or direct contact. Confirmation is by identification of Haemophilus influenzae in blood or other typically sterile body fluid.",bronchopneumonia due to H. influenzae,Congenital pneumonia,Pneumonia due to Haemophilus influenzae; bronchopneumonia due to H. influenzae; bronchopneumonia due to hemophilus influenzae; haemophilus influenzae lobar pneumonia; pneumonia due to H. influenzae; pneumonia due to hemophilus influenzae; Early-onset pneumonia due to Haemophilus influenzae; early-onset pneumonia due to H. influenzae
CA40.03,Pneumonia due to Klebsiella pneumoniae,,"A disease of the pulmonary system, caused by an infection with the gram-negative bacteria Klebsiella pneumoniae. This infection common presents with thick, haemorrhagic, mucoid sputum. Transmission is by inhalation of infected respiratory secretions. Confirmation is by identification of Klebsiella pneumoniae in a sputum sample.",,,Pneumonia due to Klebsiella pneumoniae; klebsiella lobar pneumonia
CA40.04,Pneumonia due to Mycoplasma pneumoniae,,"A disease of the pulmonary system, caused by an infection with Mycoplasma pneumoniae. This infection commonly presents with a non-productive cough, chest pain, or fever. Transmission is by inhalation of infected respiratory secretions. Confirmation is by identification of Mycoplasma pneumoniae in a sputum sample.",,,Pneumonia due to Mycoplasma pneumoniae; Eaton agent pneumonia; endemic pneumonia; infection by PPLO - [pleuropneumonia-like-organism]; mycoplasma infection with Eaton agent; mycoplasmal pneumonia; pneumonia due to PPLO - [pleuropneumonia-like-organism]; primary atypical pneumonia due to mycoplasma pneumoniae
CA40.05,Pneumonia due to Pseudomonas aeruginosa,,"A disease of the pulmonary system, caused by an infection with the gram-negative bacteria Pseudomonas aeruginosa. This disease is characterised by fever, cough, and dyspnoea.",,,Pneumonia due to Pseudomonas aeruginosa; pseudomonal pneumonia; pseudomonas lobar pneumonia; pseudomonas pneumonia; Early-onset pneumonia due to Pseudomonas aeruginosa; Late-onset pneumonia due to Pseudomonas aeruginosa
CA40.06,Pneumonia due to Staphylococcus,,"A disease of the pulmonary system, caused by an infection with the gram-positive bacteria Staphylococcus. This disease is characterised by fever, cough, dyspnoea, and pulmonary abscesses.",,,Pneumonia due to Staphylococcus; acute staphylococcal pneumonia; staphylococcal bronchopneumonia; staphylococcal double pneumonia; staphylococcal lobar pneumonia; staphylococcal pneumonia; staphylococcal purulent pneumonia; staphylococcus pneumonia; Late acquired pneumonia due to Coagulase negative Staphylococci methicillin sensitive; Late-onset pneumonia due to Staphylococcus aureus
CA40.07,Pneumonia due to Streptococcus pneumoniae,,"A disease of the pulmonary system, caused by an infection with the gram-positive bacteria Streptococcus pneumoniae. This disease is characterised by an acute onset of fever and chills, or rigors. This disease may also present with chest pain, productive cough, dyspnoea, tachypnoea, hypoxia, or tachycardia. Transmission is by inhalation of infected respiratory secretions, or indirect contact. Confirmation is by identification of Streptococcus pneumoniae in a sputum sample.",Bronchopneumonia due to S. pneumoniae,Pneumonia due to beta-haemolytic Streptococcus; congenital pneumonia due to S. pneumoniae; Pneumonia due to other streptococci,Pneumonia due to Streptococcus pneumoniae; Bronchopneumonia due to S. pneumoniae; Bronchopneumonia due to streptococcus pneumoniae; pneumococcal lobar pneumonia; pneumococcal pneumonia; pneumococcus pneumonia; pyemic pneumococcal embolism with pneumonia; streptococcal pneumoniae pneumonia; streptococcus pneumoniae lobar pneumonia; Early-onset pneumonia due to Streptococcus pneumoniae
CA40.08,Pneumonia due to beta-haemolytic Streptococcus,,"A disease of the lungs, caused by an infection with the gram-positive bacteria beta-haemolytic Streptococcus. This disease is characterised by an acute onset of fever and chills, or rigors. This presents with chest pain, productive cough, dyspnoea, tachypnoea, hypoxia, or tachycardia. Transmission is by inhalation of infected inspiratory secretions, or direct contact.","pneumonia due to Streptococcus, group B",,"Pneumonia due to beta-haemolytic Streptococcus; Group B streptococcal pneumonia; pneumonia due to Streptococcus, group B; Early-onset pneumonia due to Group B Streptococcus"
CA40.1,Viral pneumonia,,"A disease of the pulmonary system, caused by an infection with a viral source. This disease is characterised by fever, lethargy, headache, myalgia, vomiting, or coughing. Transmission is by inhalation of infected respiratory secretions. Confirmation is by identification of the viral source in a sputum sample.",bronchopneumonia due to viruses other than influenza viruses,Influenza; aspiration pneumonia; Aspiration pneumonitis due to anaesthesia during labour or delivery; Pulmonary complications of anaesthesia during pregnancy; Pulmonary complications of anaesthesia during the puerperium; Congenital pneumonia; Pneumonitis due to solids or liquids; Idiopathic interstitial pneumonitis; lipid pneumonia; Severe acute respiratory syndrome,
CA40.10,Pneumonia due to Adenovirus,,"A disease of the pulmonary system, caused by an infection with adenovirus. This disease is characterised by fever, chills, or rigors. This disease may also present with chest pain, productive cough, dyspnoea, tachypnoea, hypoxia, and tachycardia. Transmission is by droplet transmission. Confirmation is by identification of adenovirus in a sputum sample.",,,Pneumonia due to Adenovirus; adenoviral pneumonia; adenovirus pneumonia; adenovirus viral pneumonia
CA40.11,Pneumonia due to Respiratory syncytial virus,,"A disease caused by an infection with respiratory syncytial virus. This disease is characterised by an inflammatory condition of the lung commonly affecting the alveoli (pneumonia), leading to coughing, sneezing, fever, or wheezing. This disease may be severe in premature babies and those with concurrent disease or immunosuppression. Transmission is by direct contact, droplet transmission, or indirect contact with infected respiratory secretions. Confirmation is by identification of respiratory syncytial virus, commonly through antigen detection or cell culture.",,,Pneumonia due to Respiratory syncytial virus; RSV pneumonia; pneumonia respiratory syncytial viral; Late-onset pneumonia due to Respiratory syncytial Virus
CA40.12,Pneumonia due to parainfluenza virus,,"A disease of the pulmonary system, caused by an infection with parainfluenza virus. This disease is characterised by fever, malaise, cough, or tachypnoea. Transmission is by inhalation of infected respiratory secretions, direct contact, or through fomites. Confirmation is by identification of the parainfluenza virus in respiratory secretions, detection of a significant rise in parainfluenza specific IgG antibodies in paired serum, or detection of parainfluenza specific IgM antibodies in a single serum sample.",,,Pneumonia due to parainfluenza virus; Parainfluenza virus pneumonia; parainfluenza viral pneumonia; parainfluenzal pneumonia
CA40.13,Pneumonia due to Human metapneumovirus,,"A disease of the pulmonary system, caused by an infection with Human metapneumovirus. This disease is characterised by fever, myalgia, rhinorrhoea, dyspnoea, tachypnoea, or wheezing. This disease also presents with symptoms of pneumonia. Transmission is by direct or indirect contact, inhalation of infected respiratory sections, or through fomites. Confirmation is by identification of Human metapneumovirus in a nasopharyngeal, nose, or throat swab or blood sample.",,,Pneumonia due to Human metapneumovirus; Human metapneumovirus infection resulting in pneumonia; Human metapneumovirus pneumonia
CA40.2,Fungal pneumonia,,,,,
CA40.20,Pneumonia due to pneumocystis,,"A disease of the pulmonary system, caused by an infection with the fungi Pneumocystis jirovecii. This disease is characterised by fever, dry cough, shortness of breath, or fatigue. Transmission is by opportunistic infection. Confirmation is by identification of Pneumocystis jirovecii in a lung fluid or tissue sample.",,,Pneumonia due to pneumocystis; Pneumocystis pneumonia; plasma cells pneumonia; Pneumonia due to Pneumocystis jirovecii; pneumonia due to Pneumocystis carinii
CA41,Acute bronchiolitis,,"An acute disease of the bronchioles, commonly caused by an infection with a bacteria or viral source. This disease is characterised by inflammation of the bronchioles and coryza. This disease presents with cough, wheezing, tachypnoea, fever, or chest retraction. Transmission is by inhalation of infected respiratory secretions. Confirmation is by identification of the infectious agent in a sputum or blood sample.",,,
CA41.0,Acute bronchiolitis due to respiratory syncytial virus,,"A disease of the bronchioles, caused by an infection with respiratory syncytial virus. This disease is characterised by inflammation of the bronchioles. This disease may present with cough, wheezing, or shortness of breath. Transmission is by direct contact, droplet transmission, or indirect contact with infected respiratory secretions. Confirmation is by identification of respiratory syncytial virus from nasopharyngeal swabs.",,,Acute bronchiolitis due to respiratory syncytial virus
CA42,Acute bronchitis,,"An acute disease of the bronchi, commonly caused by an infection with a bacterial or viral source. This disease is characterised by inflammation of the bronchi. This disease presents with cough, wheezing, chest pain or discomfort, fever, or dyspnoea. Transmission is by inhalation of infected respiratory secretions. Confirmation is by identification of the infectious agent in a sputum sample.",,"Acute chemical bronchitis; Acute bronchitis due to chemical fumes; Acute noninfectious bronchitis; Chronic bronchitis, NOS; Mucopurulent chronic bronchitis; bronchitis, chronic: obstructive; Simple chronic bronchitis; Tracheobronchitis, NOS; tracheobronchitis: chronic; tracheobronchitis: chronic obstructive",
CA42.0,Acute bronchitis due to Streptococcus,,"A disease of the bronchi, caused by an infection with the gram-positive bacteria Streptococcus. This disease is characterised by inflammation of the bronchi leading to cough, sputum production, or shortness of breath and wheezing. Transmission is by inhalation of infected respiratory secretions. Confirmation is by identification of Streptococcus in a sputum sample.",,,"Acute bronchitis due to Streptococcus; Acute or subacute bronchitis, pneumococcal"
CA42.1,Acute bronchitis due to Rhinovirus,,"A disease of the pulmonary system, caused by an infection with rhinovirus. This disease is characterised by cough, with or without production of sputum. Transmission is by inhalation of infected respiratory secretions, or direct contact.",,,Acute bronchitis due to Rhinovirus
CA42.2,Acute bronchitis due to Respiratory syncytial virus,,"Rapid onset inflammation of the large airways in the lung, including any part of the bronchi due to infection with respiratory syncytial virus.",,,Acute bronchitis due to Respiratory syncytial virus
CA42.3,Acute bronchitis due to Parainfluenza virus,,"A disease of the bronchi, caused by an acute infection with parainfluenza virus. This disease is characterised by acute inflammation of the bronchi leading to cough, sputum production, wheezing, or shortness of breath. Transmission is by inhalation of infected respiratory secretions, direct contact, or through fomites. Confirmation is by identification of the parainfluenza virus in respiratory secretions, detection of a significant rise in parainfluenza specific IgG antibodies in paired serum, or detection of parainfluenza specific IgM antibodies in a single serum sample.",,,Acute bronchitis due to Parainfluenza virus
CA42.4,Acute bronchitis due to Haemophilus influenzae,,"A disease of the bronchi, caused by an infection with the gram-negative bacteria Haemophilus influenzae. This disease is characterised by acute inflammation of the bronchi leading to cough, sputum production, wheezing or shortness of breath. Transmission is by inhalation of infected respiratory secretions, or direct contact. Confirmation is by identification of Haemophilus influenzae in blood or other typically sterile body fluid.",,,Acute bronchitis due to Haemophilus influenzae; acute bronchitis due to H. influenzae
CA42.5,Acute bronchitis due to Coxsackievirus,,"A disease of the pulmonary system, caused by an infection with Coxsackie virus. This disease is characterised by cough, fever, or tachypnoea. Transmission is by the faecal-oral route, or vertical transmission. Confirmation is by identification of coxsackievirus in upper respiratory secretion samples.",,,Acute bronchitis due to Coxsackievirus
CA43,Abscess of lung or mediastinum,,,,Abscess of pleural cavity,
CA43.0,Gangrene or necrosis of lung,,"The term ""necrotizing pneumonia"" or ""lung gangrene"" is used to distinguish pulmonary necrosis with multiple small abscesses from a larger cavitary lesion (lung abscess).",,,Gangrene or necrosis of lung; Lung gangrene; gangrenous pneumonia; pulmonary gangrene; Lung necrosis; ischemic lung necrosis; ischemic pulmonary necrosis; necrotic lung; necrotic pneumonia; necrotising pneumonia; pulmonary necrosis; Acute necrotic pneumonia
CA43.1,Abscess of lung with pneumonia,,,,,Abscess of lung with pneumonia
CA43.2,Abscess of lung without pneumonia,,,,,Abscess of lung without pneumonia; abscess of lung; abscess of lung NOS; apical lung abscess; multiple abscess of lung; pulmonary abscess; Miliary lung abscess
CA43.3,Abscess of mediastinum,,,,,Abscess of mediastinum; mediastinal abscess
CA44,Pyothorax,,"Suppurative inflammation of the pleural space, typically due to acute bacterial infection. It can occur as a complication of pneumonia, thoracotomy, abscesses (lung, hepatic, or subdiaphragmatic), or penetrating trauma with a secondary infection.",empyema,due to tuberculosis,Pyothorax; acute pyothorax; empyema; Pyothorax with fistula; chest fistula NOS; empyema with fistula; empyema with thoracic fistula; pleural empyema with fistula; thoracic abscess with fistula; thoracic fistula; Abdominothoracic fistula; thoracoabdominal fistula; Bronchial fistula; bronchus fistula; Broncho-oesophageal fistula; bronchoesophageal fistula; oesophagobronchial fistula; Bronchopleural fistula; Bronchovisceral fistula; Fistula of costal region; Chest wall fistula; Hepatopulmonary fistula; Chest abscess with fistula; Hepatopleural fistula; Lung fistula; pulmonary fistula; Mediastinum fistula; mediastinal fistula; Mediastinobronchial fistula; Oesophagopleural-cutaneous fistula; Pleural abscess with fistula; Mediastinocutaneous fistula; Oesophagotracheal fistula; tracheoesophageal fistula; Pulmonoperitoneal fistula; Pyopneumothorax fistula; Thoracogastric fistula; Thoracointestinal fistula; Pyothorax without fistula; chest empyema; thoracic empyema; Abscess of pleural cavity; pleural abscess; thoracic abscess; Supradiaphragmatic empyema; Staphylococcal pleurisy; Acute staphylococcal pleurisy; Chronic staphylococcal pleurisy; Subacute staphylococcal pleurisy; Staphylococcal adhesive pleurisy; Staphylococcal double pleurisy; Staphylococcal fibrinous pleurisy; Empyema of lung; Empyema of pleura; loculated empyema; pleural empyema; Chest abscess; Pneumopyothorax; pyopneumothorax; Septic pleurisy; Seropurulent pleurisy; purulent pleurisy; suppurative pleurisy; Tension pyopneumothorax; tension pyothorax
CA45,"Respiratory infections, not elsewhere classified",,,,Upper respiratory tract disorders; Chronic obstructive pulmonary disease; Certain lower respiratory tract diseases,"Respiratory infections, not elsewhere classified; respiratory infections not specified as acute, chronic, lower, or upper; respiratory tract infections not specified as acute, chronic, lower, or upper"
CA60,Pneumoconiosis,,"Pneumoconiosis is a lung disease due to inhalation of minute particles and characterised pathologically by interstitial fibrosis. The different types of pneumoconiosis vary in relation to the types of inhaled particles, often accompanied by certain occupational environments.",,,
CA60.0,Pneumoconiosis due to dust containing silica,,Interstitial lung disease due to inhalation of silica dust. The accumulation of silica/silicates in lung leads to fibrosis and formation of opacities in upper lobes of lungs on chest X-ray.,,with tuberculosis,
CA60.00,Pneumoconiosis due to talc dust,,,,,Pneumoconiosis due to talc dust; fibrosis of lung due to talc; pneumoconiosis due to talc; pulmonary talcosis; talc lung disease; talc pneumoconiosis; talc workers' pneumoconiosis; talcosis
CA60.1,Coal worker pneumoconiosis,,"Coalworker pneumoconiosis, an interstitial lung disease due to inhalation of coal dust. The accumulation of coal in the lung leads to fibrosis and formation of coal macules which are seen on chest X-ray as opacities and fibrosis.",Anthracosilicosis; Anthracosis; Black lung; Coalworker lung,with tuberculosis,Coal worker pneumoconiosis; Anthracosilicosis; Anthracosis; Black lung; CWP - [coalworkers pneumoconiosis]; Coalworker lung; black lung disease; carbon lung; coal miners' lung; coal miners' pneumoconiosis; coal pneumoconiosis; collier's asthma; colliers' anthracosis; colliers' lung; fibrosis of lung with anthracosilicosis; lung anthracosis; lung fibrosis with anthracosis; lung melanosis; melanoedema; miners' asthma; miners' lung; miners' pneumoconiosis; pneumomelanosis
CA60.2,Pneumoconiosis due to mineral fibres including asbestos,,"Asbestosis is pneumoconiosis, an interstitial lung disease due to inhalation of asbestos fibres. The accumulation of fibres in the lung leads to diffuse fibrosis and formation of opacities in lower parts of lungs on chest X-ray. Asbestos bodies may be detected in lungs and sputum.",Asbestosis,Pleural plaque with presence of asbestos; with tuberculosis,Pneumoconiosis due to mineral fibres including asbestos; Asbestosis; amianthosis; asbestos pneumoconiosis; lung fibrosis with asbestosis; pulmonary asbestosis
CA60.3,Pneumoconiosis associated with tuberculosis,,"This is an occupational lung disease and a restrictive lung disease caused by the inhalation of dust, often in mines, associated with a common, and in many cases lethal, infectious disease caused by various strains of mycobacteria, usually Mycobacterium tuberculosis.",,,Pneumoconiosis associated with tuberculosis; pneumoconiosis with tuberculosis; tuberculous pneumoconiosis; Colliers' tuberculosis; Grinders' tuberculosis; Potters' tuberculosis; Sandblasters' tuberculosis; Silicosis with tuberculosis; silicotuberculosis; Stonemasons' tuberculosis
CA60.4,Aluminosis of lung,,Aluminosis is a lung disease caused by the inhalation of dusts of certain aluminium compounds.,,,Aluminosis of lung; aluminosis; fibrosis of lung with aluminosis
CA60.5,Bauxite fibrosis of lung,,,,,Bauxite fibrosis of lung; bauxite fibrosis; bauxite fume pneumoconiosis; bauxite lung; bauxite pneumoconiosis; bauxite pulmonary fibrosis; bauxite workers' disease; bauxite-induced lung fibrosis; corundum smelters' lung; shaver's disease
CA60.6,Berylliosis,,"Chronic beryllium disease also known as berylliosis is an occupational hypersensitivity disorder caused by beryllium exposure at the workplace. It is characterised by non-caseating, non-necrotising granulomata within affected organs, most frequently lung and skin.",,,Berylliosis; beryllium disease; lung fibrosis with berylliosis
CA60.7,Graphite fibrosis of lung,,Graphite fibrosis of lung is the pulmonary damage caused by excessive inhalation of graphite.,,,Graphite fibrosis of lung; fibrosis of lung due to graphite; graphite fibrosis; graphite lung disease; graphite pneumoconiosis; graphitosis
