Code,title,Fully Specified Name,Description,Inclusions,Exclusions,Index Terms
3A21.1,Microangiopathic haemolytic anaemia,,This is a microangiopathic subgroup of haemolytic anaemia (loss of red blood cells through destruction) caused by factors in the small blood vessels. It is identified by the finding of anaemia and schistocytes on microscopy of the blood film.,,,Microangiopathic haemolytic anaemia; Neoplastic microangiopathic haemolytic anaemia
3A21.2,Haemolytic uraemic syndrome,,,,Hereditary haemolytic uraemic syndrome,Haemolytic uraemic syndrome; Gasser syndrome; HUS - [haemolytic uraemic syndrome]; Typical haemolytic uraemic syndrome; Glomerular disorders in haemolytic uraemic syndrome
3A50,Thalassaemias,,"A disease caused by genetically inherited autosomal recessive mutations leading to abnormal production of haemoglobin. This disease is characterised by destruction of red blood cells leading to anaemia and abnormal production of haemoglobin. This disease may present with pallor, jaundice, iron overload, fatigue, or shortness of breath. Confirmation is by identification of mutations through genetic testing.",,,
3A50.0,Alpha thalassaemia,,"Alpha-thalassemia is an inherited haemoglobinopathy characterised by impaired synthesis of alpha-globin chains leading to a variable clinical picture depending on the number of affected alleles, and encompassing the alpha thalassaemia trait, haemoglobin H disease (HbH) and Bart's hydrops fetalis.",,Hydrops fetalis due to haemolytic disease,
3A50.00,Mild alpha thalassaemia diseases,,"A disease caused by genetically inherited factors affecting the alpha chain of the haemoglobin molecule. This disease is characterised by structural abnormalities of the haemoglobin molecule. This disease may present with mild anaemia: pallor, fatigue, shortness of breath. Confirmation is by identification of changes to the alpha chain by genetic testing.",,,Mild alpha thalassaemia diseases; Alpha thalassaemia minor; Mild alpha thalassaemia syndromes; Heterozygous alpha+ thalassaemia (– α/αα) (thalassaemia trait); Heterozygous alpha thalassaemia (––/ααα) (thalassaemia trait); Homozygous alpha+ thalassaemia (– α/– α) (thalassaemia trait); Heterozygous non-deletional alpha thalassaemia (αTα/αα and ααT/αα included)
3A50.01,Thalassaemic alpha-chain variants,,,,,Thalassaemic alpha-chain variants; Haemoglobin Koya Dora; Haemoglobin Pakse; Haemoglobin Seal Rock; Haemoglobin Constant Spring
3A50.02,Haemoglobin H disease (– α/– – included),,Haemoglobin H (HbH) disease is a moderate to severe form of alpha-thalassemia characterised by pronounced microcytic hypochromic haemolytic anaemia.,,,Haemoglobin H disease (– α/– – included); HbH - [haemoglobin H] disease; alpha - /- - or mutational forms of alpha-thalassaemia; alpha thalassaemia intermedia
3A50.03,Hemoglobin Bart's fetalis syndrome,,"Hb Bart's hydrops fetalis (HBFS) is the most severe form of alpha-thalassemia and is almost always lethal. It is characterised by fetal onset of generalised oedema, pleural and pericardial effusions, and severe hypochromic anaemia. 
HBFS can be caused by either homozygous or compound heterozygous alpha0 (alpha zero) thalassaemia, resulting in zero functional alpha haemoglobin genes.",,,Hemoglobin Bart's fetalis syndrome; BHFS - [Bart's hydrops fetalis syndrome]; HBHF - [Hb Bart's hydrops fetalis]; Haemoglobin Bart's disease; Hb Bart's hydrops fetalis; Hb Bart's hydrops fetalis syndrome; alpha thalassaemia hydrops fetalis; alpha-thalassemia major; haemoglobin Bart hydrops fetalis; homozygous alpha0-thalassemia
3A50.1,Alpha thalassaemia related syndromes,,"Alpha-thalassemia-related diseases refers to a group of diseases characterised by alpha-thalassemia and an associated disorder. Three conditions are included in this group: alpha-thalassemia-intellectual deficit syndrome, X-linked (or ATR-X syndrome), alpha-thalassemia-intellectual deficit syndrome and alpha-thalassemia-myelodysplastic disease or ATMDS.",,,Alpha thalassaemia related syndromes; Alpha thalassaemia related diseases; Alpha thalassaemia - X-linked intellectual deficit; X-linked alpha thalassaemia with mental retardation; Alpha thalassaemia - intellectual deficit syndrome; 16pter-p13.3 deletion; Alpha-thalassaemia intellectual disability syndrome linked to chromosome 16
3A50.2,Beta thalassaemia,,"Beta-thalassemia (BT) is a haemoglobinopathy characterised by deficiency (Beta+) or absence (Beta0) of synthesis of the beta globin chains of haemoglobin (Hb). Three main types of BT have been described: minor, intermedia and major with clinical presentation ranging from asymptomatic forms to microcytic anaemia and splenomegaly due to defective erythropoiesis and haemolysis.",Beta thalassaemia minor; Beta thalassaemia intermedia; Dominant beta thalassaemia; Beta thalassaemia major,,Beta thalassaemia; Mediterranean anaemia; Mediterranean disease; beta thalassaemia disease; beta thalassaemia syndrome; Beta thalassaemia minor; Beta thalassaemia carrier; Beta thalassaemia trait; Heterozygous beta-thalassaemia; Beta thalassaemia intermedia; Dominant beta thalassaemia; Beta thalassaemia major; Compound heterozygotes for beta zero or beta+ or delta-beta-thal genes; Cooley anaemia; Homozygous beta thalassaemia; erythroblastic anaemia of childhood; familial erythroblastic anaemia; Haemoglobin E beta thalassaemia; Hb E/beta thalassaemia; Beta-thalassemia-X-linked thrombocytopenia syndrome
3A50.3,"Delta, delta-beta or gamma-delta-beta thalassaemia",,Delta-beta-thalassemia is a form of beta-thalassemia characterised by decreased or absent synthesis of the delta- and beta-globin chains with a compensatory increase in expression of fetal gamma-chain synthesis.,,,"Delta, delta-beta or gamma-delta-beta thalassaemia; Delta thalassaemia; Delta-beta thalassaemia; f thalassaemia; Gamma-delta-beta thalassaemia; Haemoglobin Lepore"
3A50.4,Hereditary persistence of fetal haemoglobin,,Hereditary persistence of fetal haemoglobin (HPFH) associated with beta-thalassaemia is a haemoglobinopathy characterised by high haemoglobin (Hb)F levels and an increased number of fetal-Hb-containing cells. The association of HPFH with beta-thalassaemia mitigates the clinical manifestations which vary from a normal state to beta-thalassaemia intermedia.,,,"Hereditary persistence of fetal haemoglobin; HPFH - [Hereditary persistence of fetal haemoglobin]; fetal haemoglobin; persistence of fetal haemoglobin; persistent haemoglobin F; Hereditary persistence of fetal haemoglobin, deletional; Hereditary persistence of fetal haemoglobin, non-deletional"
3A51,Sickle cell disorders or other haemoglobinopathies,,"Any disorder caused by a HbS mutation in the haemoglobin gene. This disorder is characterised by abnormal rigid sickle-shaped red blood cells decreasing its ability to carry oxygen. This disorder may present with fatigue, shortness of breath, dizziness, headaches, pallor of skin or mucous membranes, and jaundice. This disorder is confirmed by identification of HbS mutation by genetic testing.",,,
3A51.0,Sickle cell trait,,A disease caused by genetic inheritance of one abnormal allele of the haemoglobin gene. This disease does not display the severe symptoms of sickle cell disease that occurs in homozygous individuals. Confirmation is by identification of mutation through genetic testing.,,,Sickle cell trait; AS - [sickle cell trait]; Hb-S - [sickle cell haemoglobin] carrier; HbAS - [heterozygous haemoglobin S]; HbAS - [sickle cell haemoglobin trait]; Sickle-cell disease carrier; haemoglobin a-s genotype; haemoglobin sickle cell trait disorder; heterozygous sickle cell trait; sickle cell haemoglobin trait; sickle-cell heterozygous disorder; sickle-cell trait haemoglobin disease
3A51.1,Sickle cell disease without crisis,,"A disorder caused by a HbS mutation in the haemoglobin gene. This disorder is characterised by abnormal rigid sickle-shaped red blood cells decreasing its ability to carry oxygen. This disorder may present with fatigue, shortness of breath, dizziness, headaches, pallor of skin or mucous membranes, and jaundice. This disorder is confirmed by identification of HbS mutation by genetic testing.",,,Sickle cell disease without crisis; Hb S disease; Hb SS disease; Hb-SS disease without crisis; HbSS without crisis; Herrick anaemia; SCA - [sickle cell anaemia]; SCD - [sickle cell disease]; Sickle-cell anaemia NOS; Sickle-cell anaemia without crisis; haemoglobin S disease; haemoglobin SS disease; hereditary haemoglobinopathy disorder homozygous for haemoglobin S; sickle cell disease NOS; sickle cell disorder; sickle cell syndrome; sickle-cell disorder NOS; sickle-cell haemoglobin disease; sickling disorder due to haemoglobin S; Sickle cell nephropathy; Drepanocythemia; drepanocytic anaemia; drepanocytosis
3A51.2,Sickle cell disease with crisis,,"Sickle cell crisis occurs when the sickle cells block blood flow, thus decreasing oxygen delivery to the tissues. This results in intense to severe pain in the extremities, lower back, abdomen, and chest. A crisis can be brought on by illness, stress, dehydration, exposure to temperature changes or high altitudes.",Hb-SS disease with crisis,,Sickle cell disease with crisis; Hb S disease with mention of crisis; Hb-SS disease with crisis; Hb-SS disease with vaso-occlusive pain; HbSS with crisis; haemoglobin SS disease with crisis; sickle cell crisis; sickle-cell anaemia with crisis; sickle-cell disorder with crisis; vaso-occlusive crisis; Sickle cell disease with crisis with acute chest syndrome; HbSS with crisis with acute chest syndrome; Sickle cell disease with crisis with splenic sequestration; HbSS with crisis with splenic sequestration; Sickle cell disease with crisis with fever; HbSS with crisis with fever
3A51.3,Compound heterozygous sickling disorders without crisis,,"A disease caused by genetic inheritance of two heterozygous recessive alleles of the haemoglobin gene leading to abnormal formation of haemoglobin molecule. This disease is characterised by rigid, sickle shaped red blood cells. Confirmation is by identification of mutations through genetic testing.",Sickle cell Hb-C disease without crisis; Sickle cell thalassaemia without crisis,,"Compound heterozygous sickling disorders without crisis; double heterozygous sickling disorder; Sickle cell Hb-C disease without crisis; Hb S Hb C disease; Hb SC disease; sickle-cell HbC disease; Sickle cell thalassaemia without crisis; double heterozygous for Hb S or beta thalassaemia; haemoglobin s/beta thalassaemia; microdrepanocytosis; sickle-cell beta thalassaemia; sickle-cell thalassaemia; thalassaemia with haemoglobin S disease; Compound HbS or HbC heterozygotes; Compound HbS, HbD-Punjab or Los Angeles heterozygotes; Hb-SD disease; Compound HbS or HbE heterozygotes; Hb SE disease; Compound HbS or O-Arab heterozygotes; Double heterozygous sickling disorders with retinopathy; Glomerular disorders in double heterozygous sickling disorders; Gouty arthropathy in double heterozygous sickling disorders; Compound HbS or beta thalassaemia heterozygotes; Compound HbS and beta thalassaemia heterozygotes including HbS/delta-beta-thal compounds; Hereditary persistence of fetal haemoglobin - sickle cell disease"
3A51.4,Compound heterozygous sickling disorders with crisis,,"Compound heterozygous sickling disorders with crisis may present with acute chest syndrome, splenic sequestration, haemolytic crisis, and pain.",,,Compound heterozygous sickling disorders with crisis; Sickle cell Hb-C disease with crisis; Hb S Hb C disease with crisis; Hb SC disease with crisis; Sickle cell Hb-C disease with crisis with acute chest syndrome; Sickle cell Hb-C disease with crisis with splenic sequestration; Sickle cell Hb-C disease with crisis with fever; Sickle cell thalassaemia with crisis; sickle-cell beta thalassaemia with crisis; thalassaemia Hb S disease; thalassaemia Hb S disease with crisis; Sickle cell thalassaemia with crisis with acute chest syndrome; Sickle cell thalassaemia with crisis with splenic sequestration; Sickle cell thalassaemia with crisis with fever; Sickle-cell thalassaemia with vaso-occlusive pain
3A51.5,Haemoglobin C disease,,"A disease caused by the bi-parental gene that encodes for haemoglobin C. This disease is characterised by abnormal structure of one of the globin chains of the haemoglobin molecule. This disease may present with mild haemolytic anaemia, increased risk for gallstones, enlarged spleen, episodes of joint pain, and increased risk of infection. This disease is confirmed by identification of the haemoglobin C gene by genetic testing.",,Hereditary persistence of fetal haemoglobin,"Haemoglobin C disease; Homozygous HbC carriers; Homozygous (HbC/HbC, HbC/beta-thal and other)"
3A51.6,Haemoglobin D disease,,Haemoglobin D (Hb D) disease is characterised by mild haemolytic anaemia and mild to moderate splenomegaly. Prevalence is unknown. Heterozygous forms of Hb D are clinically silent. Molecular testing can be useful to distinguish Hb D homozygosity from cases of heterozygous Hb D in association with beta-(0) thalassaemia.,,,Haemoglobin D disease; Hb D Los Angeles disease; Hb D Punjab disease; Los Angeles disease; Punjab disease
3A51.7,High affinity haemoglobin,,"A disease caused by determinants arising after birth, in the antenatal period or by genetically inherited factors leading to high oxygen affinity haemoglobin. This disease is characterised by abnormalities in the globin chains that alter the affinity of the haemoglobin molecule for oxygen, affecting the normal loading of oxygen in the lungs and delivery of oxygen to the tissues.",,,High affinity haemoglobin; Haemoglobins with abnormal oxygen affinity
3A51.8,Low affinity haemoglobin,,"A disease caused by determinants arising after birth, in the antenatal period or by genetically inherited factors leading to low oxygen affinity haemoglobin. This disease is characterised by abnormalities in the globin chains that alter the affinity of the haemoglobin molecule for oxygen, affecting the normal loading of oxygen in the lungs and delivery of oxygen to the tissues. This disease may present with fatigue, muscle weakness, loss of appetite, weight loss, diarrhoea, nausea, fast heartbeat or numbness in extremities.",,,Low affinity haemoglobin; Haemoglobins causing cyanosis
3A51.9,Haemoglobin O disease,,"A disease caused by the bi-parental inheritance of the gene that encodes for haemoglobin O. This disease is characterised by abnormal structure of one of the globin chains of the haemoglobin molecule. This disease may present with mild haemolytic anaemia, increased risk for gallstones, enlarged spleen, episodes of joint pain, and increased risk of infection. This disease is confirmed by identification of the haemoglobin O gene by genetic testing.",,,Haemoglobin O disease; Arab disease
3A51.A,Haemoglobin E disease,,"Haemoglobin E disease is characterised by the synthesis of an abnormal haemoglobin called haemoglobin E (HbE), instead of the normal haemoglobin A (HbA). Subjects heterozygous for HbE (AE) have an asymptomatic condition with no clinical relevance, except for the risk of transmitting E/beta thalassemia if the other parent carries beta thalassemia. The severity of these E/beta thalassemia forms is very variable, the clinical picture ranging from that of beta thalassemia minor through to thalassemia intermedia to thalassemia major. Subjects homozygous for HbE (EE) are asymptomatic.",,,Haemoglobin E disease; Homozygous HbE carriers; Compound HbE or other Hb mutant heterozygotes
3A51.B,Haemoglobin C/beta thalassaemia compound heterozygosity,,"Haemoglobin C/beta thalassaemia is a condition resulting from coinheritance of haemoglobin C and beta thalassaemia, both beta globin genes being mutated.",,,Haemoglobin C/beta thalassaemia compound heterozygosity; Compound heterozygosity for haemoglobin C or beta thalassaemia
3A60,Congenital pure red cell aplasia,,"A condition caused by determinants arising during the antenatal period, leading to a change in the formation of erythrocytes. This condition is characterised by maturation arrest occurring in the formation of erythrocytes. This condition may present with severe anaemia. Confirmation is by identification of decreased red blood cell count in a blood sample.",,,
3A60.0,Congenital non-inherited pure red cell aplasia,,"A condition caused by determinates arising during the antenatal period, leading to a change in the formation of erythrocytes. This condition is characterised by maturation arrest occuring in the formation of erythrocytes. This condition may present with severe anaemia. Confirmation is by identification of decreased levels of red blood cells in a blood sample.",,,Congenital non-inherited pure red cell aplasia
3A60.1,Hereditary pure red cell aplasia,,"A condition caused by determinates arising during the antenatal period, leading to a change in the formation of erythrocytes. This condition is characterised by maturation arrest occuring in the formation of erythrocytes. This condition may present with severe anaemia. Confirmation is by identification of decreased red blood cell count in a blood sample.",Blackfan-Diamond anaemia,,Hereditary pure red cell aplasia; Constitutional pure red cell aplasia; Familial hypoplastic anaemia with malformations; Blackfan-Diamond anaemia; Aase syndrome; Aase-Smith 2 syndrome; Aase-Smith II syndrome; Blackfan-Diamond disease; Blackfan-Diamond hypoplastic congenital anaemia; Blackfan-Diamond syndrome
3A61,Acquired pure red cell aplasia,,"This refers to a chronic and acquired type of anaemia affecting the precursors to red blood cells but not to white blood cells. In Pure red cell aplasia (PRCA), the bone marrow ceases to produce red blood cells.",,Aplastic anaemia with paroxysmal nocturnal haemoglobulinuria,
3A61.0,Acute acquired pure red cell aplasia,,"This refers to transient (acute) and acquired type of anaemia affecting the precursors to red blood cells but not to white blood cells. In pure red cell aplasia (PRCA), the bone marrow ceases to produce red blood cells.",,,Acute acquired pure red cell aplasia; Transient acquired pure red cell aplasia; Transient erythroblastopenia of childhood; transient pure red cell aplasia; transient red cell aplasia; transient red cell aplastic anaemia; Pure red cell aplasia due to acute parvovirus B19 infection
3A61.1,Chronic acquired pure red cell aplasia,,"This refers to a chronic and acquired type of anaemia affecting the precursors to red blood cells but not to white blood cells. In pure red cell aplasia (PRCA), the bone marrow ceases to produce red blood cells.",,,Chronic acquired pure red cell aplasia; Adult pure red cell aplasia; chronic pure red cell aplasia; chronic red cell aplasia; chronic red cell aplastic anaemia; primary pure red cell aplasia; primary red cell aplasia; Chronic erythroid dysplasia; Drug-induced pure red cell aplasia; Pure red cell aplasia due to chronic parvirus B19 infection
3A70,Aplastic anaemia,,"A disease caused by determinants arising after birth, in the antenatal period or genetically inherited factors leading to the inability of stem cells to generate new mature cells. This disease is characterised by low levels of red blood cells, white blood cells, and platelets. This disease may present with pallor, fatigue, dizziness, increased risk of infection or increased bruising or bleeding.",Medullary hypoplasia; Panmyelophthisis,,
3A70.0,Congenital aplastic anaemia,,"A disease caused by determinants in the antenatal period leading to the inability of stem cells to generate new mature cells. This disease is characterised by low levels of red blood cells, white blood cells, platelets. This disease may present with pallor, fatigue, dizziness, increased risk of infection or increased bruising or bleeding.",Constitutional medullar aplasia; familial hypoplastic anaemia; Fanconi anaemia,Congenital amegakaryocytic thrombocytopenia,Congenital aplastic anaemia; Constitutional medullar aplasia; congenital or familial hypoplastic anaemia; congenital pancytopenia; constitutional aplastic anaemia; constitutional aplastic anaemia with malformation; constitutional panhaematopenia; constitutional panhemocytopenia; familial hypoplastic anaemia; pancytopenia with malformation; Fanconi anaemia; Fanconi pancytopenia; Fanconi pancytopenia syndrome; Fanconi-ichthyosis-dysmorphism syndrome; Fanconi familial refractory anaemia; Fanconi hypoplastic anaemia; Dyskeratosis congenita; Autosomal dominant dyskeratosis congenita; AD-DKC - [Autosomal dominant dyskeratosis congenita]; Autosomal recessive dyskeratosis congenita; AR-DKC - [Autosomal recessive dyskeratosis congenita]; Hoyeraal-Hreidarsson syndrome; Progressive pancytopenia - immunodeficiency - cerebellar hypoplasia; Shwachman-Diamond syndrome; Congenital lipomatosis of pancreas; WT limb-blood syndrome
3A70.1,Acquired aplastic anaemias,,"A condition occurring secondary to other disorders or via an auto-immune response directed to the bone marrow arising after birth. This disease is characterised by an almost complete absence of hematopoietic stem cells resulting in low levels of red and white blood cells and platelets. This condition may present with fatigue, chronic infections, dizziness, weakness, headaches, and episodes of bleeding, usually in the skin and mucous membranes.",Acquired medullar aplasia,,
3A70.10,Drug-induced aplastic anaemia,,"A disease caused by drug intake. This disease is characterised by inability of stem cells to generate new mature cells leading to low levels of red blood cells, white blood cells, platelets. This disease may present with pallor, fatigue, dizziness, increased risk of infection or increased bruising/bleeding.",,,Drug-induced aplastic anaemia; aplastic anaemia due to drugs; medicament-induced aplastic anaemia; Aplastic anaemia due to cytostatic therapy
3A70.11,Aplastic anaemia due to other external agents,,,,,Aplastic anaemia due to other external agents; aplastic anaemia due to toxic cause; toxic anaemia; toxic aplastic anaemia
3A70.12,Idiopathic aplastic anaemia,,,,,Idiopathic aplastic anaemia; Idiopathic bone marrow failure; idiopathic aplastic anaemia NOS
3A71,Anaemia due to chronic disease,,"A disease caused by chronic diseases such as chronic infection. This disease is characterised by inflammatory responses targeted at red blood cells leading to low levels of red blood cells in the body. This disease may present with pallor, fatigue, or shortness of breath. Confirmation is by identification of low levels of red blood cells in a blood sample.",,,
3A71.0,Anaemia in neoplastic disease,,"A disease caused by chronic neoplastic diseases. This disease is characterised by inflammatory responses targeted at red blood cell leading to low levels of red blood cells in the body. This disease may present with pallor, fatigue, or shortness of breath. Confirmation is by identification of low levels of red blood cells in a blood sample",,,Anaemia in neoplastic disease
3A71.1,Anaemia in chronic infectious diseases,,"A disease caused by chronic infectious diseases leading to decreased levels of red blood cells in the blood. This disease is characterised by a low red blood cell count in the body. This disease may present with pallor, fatigue, or shortness of breath. Confirmation is by identification of low red blood cell count in a blood sample.",,,Anaemia in chronic infectious diseases
3A71.2,Anaemia in chronic kidney disease,,"A disease caused by chronic kidney disease. This disease is characterised by a low red blood cell count in the blood. This disease may present with pallor, fatigue, or shortness of breath. Confirmation is by identification of a low red blood cell count in a blood sample.",,,Anaemia in chronic kidney disease
3A72,Sideroblastic anaemia,,"Sideroblastic anaemias are a group of disorders in which haemoglobin is insufficiently synthesized, because of defective use of iron (although plasmatic iron levels may be normal or elevated). They are said to be sideroblastic because of the presence of ringed sideroblasts in the blood due to accumulated ferritin in mitochondria. Anaemias may be microcytic hypochrome (in thalassemia and hereditary sideroblastic anaemias), or macrocytic (in idiopathic acquired sideroblastic anaemias).",,,
3A72.0,Congenital sideroblastic anaemias,,"A disease caused by determinants arising in the antenatal period leading to the production of ringed sideroblasts; abnormal nucleated erythroblasts. This disease is characterised by the inability to incorporate haemoglobin, which red blood cells need to transport oxygen efficiently. This disease may present with pallor, fatigue, dizziness, and enlarged spleen and liver, heart disease, liver damage, or kidney failure.",,,
3A72.00,Hereditary sideroblastic anaemias,,,"Sex-linked hypochromic sideroblastic anaemia; X-linked sideroblastic anaemia, pyridoxine-responsive; Autosomal recessive sideroblastic anaemia, pyridoxine-refractory",,"Hereditary sideroblastic anaemias; Autosomal recessive sideroblastic anaemia; Sex-linked hypochromic sideroblastic anaemia; familial sex linked hypochromic anaemia; X-linked sideroblastic anaemia, pyridoxine-responsive; Erythroid 5-aminolevulinate synthase deficiency; Autosomal dominant sideroblastic anaemia; Autosomal recessive congenital sideroblastic anaemia; Severe congenital hypochromic anaemia with ringed sideroblasts; Autosomal recessive sideroblastic anaemia, pyridoxine-refractory; Adult-onset autosomal recessive sideroblastic anaemia"
3A72.01,Hereditary syndromic sideroblastic anaemia,,,,,Hereditary syndromic sideroblastic anaemia; X-linked sideroblastic anaemia with ataxia; Pearson syndrome
