Code,title,Fully Specified Name,Description,Inclusions,Exclusions,Index Terms
3B62.00,Alpha-granule diseases,,"A condition caused by determinants arising after birth, in the antenatal period. This condition is characterised by defects in the alpha granules in platelets leading to abnormalities in coagulation mechanisms. This condition may present with prolonged bleeding, epistaxis, menorrhagia, easy bruising, anaemia, fatigue or shortness of breath. Confirmation is by identification of platelet defects in a blood sample.",,,Alpha-granule diseases; Quebec platelet disorder; Factor V Quebec; Gray platelet syndrome
3B62.01,Inherited giant platelet disorder,,"A disease caused by genetically inherited mutations. This disease is characterised by abnormally large platelets, low platelet count and a bleeding tendency. Confirmation is by identification of mutations through genetic testing.",,,Inherited giant platelet disorder; Bernard-Soulier syndrome; Bernard-Soulier thrombopathy; giant platelet syndrome; Mediterranean macrothrombocytopenia; Macrothrombocytopenia with mitral valve insufficiency
3B62.1,Bleeding diathesis due to thromboxane synthesis deficiency,,"A disease caused by thromboxane synthesis deficiency. This disease is characterised by low levels of eicosanoids (lipids), abnormalities in coagulation leading to haemorrhaging. Confirmation is by identification of low levels of eicosanoids in a blood sample.",,,Bleeding diathesis due to thromboxane synthesis deficiency
3B62.2,Isolated thrombocytopenia,,,,,Isolated thrombocytopenia
3B62.3,Dense granule disease,,"A condition caused by determinants arising after birth, in the antenatal period. This condition is characterised by defects in the dense granules in platelets leading to abnormalities in coagulation mechanisms. This condition may present with prolonged bleeding, epistaxis, menorrhagia, easy bruising, anaemia, fatigue or shortness of breath. Confirmation is by identification of platelet defects in a blood sample.",,,Dense granule disease; Isolated delta-storage pool disease; Isolated delta- SPD - [storage pool disease]; Isolated dense SPD - [storage pool disease]; Isolated dense storage pool disease; Familial platelet syndrome with predisposition to acute myelogenous leukaemia
3B62.4,Alpha-delta dense granule deficiency,,"A condition caused by determinants arising after birth, in the antenatal period. This condition is characterised by defects in the alpha delta dense granules in platelets, leading to abnormalities in coagulation mechanisms. This condition may present with prolonged bleeding, epistaxis, menorrhagia, easy bruising, anaemia, fatigue or shortness of breath. Confirmation is by identification of low levels of alpha delta dense granules in a blood sample.",,,Alpha-delta dense granule deficiency; deficient alpha granule syndrome; platelet alpha granule deficiency
3B63,Thrombocytosis,,"A disease caused by essential thrombocytosis or other myelo-proliferative disorders such as chronic myelogenous leukaemia, polycythaemia, myelofibrosis. This disease can also have secondary causes such as inflammation, surgery, hyposplenism, splenectomy, asplenia, iron deficiency anaemia or haemorrhage. This disease is characterised by elevated platelet count in the blood. Confirmation is by identification of increased platelet count in a blood sample.",,,
3B63.0,Congenital thrombocytosis,,"Familial thrombocytosis is a type of thrombocytosis, a sustained elevation of platelet numbers, which affects the platelet/megakaryocyte lineage and may create a tendency for thrombosis and haemorrhage but does not cause myeloproliferation.",Hereditary thrombocytosis; Autosomal dominant thrombocytosis; X-linked thrombocytosis,Essential thrombocythemia,Congenital thrombocytosis; Familial thrombocythaemia; Hereditary thrombocythaemia; Hereditary thrombocytosis; Autosomal dominant thrombocytosis; X-linked thrombocytosis
3B63.1,Acquired thrombocytosis,,"A chronic myeloproliferative neoplasm that involves primarily the megakaryocytic lineage. It is characterised by sustained thrombocytosis in the blood, increased numbers of large, mature megakaryocytes in the bone marrow, and episodes of thrombosis and/or haemorrhage. Progression to a post essential thrombocythaemia myelofibrosis stage or transformation to acute myeloid leukaemia is rarely observed.",Idiopathic haemorrhagic thrombocythaemia,,
3B63.10,Secondary thrombocytosis,,,,,Secondary thrombocytosis
3B64,Thrombocytopenia,,This disease is characterised by decreased levels of platelets within the blood. This disease may present with increased bruising or haemorrhaging. Confirmation is by identification of decreased platelet count in a blood sample.,,,
3B64.0,Congenital thrombocytopenia,,A disease caused by determinants arising during the antenatal period leading to low platelet count. This disease is characterised by decreased levels of platelets within the blood. This disease may present with increased bruising or haemorrhaging. Confirmation is by identification of a decreased platelet count in a blood sample.,,,
3B64.00,Congenital non-inherited thrombocytopenia,,,,,Congenital non-inherited thrombocytopenia; Fetal or neonatal alloimmune thrombocytopenia; FNAIT - [fetal or neonatal alloimmune thrombocytopenia]; NAIT - [neonatal alloimmune thrombocytopenia]; fetal or neonatal thrombocytopenia due to maternal idiopathic thrombocytopenic purpura; Fetal and neonatal thrombocytopenia due to maternal ITP - [idiopathic thrombocytopenic purpura]; Neonatal thrombocytopenia due to maternal idiopathic thrombocytopenic purpura
3B64.01,Hereditary thrombocytopenia,,A disease caused by a genetically inherited mutation leading to decreased platelet count. This disease is characterised by decreased levels of platelets within the blood. This disease may present with increased bruising or haemorrhaging. Confirmation is by identification of decreased platelet count in a blood sample.,,,Hereditary thrombocytopenia; Congenital amegakaryocytic thrombocytopenia; MYH9 macrothrombocytopenia syndromes; MYH9-related disease; May-Hegglin thrombocytopenia; Fechtner syndrome; Epstein syndrome; Sebastian syndrome; Paris-Trousseau thrombocytopenia; Radio-ulnar synostosis - amegakaryocytic thrombocytopenia; ATRUS - [amegakaryocytic thrombocytopenia radioulnar syndrome]
3B64.1,Acquired thrombocytopenia,,"A disease caused by determinants arising after birth, leading to low platelet count. This disease is characterised by low levels of platelets within the blood. This disease may present with increased bruising or haemorrhaging. Confirmation is by identification of decreased platelet count in a blood sample.",,,
3B64.10,Immune thrombocytopenic purpura,,"Immune thrombocytopenic purpura (or immune thrombocytopenia; ITP) is an autoimmune coagulation disorder characterised by isolated thrombocytopenia (a platelet count <100,000/microL), in the absence of any underlying disorder that may be associated with thrombocytopenia.",,,Immune thrombocytopenic purpura; Frank's essential thrombocytopenia; ITP - [idiopathic thrombocytopenia purpura]; Werlhof disease; autoimmune thrombocytopenic purpura; essential thrombocytopenia; haemorrhagic purpura; idiopathic purpura; idiopathic thrombocytopenia; idiopathic thrombocytopenia purpura; idiopathic thrombocytopenic purpura; primary autoimmune thrombocytopenic purpura; purpura haemorrhagica; Immune thrombocytopenic purpura specified as refractory
3B64.11,Secondary thrombocytopenic purpura,,This disease is characterised by a relative decrease in levels of platelets within the blood. This disease may present with increased bruising or haemorrhaging. Confirmation is by identification of decreased platelets in a blood sample.,,,Secondary thrombocytopenic purpura; secondary thrombocytopenia NOS; Secondary thrombocytopenic purpura specified as refractory; Dilutional thrombocytopenia
3B64.12,Drug-induced thrombocytopenic purpura,,"Thrombocytopenic purpura attributable to drug toxicity (e.g. cytotoxic chemotherapeutic or immunosuppressive agents) or to an idiosyncratic drug-associated allergic thrombocytopenia (e.g. quinine, thiazides).",,,"Drug-induced thrombocytopenic purpura; Drug-induced immune thrombocytopenia; medicament-induced immune thrombocytopenia; Drug-induced non-immune thrombocytopenia; Heparin-induced thrombocytopenia; Heparin-induced thrombosis/thrombocytopenia syndrome; Heparin skin necrosis due to immune heparin-induced thrombocytopenia; HITTS - [Heparin-induced thrombocytopenia and thrombosis syndrome]; Heparin-induced thrombocytopenia, Type 1; Heparin-induced thrombocytopenia, Type 2; Drug-induced thrombocytopenic purpura specified as refractory"
3B64.13,Alloimmune thrombocytopenia,,A disease caused by determinants such as a blood transfusion that lead to an immune response to the foreign antigens. This disease is characterised by low levels of platelets in the body due to an immune reactive response to the foreign platelet antigens. This disease may present with increased bruising or haemorrhaging. Confirmation is by identification of decreased platelet count and presence of autoantibodies in a blood sample.,,,Alloimmune thrombocytopenia
3B64.14,Thrombotic thrombocytopenic purpura,,"This condition is idiopathic. This condition is characterised by abnormality of blood coagulation causing extensive microscopic clots to form in the small blood vessels throughout the body resulting in low platelet count. This condition may present with seizures, hemiplegia, paresthesias, visual disturbance, and aphasia or anaemia. Confirmation is by identification of thromboses.",,,Thrombotic thrombocytopenic purpura; Moschcowitz disease; Moschcowitz syndrome; TTP - [thrombotic thrombocytopenic purpura]; Acquired thrombotic thrombocytopenic purpura due to anti-ADAMTS 13 antibodies; Congenital thrombotic thrombocytopenic purpura due to ADAMTS-13 deficiency; Upshaw-Schulman syndrome; congenital thrombocytopaenic purpura; Glomerular disorders in thrombotic thrombocytopenic purpura; Thrombotic thrombocytopenic purpura specified as refractory
3B65,"Thrombotic microangiopathy, not elsewhere classified",,"Thrombotic microangiopathies are microvascular occlusive disorders characterised by systemic or intrarenal aggregation of platelets, thrombocytopenia, and mechanical injury to erythrocytes. Thrombotic thrombocytopenic purpura (TTP) and haemolytic–uremic syndrome (HUS) represent a spectrum of thrombotic microangiopathies. In TTP, systemic microvascular aggregation of platelets causes ischemia in the brain and other organs. In HUS, platelet–fibrin thrombi predominantly occlude the renal circulation.",,,"Thrombotic microangiopathy, not elsewhere classified; Acute intravascular thrombotic microangiopathy; Acute intravascular thrombi microangiopathy; Chronic intravascular thrombotic microangiopathy; Chronic intravascular thrombi microangiopathy"
3B80,Congenital disorders of spleen,,Any condition caused by a failure of the spleen to correctly develop in the antenatal period.,,,Congenital disorders of spleen
3B80.0,Splenomegaly in storage diseases,,"A disease caused by storage diseases; genetically inherited metabolic disorders that result from defects in lysosomal, lipid or glycogen function, of the spleen. This disease is characterised by enlargement of the spleen. This disease may present with abdominal pain, chest pain, pallor, shortness of breath fatigue. Confirmation is through medical imaging.",,,Splenomegaly in storage diseases
3B81,Acquired disorders of spleen,,"Any condition caused by determinants acquired after birth, leading to dysfunction of the spleen.",,,
3B81.0,Tumour-like conditions of spleen,,"Any condition caused by determinants acquired after birth, in the antenatal period or genetically inherited factors, leading to tumour-like conditions of the spleen. Confirmation is through medical imaging.",,,Tumour-like conditions of spleen; Splenic hamartoma; Inflammatory pseudotumour of spleen; Sclerosing angiomatoid nodular transformation; SANT - [Sclerosing angiomatoid nodular transformation]
3B81.1,Postsurgical asplenia,,"A disease caused by underlying diseases, splenectomy or splenic rupture from trauma. This disease is characterised by absence of normal spleen function. This disease may present with increased susceptibility to infection. Confirmation is through medical imaging.",,,Postsurgical asplenia; acquired absence of spleen; postsurgical acquired absence of spleen
3B81.2,Atrophy of spleen,,"A disease caused by determinants arising after birth, during the antenatal period or by genetically inherited factors. This disease is characterised by partial or complete degradation of the spleen. This disease may present with increased susceptibility to infection. Confirmation is through medical imaging.",,,Atrophy of spleen; hyposplenism; splenic atrophy; Hyposplenism due to previous infarction of spleen; Degenerative diseases of the spleen
3B81.3,Nontraumatic laceration or rupture of spleen,,"A disease caused by non-traumatic determinants such as infectious diseases, medical procedures such as colonoscopy, haematological diseases, medications, or pregnancy. This disease is characterised by laceration or rupturing of the spleen leading to lack of function. This disease may present with bleeding and increased susceptibility of infection. Confirmation is through medical imaging.",,,Nontraumatic laceration or rupture of spleen
3B81.4,Splenosis,,A disease caused by determinants arising after birth such as physical trauma or splenectomy . This disease is characterised by autoimplantation of one or more focal deposits of splenic tissue in various compartments of the body. Confirmation is through medical imaging.,,,Splenosis
3B81.5,Splenic cyst or pseudocyst,,,,,
3B81.50,Pseudocyst of spleen,,"A disease caused by determinants arising after birth, during the antenatal period or by genetically inherited factors. This disease is characterised by a noncancerous fluid-filled sac, pseudocysts are like cysts, but lack epithelial or endothelial cells. This disease is often asymptomatic but may present with abdominal pain, nausea and vomiting. Confirmation is through medical imaging.",,,Pseudocyst of spleen
3B81.51,Epithelial cyst of spleen,,,,,Epithelial cyst of spleen
3B81.6,Infarction of spleen,,"A disease caused by determinants such as trauma, infection, or inherited factors leading to a shortage of oxygen in the spleen. This disease is characterised by death of spleen tissue and loss of function. Confirmation is by medical imaging.",,traumatic rupture of spleen,Infarction of spleen; Spleen phlebothrombosis; splenic phlebothrombosis; Necrotising spleen; ischemic splenic necrosis; necrotic spleen; splenic necrosis; Splenic haemorrhage; spleen haemorrhage; Subcapsular splenic haemorrhage
3B81.7,Infection of spleen,,"Any condition of the spleen, caused by an infection with a bacterial, viral, fungal, or parasitic source.",,,
3B81.70,Acute septic splenitis,,,septic spleen,,Acute septic splenitis; septic spleen
3B81.71,Abscess of spleen,,"This is a collection of pus (neutrophils) that has accumulated within a tissue because of an inflammatory process in response to either an infectious process (usually caused by bacteria or parasites) or other foreign materials (e.g., splinters, bullet wounds, or injecting needles), in the spleen.",,,Abscess of spleen; splenic abscess
3B81.8,Torsion of spleen,,A disease caused by abnormal development of splenic suspensory ligaments. This disease is characterised by twisting of the spleen leading to splenic infarction. This disease may present with abdominal pain. Confirmation is through medical imaging.,,,Torsion of spleen
3B81.9,Fibrosis of spleen,,"A disease caused by determinants arising after birth, during the antenatal period or by genetically inherited factors. This disease is characterised by formation of excess fibrous connective tissue leading to partial or complete degradation of the spleen. This disease may present with increased susceptibility to infection. Confirmation is through medical imaging.",,,Fibrosis of spleen; fibrotic spleen
3B81.A,Perisplenitis,,"A disease caused by bacterial or viral infection, parasite infestation, or cysts. This disease is characterised by inflammation of the peritoneal surface of the spleen. This disease may present with abdominal pain, susceptibility to infection and enlargement of the spleen. Confirmation is by identification of infection in a blood sample.",,,Perisplenitis; hyaline perisplenitis
3B81.B,Hypersplenism,,"A disease caused by determinants such as cirrhosis, malaria, tuberculosis or inflammatory disorders leading overactive spleen function. This disease is characterised by the presence of an enlarged spleen. Confirmation is by identification through medical imaging.",,"Splenomegaly, not elsewhere classified; congenital splenomegaly",Hypersplenism; big spleen syndrome; hyperfunction of spleen; hypersplenia; increased splenic activity; spleen metaplasia; splenic metaplasia; Gamna disease; Gandy Nanta disease; Splenic primary panhaematopenia; Myeloid metaplasia; Agnogenic myeloid metaplasia; Myelogenous metaplasia
3B81.C,Chronic congestive splenomegaly,,A form of exaggerated spleen function characterised by splenic enlargement secondary to splenic vein thrombosis and/or portal hypertension,,,Chronic congestive splenomegaly; Spleen hyperaemia; splenic hyperaemia; Opitz disease
