Code,title,Fully Specified Name,Description,Inclusions,Exclusions,Index Terms
MF81,Fibronectin glomerulopathy,,"Fibronectin glomerulopathy is a rare hereditary kidney disease in which fibronectin (FN1) deposits are seen in the mesangium and subendothelial space. The clinical picture is characterised by proteinuria, type IV renal tubular acidosis, microscopic haematuria and hypertension that may lead to end-stage renal failure in the second to sixth decade of life. This disease may be associated with mutations in the FN1 gene.",,,Fibronectin glomerulopathy
MF82,Lipoprotein glomerulopathy,,Characteristic lipoprotein thrombi are found in the glomerulus in this genetically determined disease mainly found in East Asia.,,,Lipoprotein glomerulopathy
MF83,Diabetic glomerular changes,,Diabetic glomerulosclerosis involves diffuse thickening of the basement membrane progressing to diffuse mesangial expansion (diffuse diabetic glomerulosclerosis) with in some cases matrix occupying the capillary lumen to form Kimmelstiel Wilson nodules (nodular glomerulosclerosis),,,Diabetic glomerular changes; Glomerular disorders in diabetes mellitus; diabetic glomerulopathy
MF84,Pauci-immune proliferative glomerulonephritis,,A focal and segmental necrotising glomerulonephritis with no immune deposits (“pauci-immune”). Typical of glomerular involvement in anti-neutrophil cytoplasmic antibody (ANCA) mediated vasculitis – microscopic polyangiitis and Wegener's granulomatosis. Most but not all patients have circulation ANCA when there is active disease.,,,Pauci-immune proliferative glomerulonephritis
MF85,Anti-glomerular basement membrane antibody mediated disease,,"Anti-GBM mediated glomerulonephritis is an aggressive focal and segmental proliferative glomerular disease characterised by linear staining of the glomerular basement membrane for immunoglobulins, particularly IgG and IgM. Crescentic change is often associated and circulating anti-bodies to glomerular basement membrane are found in active disease. The renal syndrome is often acute nephritis with rapid renal functional decline (rapidly progressive nephritis) and if associated with respiratory involvement (haemoptysis, respiratory failure) the couple is termed “Goodpasture's syndrome”.",Goodpasture syndrome,,Anti-glomerular basement membrane antibody mediated disease; Anti-glomerular basement membrane antibody disease; Goodpasture syndrome
MF90,Acetonuria,,Acetonuria is a medical condition in which acetone is present in the urine.,Ketonuria,,Acetonuria; Ketonuria
MF91,Bilirubinuria,,Bilirubinuria means the presence of any bile pigment in the urine.,,,Bilirubinuria; Biliuria; bile pigments in urine; choluria
MF92,Chyluria,,"Chyluria, also called chylous urine, is a medical condition involving the presence of chyle in the urine stream, which results in urine appearing milky white.",,Filarial chyluria,Chyluria; galacturia; lipuria; milky urine; nonfilarial chyluria
MF93,Glycosuria,,,,,Glycosuria; glucosuria; sugar in urine; urinary sugar
MF94,Haemoglobinuria,,"The presence of free haemoglobin in the urine, indicating haemolysis of erythrocytes within the vascular system. After saturating the haemoglobin-binding proteins (haptoglobins), free haemoglobin begins to appear in the urine.",,Marchiafava-Micheli syndrome,Haemoglobinuria; globinuria; haematinuria
MF95,Myoglobinuria,,"Myoglobinuria is the presence of myoglobin in the urine usually as result of rhabdomyolysis. Any process that interferes with the storage or use of energy by muscle cells can lead to myoglobinuria. When excreted into the urine, myoglobin can precipitate, causing tubular obstruction and acute kidney injury. The most common causes of myoglobinuria in adults are trauma, alcohol and drug abuse, usually in relation to muscle necrosis from prolonged immobilization and pressure by the body weight. Prolonged ethanol consumption and seizure activity, similar to excessive physical activity, can produce an imbalance between muscle energy consumption and production, resulting in muscle destruction.",,,Myoglobinuria; myoglobulinuria
MF96,Proteinuria,,"Excessive serum proteins in the urine, such as in renal disease when albumin is the main protein, but also may be due to other proteins such as immunoglobulin light chains in plasma cell dyscrasia such as multiple myeloma.",,Persistent proteinuria or albuminuria,
MF96.0,Orthostatic proteinuria,,A condition characterised by an elevated protein excretion while in the upright position and normal protein excretion in a supine or recumbent position.,,,"Orthostatic proteinuria; benign postural proteinuria; orthostatic albuminuria; postural albuminuria; postural proteinuria; Orthostatic proteinuria, intermittent; Orthostatic proteinuria, persistent"
MF96.1,Bence Jones proteinuria,,A condition characterised by the presence of a monoclonal globulin protein or immunoglobulin light chain (Bence Jones protein) in the urine. Originally detected by precipitating at 56 and dissolving again at 100 degrees centigrade (Henry Bence Jones 1813-1873) they are now detected by urinary electrophoresis or light chain assay.,,,"Bence Jones proteinuria; Bence Jones proteinuria, intermittent; Bence Jones proteinuria, persistent; Bence Jones proteinuria, unknown whether intermittent or persistent"
MF97,Pyuria,,Pyuria is a urinary condition that is characterized by an elevated number of white blood cells in the urine. Doctors define a high number as at least 10 white blood cells per cubic millimeter (mm³) of centrifuged urine. Pyuria can cause the urine to look cloudy or as if it contains pus.,,,"Pyuria; pus cells in urine; pus in urine; Pyuria associated with urinary tract infection; bacterial pyuria; Pyuria associated cause classified elsewhere; Pyuria, unknown cause; sterile pyuria"
MF98,Abnormal levels of serum electrolytes in the urine,,,,,
MF98.0,Hypercalciuria,,,,,Hypercalciuria; Idiopathic hypercalciuria
MF98.1,Hyperkaluria,,,,,Hyperkaluria
MF98.2,Hypermagnesuria,,,,,Hypermagnesuria
MF98.3,Hypocalciuria,,,,,Hypocalciuria
MF98.4,Hypokaluria,,,,,Hypokaluria
MF98.5,Hypomagnesuria,,,,,Hypomagnesuria
MF98.6,Hypophosphaturia,,,,,Hypophosphaturia
MF99,"Elevated urine levels of drugs, medicaments or biological substances",,"Elevated urine levels of drugs, medicaments and biological substances mean that the levels of drugs, medicaments, and biological substances have elevated on the urine examination.",,,"Elevated urine levels of drugs, medicaments or biological substances; Elevated urine levels of 17-ketosteroids; Elevated urine levels of catecholamines; Elevated urine levels of indoleacetic acid; Elevated urine levels of steroids"
MF9A,Abnormal urine levels of substances chiefly nonmedicinal as to source,,,,,Abnormal urine levels of substances chiefly nonmedicinal as to source; Abnormal urine level of heavy metals
MF9B,Abnormal findings on microbiological examination of urine,,,,,Abnormal findings on microbiological examination of urine; Positive culture findings in urine sample NEC
MF9C,Abnormal findings on cytological and histological examination of urine,,,,,Abnormal findings on cytological and histological examination of urine
MG00,Clinical findings on diagnostic imaging of breast,,"Clinical findings on diagnostic imaging of breast is findings on diagnostic imaging of the breast which don't appear in normal status of the body. Diagnostic imaging refers to technologies that doctors use to look inside body for clues about a medical condition. X-rays, CT scans, nuclear medicine scans, MRI scans and ultrasound are all types of diagnostic imaging.",,,Clinical findings on diagnostic imaging of breast
MG01,Clinical findings on diagnostic imaging of urinary organs,,,,hypertrophy of kidney,Clinical findings on diagnostic imaging of urinary organs; abnormal diagnostic imaging of urinary organs; Bladder filling defect; Kidney filling defect; Renal mass; kidney mass; Ureter filling defect; Bladder mass
MG02,Results of kidney function studies,,,Abnormal renal function test,,Results of kidney function studies; Abnormal renal function test; abnormal function studies of kidney; nonspecific abnormal results of function study of kidney
MG20,Cachexia,,"Cachexia is a pathological generalised loss of body mass with reduction of the storage fat deposits, structural fat and musculature that can be accompanied by gradual loss of function of organs.",,Human immunodeficiency virus disease associated with wasting syndrome; Malignant neoplasms of ill-defined or unspecified primary sites; nutritional marasmus,
MG20.0,Malignant cachexia,,,,,Malignant cachexia; cancerous cachexia; tumour cachexia
MG21,Chills,,,,,Chills
MG22,Fatigue,,"A feeling of exhaustion, lethargy, or decreased energy, usually experienced as a weakening or depletion of one's physical or mental resource and characterised by a decreased capacity for work and reduced efficiency in responding to stimuli. Fatigue is normal following a period of exertion, mental or physical, but sometimes may occur in the absence of such exertion as a symptom of health conditions.",General physical deterioration; Lethargy,Chronic fatigue syndrome; Myalgic encephalomyelitis; Postviral fatigue syndrome; pregnancy-related exhaustion and fatigue; Bodily distress disorder; Depressive disorders; Sleep-wake disorders; Bipolar or related disorders; senile fatigue; Combat fatigue; Exhaustion due to exposure; heat exhaustion,Fatigue; General physical deterioration; Lethargy; decline NOS; decreased energy; exhaustion; functional decline; general debilitation; general debility; general decline; lack of vitality; lethargic; prostration; slow decline; weak; weakness NOS; worn out
MG23,Fear of death or dying,,,,,Fear of death or dying
MG24,Fear of disease,,,,Bodily distress disorder; Hypochondriasis,
MG24.0,Fear of cancer,,,,,
MG24.00,Fear of cancer of digestive system,,This refers to worrying about having a cancer of the digestive system.,,,Fear of cancer of digestive system
MG24.01,Fear of breast cancer female,,,,,Fear of breast cancer female
MG24.02,Fear of genital cancer male,,,,,Fear of genital cancer male
MG24.1,Fear of human immunodeficiency virus,,,,,Fear of human immunodeficiency virus; fear of HIV - [human immunodeficiency virus]
MG24.2,Fear of haematological disease,,,,,Fear of haematological disease
MG24.3,Fear of digestive disease,,This is a health anxiety and refers to worrying about having a digestive disease.,,,Fear of digestive disease
MG24.4,Fear of eye disease,,,,,Fear of eye disease
MG24.5,Fear of heart disease,,,,,Fear of heart disease; fear of heart attack
MG24.6,Fear of hypertension,,,,,Fear of hypertension
MG24.7,Fear of cardiovascular disease,,,,,Fear of cardiovascular disease
MG24.8,Fear of musculoskeletal disease,,,,,Fear of musculoskeletal disease
MG24.9,Fear of neurological disease,,,,,Fear of neurological disease
MG24.A,Fear of respiratory disease,,,,,Fear of respiratory disease
MG24.B,"Fear of endocrine, metabolic or nutritional disease",,,,,"Fear of endocrine, metabolic or nutritional disease"
MG24.C,Fear of urinary disease,,,,,Fear of urinary disease
MG24.D,Fear of complications of pregnancy,,,,,Fear of complications of pregnancy
MG24.E,Fear of sexually transmitted disease female,,,,,Fear of sexually transmitted disease female
MG24.F,Fear of female genital or breast disease,,,,,Fear of female genital or breast disease
MG24.G,Fear of sexually transmitted disease male,,,,,Fear of sexually transmitted disease male
MG24.H,Fear of genital disease male,,,,,Fear of genital disease male
MG24.J,Fear of mental disorder,,,,,Fear of mental disorder
MG25,Feeling ill,,,malaise,,Feeling ill; malaise
MG26,Fever of other or unknown origin,,"An abnormal elevation of body temperature of unknown origin, often as a result of a pathologic process.",,fever of unknown origin in newborn; Malignant hyperthermia due to anaesthesia,"Fever of other or unknown origin; FUO - [fever of unknown origin]; Hyperpyrexia NOS; PUO - [pyrexia of unknown origin]; Pyrexia NOS; elevated body temperature; ephemeral fever; febrile; febris; fever; fever NOS; fever, unspecified; feverish; high body temperature; hyperpyrexia; hyperpyrexia of unknown origin; hyperthermia; hyperthermic; increased body temperature; intermittent fever of unknown origin; malignant hyperthermia; pyrexia; raised body temperature; Central fever; Drug-induced fever; drug fever; medicament-induced fever; Acute febrile syndrome; Other specified fever; Fever with chills; Fever with rigors; Persistent fever; persistent pyrexia"
MG27,"Haemorrhage, not elsewhere classified",,Bleeding or escape of blood from a vessel.,,"Obstetric haemorrhage; Haemorrhage or haematoma complicating a procedure, not elsewhere classified; Fetal blood loss; Certain specified neonatal haemorrhages","Haemorrhage, not elsewhere classified; Haemorrhage NOS; arterial haemorrhage; bleeding; extravasation of blood; internal bleeding NOS; ruptured vessel; secondary haemorrhage; Abdomen haemorrhage; abdominal haemorrhage; intra-abdominal bleed; intra-abdominal haemorrhage; Hypopharyngeal haemorrhage; hypopharynx haemorrhage; Retroperitoneum haemorrhage; retroperitoneal haemorrhage; Scalp haemorrhage; Splenic vein rupture; Subdiaphragmatic haemorrhage"
MG28,"Hypothermia, not associated with low environmental temperature",,,,hypothermia NOS; hypothermia low environmental temperature,"Hypothermia, not associated with low environmental temperature; hypopyrexia"
MG29,Oedema,,Abnormal fluid accumulation in tissues or body cavities not coded elsewhere.,,hydrothorax; Ascites; hydrops fetalis NOS; angioneurotic oedema; Cerebral oedema due to birth injury; hereditary oedema; Oedema of larynx; malnutrition; oedema of nasopharynx; oedema of pharynx; Pulmonary oedema,
MG29.0,Localised oedema,,,,,Localised oedema; localised oedema NOS; traumatic oedema
MG29.00,Ankle oedema,,,,,Ankle oedema; ankle swelling
MG29.01,Oedema of legs,,,,,Oedema of legs; lower extremity oedema; oedematous legs
MG29.02,Pitting of lip,,,,,Pitting of lip
MG29.1,Generalised oedema,,,,,Generalised oedema; anasarca
MG29.10,Oedema due to increased capillary pressure,,"Increased capillary pressure increases the leakage of fluid from the vascular compartment to the interstitial tissues, resulting in oedema. Causes include impaired or obstructed venous return (fluid overload, venous thrombosis, right heart failure, venous compression from tumour tissue), increased blood flow (physiological response to heat exposure, arteriovenous malformations, disturbed cutaneous vasomotor control due to drug or autonomic neuropathy), or reduced plasma oncotic pressure due to hypoproteinaemia.",,,Oedema due to increased capillary pressure; Oedema secondary to increased capillary pressure; Gravitational oedema due to venous insufficiency; Gravitational oedema; Gravitational oedema secondary to venous insufficiency; Oedema due to impaired or obstructed venous return; Oedema secondary to impaired or obstructed venous return; Oedema due to increased peripheral blood flow; Oedema secondary to increased peripheral blood flow; Oedema due to disturbed vasomotor control; Oedema secondary to disturbed vasomotor control; Drug-induced dependent oedema
MG29.2,Infectious oedema,,,,,Infectious oedema
MG29.3,Pitting oedema,,,,,Pitting oedema; pitting
MG2A,Ageing associated decline in intrinsic capacity,,,senescence without mention of psychosis,Senile dementia,Ageing associated decline in intrinsic capacity; advanced age; advanced years; age related frailty; ageing; atrophic changes of old age; frail NOS; frail aged; frail elderly; frailty NOS; frailty of old age; general frailty; geriatric frailty; old NOS (deprecated); old age (deprecated); old age atrophy; old age cachexia; old age exhaustion; old age without mention of psychosis; senectus; senescence; senescence without mention of psychosis; senile; senile asthenia; senile atrophy; senile cachexia; senile catabolism; senile change; senile decay; senile degeneration; senile deterioration; senile dysfunction; senile exhaustion; senile failure; senile fatigue; senile infirmity; senile marasmus; senile prostration; senile state; senile weakness; senilis atrophia; senility NOS
MG30,Chronic pain,,"Pain is an unpleasant sensory and emotional experience associated with, or resembling that associated with, actual or potential tissue damage. Chronic pain is pain that persists or recurs for longer than 3 months. Chronic pain is multifactorial: biological, psychological and social factors contribute to the pain syndrome.",,Acute pain,
MG30.0,Chronic primary pain,,"Chronic primary pain is chronic pain in one or more anatomical regions that is characterised by significant emotional distress (anxiety, anger/frustration or depressed mood) or functional disability (interference in daily life activities and reduced participation in social roles). Chronic primary pain is multifactorial: biological, psychological and social factors contribute to the pain syndrome. The diagnosis is appropriate independently of identified biological or psychological contributors unless another diagnosis would better account for the presenting symptoms.",,Acute pain,
MG30.00,Chronic primary visceral pain,,"Chronic primary visceral pain is chronic pain localized in the thoracic, abdominal or pelvic region, and is associated with significant emotional distress or functional disability. The distinct anatomical location is compatible with typical referral pain patterns from specific internal organs. The symptoms are not better explained by a diagnosis of chronic secondary visceral pain. Chronic primary visceral pain is multifactorial: biological, psychological and social factors contribute to the pain syndrome. The diagnosis is appropriate independently of identified biological or psychological contributors unless another diagnosis would better account for the presenting symptoms.",Chronic primary chest pain syndrome; Chronic primary epigastric pain syndrome; Chronic primary bladder pain syndrome; Chronic primary pelvic pain syndrome; Chronic primary abdominal pain syndrome,Chronic abdominal pain NOS; Acute female pelvic pain; Acute female pain; Female pelvic pain NOS,Chronic primary visceral pain; Prostatodynia syndrome (deprecated); Chronic primary chest pain syndrome; chronic noncardiac chest pain; functional chest pain (deprecated); Chronic primary epigastric pain syndrome; EPS - [epigastric pain syndrome]; Chronic primary bladder pain syndrome; BPS/IC - [bladder pain syndrome/Interstitial cystitis]; PBS/IC - [painful bladder syndrome/interstitial cystitis]; chronic interstitial cystitis; painful bladder syndrome; Chronic primary pelvic pain syndrome; chronic pelvic pain syndrome; Chronic pelvic pain in males; Chronic pelvic pain in females; Chronic primary abdominal pain syndrome
MG30.01,Chronic widespread pain,,"Chronic widespread pain (CWP) is diffuse pain in at least 4 of 5 body regions and is associated with significant emotional distress (anxiety, anger/frustration or depressed mood) or functional disability (interference in daily life activities and reduced participation in social roles). CWP is multifactorial: biological, psychological and social factors contribute to the pain syndrome. The diagnosis is appropriate when the pain is not directly attributable to a nociceptive process in these regions and there are features consistent with nociplastic pain and identified psychological and social contributors.",Fibromyalgia syndrome,Acute pain,"Chronic widespread pain; Fibromyalgia syndrome; Fibromyalgia; Fibrositis (deprecated); Fibrositis syndrome (deprecated); Myofascial pain syndrome (deprecated); Fibromyalgia, multiple sites; Fibromyositis; Myofibrositis"
MG30.02,Chronic primary musculoskeletal pain,,"Chronic primary musculoskeletal pain is chronic pain in the muscles, bones, joints or tendons that is characterised by significant emotional distress (anxiety, anger/frustration or depressed mood) or functional disability (interference in daily life activities and reduced participation in social roles). Chronic primary musculoskeletal pain is multifactorial: biological, psychological and social factors contribute to the pain syndrome. The diagnosis is appropriate independently of identified biological or psychological contributors unless another diagnosis would better account for the presenting symptoms. Other chronic musculoskeletal pain diagnoses to be considered are those listed under chronic secondary musculoskeletal pain.",Chronic primary low back pain; Chronic primary cervical pain; Chronic primary thoracic pain; Chronic primary limb pain,Acute pain,Chronic primary musculoskeletal pain; Chronic primary low back pain; chronic LBP - [low back pain]; chronic non-specific LBP - [low back pain] (deprecated); non-specific chronic low back pain; Chronic primary cervical pain; chronic nonspecific neck pain (deprecated); Chronic primary thoracic pain; Chronic primary limb pain
MG30.03,Chronic primary headache or orofacial pain,,"Chronic primary headache or orofacial pain is defined as headache or orofacial pain that occurs on at least 50% of the days during at least 3 months. It is characterised by significant emotional distress (anxiety, anger/frustration or depressed mood) or functional disability (interference in daily life activities, reduced participation in social roles). Chronic primary headache or orofacial pain is multifactorial: biological, psychological and social factors contribute to the pain syndrome. The diagnosis is appropriate independently of identified biological or psychological contributors unless another diagnosis would better account for the presenting symptoms. The duration of pain per day is at least 2 hours.",Chronic primary orofacial pain; Chronic primary temporomandibular disorder pains,Headache disorders,Chronic primary headache or orofacial pain; Chronic primary orofacial pain; Chronic primary temporomandibular disorder pains; Chronic primary temporomandibular joint pain; Chronic primary temporomandibular myofascial pain
MG30.04,Complex regional pain syndrome,,"Complex regional pain syndrome (CRPS) is a chronic pain condition in an extremity with a variable course over time. It is characterized by continuing regional pain (not in a specific nerve territory or dermatome), usually with distal predominance or distal-to-proximal gradient. It typically arises after tissue trauma and is seemingly disproportionate in magnitude or duration to the usual course of pain after such tissue trauma.
CRPS is characterized by signs indicating autonomic and neuro-inflammatory changes in the affected body region varying between patients and over time. Often, CRPS is accompanied by significant emotional distress or functional disability. CRPS is multifactorial.",,,Complex regional pain syndrome; CRPS - [complex regional pain syndrome]; algoneurodystrophy (deprecated); Complex regional pain syndrome type I; CRPS Type I - [complex regional pain syndrome type 1]; Reflex sympathetic dystrophy; Sudeck atrophy; arm-shoulder syndrome; reflex dystrophy; shoulder-hand syndrome; steinbrocker syndrome; sympathetic dystrophy; sympathetic reflex dystrophia; Complex regional pain syndrome type II; CRPS Type II - [complex regional pain syndrome type 2]; Causalgia; causalgia NOS; causalgia syndrome; deafferentation pain
MG30.1,Chronic cancer related pain,,"Chronic cancer-related pain is pain caused by the primary cancer itself or metastases (chronic cancer pain) or its treatment (chronic post-cancer treatment pain). It is distinct from pain caused by co-morbid disease [1-3]. It should be highly probable that the pain is due to cancer or its treatment; if its genesis is vague, consider using codes in the section of Primary pain.",,,
MG30.10,Chronic cancer pain,,"Chronic cancer pain is chronic pain caused by the primary cancer or metastases. It should be highly probable that the pain is due to cancer; if its genesis is vague, consider using codes in the section of chronic primary pain.",Chronic visceral cancer pain; Chronic bone cancer pain; Chronic neuropathic cancer pain,,Chronic cancer pain; chronic malignant pain; chronic metastases pain; chronic neoplasm pain; chronic neoplastic pain; Chronic visceral cancer pain; Chronic bone cancer pain; Chronic neuropathic cancer pain
