Code,title,Fully Specified Name,Description,Inclusions,Exclusions,Index Terms
5A61.40,Acquired central hypothyroidism,,"Central Hypothyroidism is a condition where the thyroid gland produces too little or no thyroid hormone, induced by dysfunction of either hypothalamus or pituitary.",,,Acquired central hypothyroidism; Acquired central hypothyroidism due to pituitary disorders; Acquired central hypothyroidism due to hypothalamic disorders; Acquired central hypothyroidism due to irradiation; Acquired central hypothyroidism due to infiltrative disorders; Acquired central hypothyroidism due to Sheehan syndrome; Acquired central hypothyroidism due to trauma; Acquired central hypothyroidism due to medicaments or other exogenous substances; Acquired central hypothyroidism due to other cause
5A61.41,Congenital central hypothyroidism,,,,,Congenital central hypothyroidism; Congenital central hypothyroidism due to isolated TSH deficiency; congenital hypothyroidism due to thyroid-stimulating hormone beta chain deficiency; isolated TSH deficiency; Congenital central hypothyroidism due to thyrotropin-releasing hormone deficiency; thyrotropin-releasing hormone deficiency; Congenital central hypothyroidism due to resistance to thyrotropin-releasing hormone syndrome; THR - [thyroid hormone resistance] syndrome; resistance to thyrotropin-releasing hormone syndrome; Congenital central hypothyroidism due to deficient transcription factors involved in pituitary development or function; hypothyroidism due to deficient transcription factors involved in pituitary development or function
5A61.5,Central diabetes insipidus,,"Central diabetes insipidus (CDI) is a hypothalamus-pituitary disease characterised by polyuria and polydipsia due to a vasopressin (AVP) deficiency. The condition may be associated with deficient secretion of antidiuretic hormone (ADH) and is most frequently idiopathic (possibly due to autoimmune injury to the ADH-producing cells), or may be induced by trauma, pituitary surgery, or hypoxic or ischaemic encephalopathy.",ADH - [antidiuretic hormone secretion] deficiency,Nephrogenic diabetes insipidus,"Central diabetes insipidus; ADH - [antidiuretic hormone secretion] deficiency; DI - [diabetes insipidus]; antidiuretic hormone hyposecretion; diabetes insipidus; diabetes insipidus secondary to vasopressin deficiency; diabetes mellitus insipidus; familial diabetes insipidus; neurogenic diabetes insipidus; primary central diabetes insipidus; vasopressin deficiency; vasopressin deficiency syndrome; vasopressin hyposecretion; Wolfram syndrome; DIDMOAD - [Diabetes insipidus, diabetes mellitus, optic atrophy, and deafness] syndrome; Diabetes insipidus, diabetes mellitus, optic atrophy, and deafness; Acquired central diabetes insipidus; Acquired central diabetes due to Infiltrative disease; Idiopathic acquired central diabetes insipidus; Traumatic central diabetes insipidus; Non-acquired central diabetes insipidus; Cranial diabetes insipidus; Neurohypophyseal diabetes insipidus"
5A61.6,Oxytocin deficiency,,Isolated oxytocin deficiency or oxytocin deficiency in combination with anterior and/or posterior pituitary deficiencies.,,,Oxytocin deficiency
5A70,Cushing syndrome,,"Cushing syndrome results from excess of corticosteroid hormones in the body due to overstimulation of the adrenal glands by excessive amounts of adrenocorticotropic hormone (ACTH), secreted either by a tumuor of the pituitary gland (Cushing's disease) or by a malignant tumour in the lung or elsewhere. Symptoms include weight gain, reddening of the face and neck, excess growth of body and facial hair, raised blood pressure, loss of mineral from the bones (osteoporosis), raised blood glucose levels, and sometimes mental disturbances.",,,
5A70.0,Pituitary-dependent Cushing disease,,"Pituitary-dependent Cushing disease is caused by a pituitary tumour, generally benign (adenoma) but rarely malignant (carcinoma), which secretes adrenocorticotropin (ACTH) autonomously, leading to hypercortisolism. The condition is associated with increased morbidity and mortality that can be mitigated by treatments that result in sustained endocrine remission. Transsphenoidal pituitary surgery (TSS) remains the mainstay of treatment for this disease but requires considerable neurosurgical expertise and experience in order to optimize patient outcomes.",,,"Pituitary-dependent Cushing disease; ACTH- [adrenocorticotropic hormone] secreting pituitary adenoma; Corticotroph pituitary adenoma; Cushing disease; Cushing syndrome or disease, pituitary-dependent; Cushing's disease; Cushing's syndrome 3; Cushings basophilism; Itsenko disease; Itsenko-Cushing syndrome; Overproduction of pituitary ACTH; Pituitary-dependent hyperadrenocorticism; pituitary ACTH hypersecretion; pituitary basophilism; pituitary-dependent hypercorticalism; suprarenogenic syndrome"
5A70.1,Ectopic ACTH syndrome,,,,,Ectopic ACTH syndrome; Cushing syndrome secondary to ectopic ACTH-secretion; Ectopic Cushing syndrome; ectopic ACTH - [adrenocorticotropic hormone] secretion; ectopic ACTH - [adrenocorticotropic hormone] secretion causing Cushing syndrome; hypercortisolism due to nonpituitary tumour; paraneoplastic Cushing's syndrome
5A70.2,Pseudo-Cushing syndrome,,"This is a condition in which patients display the signs, symptoms, and abnormal hormone levels seen in Cushing's syndrome. However, pseudo-Cushing's syndrome is not caused by a problem with the hypothalamic-pituitary-adrenal axis as Cushing's is; it is an idiopathic condition.",,,Pseudo-Cushing syndrome; Pseudo-Cushing syndrome of other causes; Alcohol-induced pseudo-Cushing syndrome; Cushing pseudosyndrome due to alcohol; alcohol-induced Cushing pseudosyndrome
5A70.3,Nelson syndrome,,,,,Nelson syndrome; Postadrenalectomy Cushing syndrome
5A71,Adrenogenital disorders,,Disorders of the reproductive system resulting from pathologic androgen production secondary to abnormalities in cortisol and/or aldosterone production,,,
5A71.0,"46,XX disorders of sex development induced by androgens of fetal origin",,"This refers to 46,XX disorders of sex development induced by any natural or synthetic compound, usually a steroid hormone, that stimulates or controls the development and maintenance of male characteristics in vertebrates by binding to androgen receptors, of fetal origin.",,,
5A71.00,Glucocorticoid resistance,,"Glucocorticoid resistance is a rare genetic endocrine condition characterised by generalised, partial, target tissue resistance to glucocorticoids. The clinical spectrum of the condition is broad, ranging from asymptomatic to severe cases of hyperandrogenism, fatigue and/or mineralocorticoid excess.",,,Glucocorticoid resistance
5A71.01,Congenital adrenal hyperplasia,,"Congenital adrenal hyperplasia (CAH) refers to a group of conditions associated with either complete (classical form) or partial (non-classical) anomalies in the biosynthesis of adrenal hormones. The condition is characterised by insufficient production of cortisol, or of aldosterone (classical form with salt wasting), associated with overproduction of adrenal androgens. In the classical form, metabolic decompensation (dehydration with hyponatraemia, hyperkalaemia and acidosis associated with mineralocorticoid deficiency, and hypoglycaemia associated with glucocorticoid deficiency) may be life-threatening from the neonatal period onwards. Genital variations may be noted at birth in affected females. Chronic hyperandrogenism may lead to accelerated growth during childhood, but advanced bone maturation may lead to a deficit in final height. Adults tend to be overweight and metabolic disturbances, bone anomalies and fertility problems may also be present. Non-classical forms are associated with later onset, during the peri- or postpubertal period, and manifest with signs of hyperandrogenism (acne, hirsutism, menstrual problems and infertility).",,,"Congenital adrenal hyperplasia; Congenital adrenogenital disorders associated with enzyme deficiency; congenital adrenal cortical hyperplasia; congenital adrenal gland hyperplasia; congenital adrenogenital syndrome; congenital adrenogenitalism; congenital female adrenal pseudohermaphroditism; congenital hyperadrenocorticism; Congenital adrenal hyperplasia due to 11-beta-hydroxylase deficiency; Congenital adrenal hyperplasia due to 17-alpha-hydroxylase deficiency; Congenital adrenal hyperplasia due to 21-hydroxylase deficiency; Congenital adrenal hyperplasia due to 21-hydroxylase deficiency, classic form; Congenital adrenal hyperplasia due to 21-hydroxylase deficiency, salt-losing; Congenital adrenal hyperplasia due to 21-hydroxylase deficiency, classic form, salt wasting; Congenital adrenal hyperplasia due to 21-hydroxylase deficiency, classic form, simple virilizing; Congenital adrenal hyperplasia due to 21-hydroxylase deficiency, non-classic form; Congenital adrenal hyperplasia due to 21-hydroxylase deficiency, non salt-losing; Congenital adrenal hyperplasia due to 3-beta-hydroxysteroid dehydrogenase deficiency; Congenital adrenal hyperplasia due to cytochrome P450 oxidoreductase deficiency; Congenital adrenal hyperplasia due to cytochrome POR deficiency; Congenital adrenal hyperplasia due to side-chain cleavage enzyme deficiency; Congenital lipoid adrenal hyperplasia due to STAR deficiency; Congenital lipoid adrenal hyperplasia due to STAR deficiency, classic form; Congenital lipoid adrenal hyperplasia due to STAR deficiency, nonclassic form"
5A71.1,"46,XX disorders of sex development induced by androgens of maternal origin",,"This refers to 46,XX disorders of sex development induced by any natural or synthetic compound, usually a steroid hormone, that stimulates or controls the development and maintenance of male characteristics in vertebrates by binding to androgen receptors, of maternal origin.",,,"46,XX disorders of sex development induced by androgens of maternal origin; 46,XX DSD of maternal origin; 46,XX androgen-induced disorder of sex development due to maternal adrenal hyperplasia; 46,XX androgen-induced DSD due to maternal adrenal hyperplasia; 46,XX androgen-induced disorder of sex development due to maternal androluteoma; 46,XX androgen-induced DSD due to maternal androluteoma; 46,XX androgen-induced disorders of sex development due to a virilizing maternal ovarian or adrenal tumour; 46,XX androgen-induced disorder of sex development due to maternal adrenal tumour; 46,XX androgen-induced DSD due to maternal adrenal tumour; 46,XX androgen-induced disorder of sex development due to maternal arrhenoblastoma; 46,XX androgen-induced DSD due to maternal arrhenoblastoma; 46,XX androgen-induced disorder of sex development due to maternal Krukenberg tumour; 46,XX androgen-induced DSD due to maternal Krukenberg tumour; 46,XX androgen-induced disorders of sex development of iatrogenic maternal origin; 46,XX androgen-induced DSD of iatrogenic maternal origin; 46,XX disorder of sex development due to synthetic oral progestogen or diethylstilbestrol; 46,XX DSD due to synthetic oral progestogen or diethylstilbestrol; 46,XX disorder of sex development due to testosterone or related steroids; 46,XX DSD due to testosterone or related steroids"
5A72,Hyperaldosteronism,,,,,
5A72.0,Primary hyperaldosteronism,,,,,"Primary hyperaldosteronism; Aldosteronism; Conn syndrome; idiopathic aldosteronism; primary aldosteronism; primary aldosteronism due to adrenal hyperplasia; primary aldosteronism due to bilateral adrenal hyperplasia; Familial hyperaldosteronism; Familial hyperaldosteronism type 1; Dexamethasone sensitive hypertension; FH1 - [Familial hyperaldosteronism type 1]; GRA - [Glucocorticoid-remediable aldosteronism]; Glucocorticoid sensitive hypertension; Glucocorticoid-remediable aldosteronism; Hereditary hyperaldosteronism type 1; Primary hyperaldosteronism, glucocorticoid-sensitive; Familial hyperaldosteronism type 2; FH2 - [Familial hyperaldosteronism type 2]; Familial adrenal adenoma; Hereditary hyperaldosteronism type 2; Primary hyperaldosteronism, glucocorticoid-resistant; Familial hyperaldosteronism type 3; Nonfamilial primary hyperaldosteronism; Nonhereditary primary hyperaldosteronism; Aldosterone-producing adenoma; APA - [aldosterone-producing adenoma]; Aldosterone-secreting adenoma; Conn adenoma; Primary aldosteronism due to Conn adenoma; Aldosterone-producing carcinoma; Pure APAC - [aldosterone-producing adrenocortical carcinoma]; Pure aldosterone-producing adrenocortical carcinoma; Pure aldosterone-secreting adrenocortical carcinoma; Idiopathic hyperaldosteronism; Primary bilateral adrenal hyperplasia; Primary unilateral adrenal hyperplasia; Aldosteronism with hyperplasia of the adrenal cortex"
5A72.1,Secondary hyperaldosteronism,,,,,Secondary hyperaldosteronism; secondary aldosteronism; Juxtaglomerular hyperplasia with secondary aldosteronism
5A73,Hypoaldosteronism,,,,Congenital adrenal hyperplasia,"Hypoaldosteronism; Familial hypoaldosteronism; Aldosterone synthase deficiency; Hereditary hypoaldosteronism; Familial hyperreninaemic hypoaldosteronism type 1; CMO - [Corticosterone methyl-oxidase] deficiency; Corticosterone methyl-oxidase deficiency; FHHA1 - [Familial hyperreninaemic hypoaldosteronism type 1]; Hereditary hyperreninaemic hypoaldosteronism type 1; Familial hyperreninaemic hypoaldosteronism type 1A; Familial hyperreninaemic hypoaldosteronism type 1A [FHHA1A, 18-hydroxylase deficiency]; Familial hyperreninaemic hypoaldosteronism type 1B; Familial hyperreninaemic hypoaldosteronism type 1B [FHHA1B, 18-oxidase deficiency]; Familial hyperreninaemic hypoaldosteronism type 2; FHHA2 - [Familial hyperreninaemic hypoaldosteronism type 2]; Hereditary hyperreninaemic hypoaldosteronism type 2"
5A74,Adrenocortical insufficiency,,"A condition in which the adrenal glands do not produce adequate amounts of steroid hormones, primarily cortisol. It may also include impaired production of aldosterone (a mineralocorticoid), which regulates sodium conservation, potassium secretion, and water retention and also accompanies impaired production of adrenal androgens.",,,
5A74.0,Acquired adrenocortical insufficiency,,"This is a acquired condition in which the adrenal glands do not produce adequate amounts of steroid hormones, primarily cortisol; but may also include impaired production of aldosterone (a mineralocorticoid), which regulates sodium conservation, potassium secretion, and water retention.",,Amyloidosis,Acquired adrenocortical insufficiency; Acquired hypocortisolism; Addison bronzed skin disease; Addison bronzed skin disorder; Addison disease; Addison disease NOS; Addison syndrome; Addisonian melanosis; Addisons NOS; Autoimmune Addison disease; Autoimmune adrenalitis; Chronic acquired adrenal insufficiency; Classic Addison disease; Primary Addison disease; adrenal cortex insufficiency; adrenal melanosis; adrenal melasma; autoimmune adrenal atrophy; bronze disease; noncongenital chronic primary adrenocortical insufficiency; primary adrenal atrophy; primary adrenal capsule atrophy; primary adrenal cortex deficiency; primary adrenal cortex hypofunction; primary adrenal glandular insufficiency; primary adrenal insufficiency; primary adrenocortical deficiency; primary adrenocortical hypofunction; primary corticoadrenal deficiency; primary hypoadrenalism; primary hypoadrenocorticism; primary suprarenal insufficiency; suprarenal melanosis; suprarenal melasma; Drug-induced adrenocortical insufficiency; drug-induced adrenocortical hypofunction; medicament-induced adrenocortical insufficiency; Myopathy in Addison disease; Adrenal cortex atrophy
5A74.1,Adrenal crisis,,Adrenal crisis is a life-threatening condition that indicates severe adrenal insufficiency caused by insufficient levels of cortisol.,,,Adrenal crisis; Acute adrenocortical insufficiency; Addison crisis; Addisonian crisis; Adrenocortical crisis; acute adrenal insufficiency; adrenal collapse; adrenal shock; severe adrenal insufficiency; Interruption of corticosteroid therapy
5A75,Adrenomedullary hyperfunction,,Idiopathic overstimulation of the adrenal medulla resulting in pathologic epinephrine/norepinephrine-mediated sympathetic output,,,"Adrenomedullary hyperfunction; Catecholamine hypersecretion; Hypersecretion of adrenomedullary hormones; Secretion of hormone by pheochromocytoma; adrenaline hypersecretion; adrenomedullary hypersecretion; catecholamine secretion; catecholamine secretion by pheochromocytoma; epinephrine hypersecretion; hyperadrenalism; medulloadrenal hypersecretion; overproduction of catecholamine; Adrenomedullary hyperplasia; Secreting paraganglioma; Von Hippel-Lindau disease; Von Hippel-Lindau syndrome; Phaeochromocytoma; pheochromocytoma, unspecified site"
5A76,Certain specified disorders of adrenal gland,,,,,Certain specified disorders of adrenal gland
5A76.0,Premature adrenarche,,Premature development of pubic and/or axillary hair without central or peripheral precocious puberty. Children show premature clinical and/or laboratory signs of androgen action without estrogen action.,,Central precocious puberty; Congenital adrenal hyperplasia; Peripheral precocious puberty,Premature adrenarche; Premature pubarche
5A80,Ovarian dysfunction,,Pathological processes of the ovary.,,isolated gonadotropin deficiency; Postprocedural ovarian failure,
5A80.0,Clinical hyperandrogenism,,"Presence of hirsutism, acne or androgenic alopecia (scalp hair loss in women)",,,Clinical hyperandrogenism; androgen excess; hypersecretion of ovarian androgen; hypersecretion of ovarian androgen hormone; ovarian dysfunction with androgen excess; Drug-induced androgen excess; Tumoural androgen excess
5A80.1,Polycystic ovary syndrome,,Condition defined by the presence of at least 2 of the following 3 criteria: oligo/anovulation; clinical or biochemical signs of hyperandrogenism; presence of polycystic ovaries as identified by ultrasound.,Sclerocystic ovary syndrome,Polycystic ovary NOS,Polycystic ovary syndrome; PCOS - [polycystic ovary syndrome]; Sclerocystic ovary syndrome; Stein-Leventhal syndrome
5A80.2,Polycystic ovary,,"Ovary with increased size (> 7 mL) and stromal volume, and with increased number of follicles (12 or more measuring 2-9 mm in diameter), that may be present in women with PCOS [polycystic ovary syndrome], but also in women with normal ovulatory function and normal fertility (unilaterally or bilaterally).",,Polycystic ovary syndrome,Polycystic ovary; PCO - [polycystic ovary]; polycystic ovary NOS
5A80.3,Anovulation,,"lack of ovulation in the last 12 months, leading to amenorrhea, irregular or infrequent cycles",,,Anovulation
5A80.4,Oligo-ovulation,,"Oligo-ovulation (less than 4 ovulations in the last 12 months) not related to described categories of endocrine dysfunction. Excludes anovulation related to PCOS, hyperprolactinaemia or amenorrhea.",,,Oligo-ovulation
5A80.5,Diminished ovarian reserve,,"Condition characterised by ovaries with lower number of oocytes than expected for female chronologic age, marked by biochemical abnormalities (increased serum FSH levels, decreased serum AMH levels) and/or ultrasound findings (low antral follicle count) associated with ovarian ageing, reduced response to ovarian stimulation, and female infertility",,,Diminished ovarian reserve
5A81,Testicular dysfunction or testosterone-related disorders,,,,Oligospermia; Azoospermia; isolated gonadotropin deficiency; Klinefelter syndrome; Postprocedural testicular hypofunction,
5A81.0,Testicular hyperfunction,,A hypersecretion of testicular hormones.,,McCune-Albright syndrome,Testicular hyperfunction; Hypersecretion of testicular hormones; hypersecretion of androgen; testicular hypergonadism; Testotoxicosis; Familial gonadotropin-independent male-limited sexual precocity; Idiopathic male luteinising hormone-independent sexual precocity; Male limited precocious puberty; familial testotoxicosis
5A81.1,Testicular hypofunction,,"In pre-puberty, a disorder characterised by atrophied testes and sterility, abnormal height and absence of secondary sex characteristics. In post-puberty, a disorder characterised by depressed sexual function, loss of sex drive and sterility, muscle weakness and osteoporosis (due to loss of the androgen anabolic effect).",,,Testicular hypofunction; 5-alpha-reductase deficiency; 5-alpha-reductase deficiency with male pseudohermaphroditism; Testicular hypogonadism NOS; androgen deficiency; defect of testicular androgen synthesis; deficiency of testicular hormone; eunuchoidism; gonadal insufficiency of testis; hypofunction testicle; male hypogonadism; prepuberal castrate syndrome; testicular hypogonadism; undeveloped testis; Male infertility due to a systemic disease; Male infertility with normal virilization due to a systemic disease; Male infertility with normal virilization due to acquired testicular defects; Defective biosynthesis of testosterone in aged men; Defective biosynthesis of testicular androgen NOS; Testicular hypogonadism in aged men; defective biosynthesis of testicular androgen; deficiency of testosterone biosynthesis; Male infertility associated with autoimmunity; Male infertility with normal virilisation due to acquired testicular defect associated with autoimmunity; Male infertility associated with drug; Drug induced testicular hypofunction; Male infertility with normal virilisation due to acquired testicular defect associated with drug; Male infertility associated with environmental toxin; Male infertility with normal virilisation due to acquired testicular defect associated with environmental toxin; Male infertility associated with mycoplasma infection; Male infertility associated with radiation; Male infertility with normal virilisation due to acquired testicular defect associated with radiation; Male infertility associated with spinal cord injury; Male infertility with normal virilisation due to testicular defect associated with spinal cord injury; Male infertility with normal virilization due to developmental or structural testicular defects; Chromosome Y deletion; Male sterility due to chromosome Y deletion; Partial chromosome Y deletion; Male infertility associated with cryptorchidism; Male infertility with normal virilisation due to developmental or structural testicular defect associated with cryptorchidism; Male infertility associated with varicocele; Male infertility with normal virilisation due to a developmental or structural testicular defect associated with varicocele; Sertoli cell only syndrome
5A90,Disorder of puberty due to oestrogen resistance,,,,,Disorder of puberty due to oestrogen resistance
5A91,Delayed puberty,,"This is when an organism has passed the usual age of onset of puberty with no physical or hormonal signs that it is beginning. Puberty may be delayed for several years and still occur normally, in which case it is considered constitutional delay, a variation of healthy physical development. Delay of puberty may also occur due to malnutrition, many forms of systemic disease, or to defects of the reproductive system (hypogonadism) or the body's responsiveness to sex hormones.",Constitutional delay of puberty; Delayed sexual development,,Delayed puberty; Constitutional delay of puberty; Delayed sexual development; delay in sexual development and/or puberty; delayed menarche; infantile uterus; sexual underdevelopment
5A92,Peripheral precocious puberty,,Precocious puberty without activation of the GnRH-/gonadotropin axis. It includes gonadal tumours with sex hormone production and it may be part of McCune-Albright's syndrome.,Precocious menstruation,Central precocious puberty; Congenital adrenal hyperplasia; female heterosexual precocious pseudopuberty; male isosexual precocious pseudopuberty,Peripheral precocious puberty; Precocious menstruation; Precocious puberty; gonadotrophin-independent familial sexual precocity; gonadotropin-independent familial sexual precocity; precocious menarche; precocious sexual development; premature puberty; pubertas praecox; sexual precocity; sexual precocity NOS; Aromatase excess syndrome
